Date,Type,Action,Symbol,Instrument Type,Description,Value,Quantity,Average Price,Commissions,Fees,Multiplier,Underlying Symbol,Expiration Date,Strike Price,Call or Put,Order #
2021-05-10,Trade,BUY_TO_CLOSE,AAPL  210618C00135000,Equity Option,Bought 1 AAPL 06/18/21 Call 135.00 @ 2.00,-200.0,1.0,-200.0,0.0,-0.13,100.0,AAPL,2021-06-18,135.0,CALL,148272350.0
2021-05-07,Trade,SELL_TO_OPEN,IQ    210618P00015000,Equity Option,Sold 1 IQ 06/18/21 Put 15.00 @ 2.01,201.0,1.0,201.0,-1.0,-0.142,100.0,IQ,2021-06-18,15.0,PUT,148273282.0
2021-05-07,Trade,BUY_TO_CLOSE,IQ    210521P00015000,Equity Option,Bought 1 IQ 05/21/21 Put 15.00 @ 1.73,-173.0,1.0,-173.0,0.0,-0.13,100.0,IQ,2021-05-21,15.0,PUT,148273282.0
2021-05-07,Trade,BUY_TO_CLOSE,EBAY  210618P00055000,Equity Option,Bought 1 EBAY 06/18/21 Put 55.00 @ 0.61,-61.0,1.0,-61.0,0.0,-0.13,100.0,EBAY,2021-06-18,55.0,PUT,148272550.0
2021-05-07,Trade,BUY_TO_CLOSE,./ESM1 EW3K1 210521P4000,Future Option,Bought 1 /ESM1 EW3K1 05/21/21 Put 4000.00 @ 7.25,-362.5,1.0,-362.5,0.0,-0.87,1.0,/ESM1,2021-05-21,4000.0,PUT,148271895.0
2021-05-07,Trade,BUY_TO_CLOSE,PTON  210521C00100000,Equity Option,Bought 1 PTON 05/21/21 Call 100.00 @ 0.67,-67.0,1.0,-67.0,0.0,-0.13,100.0,PTON,2021-05-21,100.0,CALL,148250318.0
2021-05-07,Trade,SELL_TO_OPEN,SPY   210618P00370000,Equity Option,Sold 1 SPY 06/18/21 Put 370.00 @ 1.21,121.0,1.0,121.0,-1.0,-0.142,100.0,SPY,2021-06-18,370.0,PUT,148183828.0
2021-05-07,Trade,SELL_TO_OPEN,SPY   210618P00380000,Equity Option,Sold 1 SPY 06/18/21 Put 380.00 @ 1.69,169.0,1.0,169.0,-1.0,-0.142,100.0,SPY,2021-06-18,380.0,PUT,148183702.0
2021-05-07,Trade,SELL_TO_OPEN,SPY   210618P00390000,Equity Option,Sold 1 SPY 06/18/21 Put 390.00 @ 2.38,238.0,1.0,238.0,-1.0,-0.142,100.0,SPY,2021-06-18,390.0,PUT,148183631.0
2021-05-07,Trade,SELL_TO_OPEN,SPY   210618P00400000,Equity Option,Sold 1 SPY 06/18/21 Put 400.00 @ 3.42,342.0,1.0,342.0,-1.0,-0.142,100.0,SPY,2021-06-18,400.0,PUT,148183560.0
2021-05-05,Trade,SELL_TO_OPEN,PTON  220121C00085000,Equity Option,Sold 1 PTON 01/21/22 Call 85.00 @ 15.85,1585.0,1.0,1585.0,-1.0,-0.142,100.0,PTON,2022-01-21,85.0,CALL,147618153.0
2021-05-05,Trade,BUY_TO_OPEN,PTON  220121C00065000,Equity Option,Bought 2 PTON 01/21/22 Call 65.00 @ 25.55,-5110.0,2.0,-2555.0,-2.0,-0.27,100.0,PTON,2022-01-21,65.0,CALL,147618153.0
2021-05-05,Trade,SELL_TO_OPEN,PTON  210521C00100000,Equity Option,Sold 1 PTON 05/21/21 Call 100.00 @ 2.03,203.0,1.0,203.0,-1.0,-0.142,100.0,PTON,2021-05-21,100.0,CALL,147625440.0
2021-05-05,Trade,SELL_TO_OPEN,TSLA  210618C00900000,Equity Option,Sold 1 TSLA 06/18/21 Call 900.00 @ 3.95,395.0,1.0,395.0,-1.0,-0.142,100.0,TSLA,2021-06-18,900.0,CALL,147442226.0
2021-05-05,Trade,BUY_TO_CLOSE,TSLA  210521C00800000,Equity Option,Bought 1 TSLA 05/21/21 Call 800.00 @ 2.60,-260.0,1.0,-260.0,0.0,-0.13,100.0,TSLA,2021-05-21,800.0,CALL,147442226.0
2021-05-04,Trade,BUY_TO_CLOSE,RIOT  210618C00070000,Equity Option,Bought 1 RIOT 06/18/21 Call 70.00 @ 1.07,-107.0,1.0,-107.0,0.0,-0.13,100.0,RIOT,2021-06-18,70.0,CALL,146226106.0
2021-04-30,Trade,SELL_TO_OPEN,EBAY  210618P00055000,Equity Option,Sold 1 EBAY 06/18/21 Put 55.00 @ 1.80,180.0,1.0,180.0,-1.0,-0.142,100.0,EBAY,2021-06-18,55.0,PUT,146810912.0
2021-04-30,Trade,BUY_TO_CLOSE,EBAY  210521P00055000,Equity Option,Bought 1 EBAY 05/21/21 Put 55.00 @ 1.00,-100.0,1.0,-100.0,0.0,-0.13,100.0,EBAY,2021-05-21,55.0,PUT,146810912.0
2021-04-30,Trade,SELL_TO_OPEN,AAPL  210618C00160000,Equity Option,Sold 1 AAPL 06/18/21 Call 160.00 @ 0.22,22.0,1.0,22.0,-1.0,-0.142,100.0,AAPL,2021-06-18,160.0,CALL,146832262.0
2021-04-30,Trade,BUY_TO_CLOSE,AAPL  210618C00200000,Equity Option,Bought 1 AAPL 06/18/21 Call 200.00 @ 0.05,-5.0,1.0,-5.0,0.0,-0.13,100.0,AAPL,2021-06-18,200.0,CALL,139888999.0
2021-04-29,Trade,BUY_TO_CLOSE,EBAY  210521C00069000,Equity Option,Bought 1 EBAY 05/21/21 Call 69.00 @ 0.04,-4.0,1.0,-4.0,0.0,-0.13,100.0,EBAY,2021-05-21,69.0,CALL,145467645.0
2021-04-28,Trade,SELL_TO_OPEN,RIOT  210618C00070000,Equity Option,Sold 1 RIOT 06/18/21 Call 70.00 @ 2.14,214.0,1.0,214.0,-1.0,-0.142,100.0,RIOT,2021-06-18,70.0,CALL,146225995.0
2021-04-28,Trade,SELL_TO_OPEN,RIOT  210618P00040000,Equity Option,Sold 1 RIOT 06/18/21 Put 40.00 @ 6.51,651.0,1.0,651.0,-1.0,-0.142,100.0,RIOT,2021-06-18,40.0,PUT,146225995.0
2021-04-28,Trade,SELL_TO_OPEN,AAPL  210618C00135000,Equity Option,Sold 1 AAPL 06/18/21 Call 135.00 @ 5.17,517.0,1.0,517.0,-1.0,-0.142,100.0,AAPL,2021-06-18,135.0,CALL,146132542.0
2021-04-28,Trade,BUY_TO_CLOSE,AAPL  210430C00129000,Equity Option,Bought 1 AAPL 04/30/21 Call 129.00 @ 5.56,-556.0,1.0,-556.0,0.0,-0.13,100.0,AAPL,2021-04-30,129.0,CALL,146132542.0
2021-04-27,Trade,SELL_TO_OPEN,TSLA  210521C00800000,Equity Option,Sold 1 TSLA 05/21/21 Call 800.00 @ 8.87,887.0,1.0,887.0,-1.0,-0.142,100.0,TSLA,2021-05-21,800.0,CALL,145880526.0
2021-04-27,Trade,BUY_TO_OPEN,TSLA  220121C00950000,Equity Option,Bought 1 TSLA 01/21/22 Call 950.00 @ 80.87,-8087.0,1.0,-8087.0,-1.0,-0.13,100.0,TSLA,2022-01-21,950.0,CALL,145880526.0
2021-04-27,Trade,SELL_TO_OPEN,TGT   210618C00230000,Equity Option,Sold 1 TGT 06/18/21 Call 230.00 @ 1.53,153.0,1.0,153.0,-1.0,-0.142,100.0,TGT,2021-06-18,230.0,CALL,145922422.0
2021-04-27,Trade,SELL_TO_OPEN,TGT   210618P00180000,Equity Option,Sold 1 TGT 06/18/21 Put 180.00 @ 1.29,129.0,1.0,129.0,-1.0,-0.142,100.0,TGT,2021-06-18,180.0,PUT,145922422.0
2021-04-27,Trade,SELL_TO_CLOSE,TSLA  210521C00800000,Equity Option,Sold 1 TSLA 05/21/21 Call 800.00 @ 9.35,935.0,1.0,935.0,0.0,-0.142,100.0,TSLA,2021-05-21,800.0,CALL,145879304.0
2021-04-27,Trade,BUY_TO_CLOSE,TSLA  220121C00950000,Equity Option,Bought 1 TSLA 01/21/22 Call 950.00 @ 82.35,-8235.0,1.0,-8235.0,0.0,-0.13,100.0,TSLA,2022-01-21,950.0,CALL,145879304.0
2021-04-27,Trade,SELL_TO_OPEN,TSLA  220121C00950000,Equity Option,Sold 1 TSLA 01/21/22 Call 950.00 @ 82.34,8234.0,1.0,8234.0,-1.0,-0.182,100.0,TSLA,2022-01-21,950.0,CALL,145862332.0
2021-04-27,Trade,BUY_TO_OPEN,TSLA  210521C00800000,Equity Option,Bought 1 TSLA 05/21/21 Call 800.00 @ 9.84,-984.0,1.0,-984.0,-1.0,-0.13,100.0,TSLA,2021-05-21,800.0,CALL,145862332.0
2021-04-26,Trade,SELL_TO_OPEN,./ESM1 EW3K1 210521P4000,Future Option,Sold 1 /ESM1 EW3K1 05/21/21 Put 4000.00 @ 23.0,1150.0,1.0,1150.0,-2.5,-0.87,1.0,/ESM1,2021-05-21,4000.0,PUT,145641235.0
2021-04-26,Trade,BUY_TO_CLOSE,MARA  210521P00020000,Equity Option,Bought 1 MARA 05/21/21 Put 20.00 @ 0.38,-38.0,1.0,-38.0,0.0,-0.13,100.0,MARA,2021-05-21,20.0,PUT,144602463.0
2021-04-23,Trade,SELL_TO_OPEN,EBAY  210521C00069000,Equity Option,Sold 1 EBAY 05/21/21 Call 69.00 @ 0.42,42.0,1.0,42.0,-1.0,-0.142,100.0,EBAY,2021-05-21,69.0,CALL,145466869.0
2021-04-23,Trade,SELL_TO_OPEN,EBAY  210521P00055000,Equity Option,Sold 1 EBAY 05/21/21 Put 55.00 @ 0.60,60.0,1.0,60.0,-1.0,-0.142,100.0,EBAY,2021-05-21,55.0,PUT,145466869.0
2021-04-23,Trade,SELL_TO_OPEN,FXI   210618P00045000,Equity Option,Sold 2 FXI 06/18/21 Put 45.00 @ 0.66,132.0,2.0,66.0,-2.0,-0.284,100.0,FXI,2021-06-18,45.0,PUT,145449884.0
2021-04-23,Trade,BUY_TO_CLOSE,FXI   210521P00045000,Equity Option,Bought 2 FXI 05/21/21 Put 45.00 @ 0.26,-52.0,2.0,-26.0,0.0,-0.27,100.0,FXI,2021-05-21,45.0,PUT,141825668.0
2021-04-23,Trade,SELL_TO_OPEN,./ESM1 EW1M1 210604C4310,Future Option,Sold 1 /ESM1 EW1M1 06/04/21 Call 4310.00 @ 20.25,1012.5,1.0,1012.5,-2.5,-0.87,1.0,/ESM1,2021-06-04,4310.0,CALL,145304679.0
2021-04-23,Trade,SELL_TO_OPEN,./ESM1 EW1M1 210604P3935,Future Option,Sold 1 /ESM1 EW1M1 06/04/21 Put 3935.00 @ 30.5,1525.0,1.0,1525.0,-2.5,-0.87,1.0,/ESM1,2021-06-04,3935.0,PUT,145304679.0
2021-04-20,Trade,SELL_TO_OPEN,MARA  210521P00020000,Equity Option,Sold 1 MARA 05/21/21 Put 20.00 @ 0.75,75.0,1.0,75.0,-1.0,-0.142,100.0,MARA,2021-05-21,20.0,PUT,144559834.0
2021-04-19,Trade,SELL_TO_OPEN,FUBO  210618C00030000,Equity Option,Sold 1 FUBO 06/18/21 Call 30.00 @ 0.70,70.0,1.0,70.0,-1.0,-0.142,100.0,FUBO,2021-06-18,30.0,CALL,144271847.0
2021-04-19,Trade,BUY_TO_CLOSE,DIS   210521P00170000,Equity Option,Bought 1 DIS 05/21/21 Put 170.00 @ 1.30,-130.0,1.0,-130.0,0.0,-0.13,100.0,DIS,2021-05-21,170.0,PUT,141376636.0
2021-04-19,Trade,BUY_TO_CLOSE,CCL   210521C00030000,Equity Option,Bought 1 CCL 05/21/21 Call 30.00 @ 0.65,-65.0,1.0,-65.0,0.0,-0.13,100.0,CCL,2021-05-21,30.0,CALL,139889606.0
2021-04-15,Trade,BUY_TO_CLOSE,FUBO  210521C00030000,Equity Option,Bought 1 FUBO 05/21/21 Call 30.00 @ 0.90,-90.0,1.0,-90.0,0.0,-0.13,100.0,FUBO,2021-05-21,30.0,CALL,140203646.0
2021-04-07,Trade,SELL_TO_CLOSE,./ESM1 EW3J1 210416C4300,Future Option,Sold 1 /ESM1 EW3J1 04/16/21 Call 4300.00 @ 0.2,10.0,1.0,10.0,0.0,-0.87,1.0,/ESM1,2021-04-16,4300.0,CALL,142118708.0
2021-04-07,Trade,BUY_TO_CLOSE,./ESM1 EW3J1 210416C4150,Future Option,Bought 1 /ESM1 EW3J1 04/16/21 Call 4150.00 @ 4.9,-245.0,1.0,-245.0,0.0,-0.87,1.0,/ESM1,2021-04-16,4150.0,CALL,142118708.0
2021-04-06,Trade,BUY_TO_OPEN,./ESM1 EW3J1 210416C4300,Future Option,Bought 1 /ESM1 EW3J1 04/16/21 Call 4300.00 @ 0.25,-12.5,1.0,-12.5,-2.5,-0.87,1.0,/ESM1,2021-04-16,4300.0,CALL,141987032.0
2021-04-06,Trade,SELL_TO_OPEN,./ESM1 EW3J1 210416C4150,Future Option,Sold 1 /ESM1 EW3J1 04/16/21 Call 4150.00 @ 6.5,325.0,1.0,325.0,-2.5,-0.87,1.0,/ESM1,2021-04-16,4150.0,CALL,141987032.0
2021-04-06,Trade,SELL_TO_OPEN,IQ    210521P00015000,Equity Option,Sold 1 IQ 05/21/21 Put 15.00 @ 0.75,75.0,1.0,75.0,-1.0,-0.142,100.0,IQ,2021-05-21,15.0,PUT,141960706.0
2021-04-06,Trade,SELL_TO_CLOSE,TWTR  210416P00055000,Equity Option,Sold 1 TWTR 04/16/21 Put 55.00 @ 0.04,4.0,1.0,4.0,0.0,-0.142,100.0,TWTR,2021-04-16,55.0,PUT,141835572.0
2021-04-06,Trade,BUY_TO_CLOSE,TWTR  210416P00065000,Equity Option,Bought 1 TWTR 04/16/21 Put 65.00 @ 1.02,-102.0,1.0,-102.0,0.0,-0.13,100.0,TWTR,2021-04-16,65.0,PUT,141835572.0
2021-04-06,Trade,SELL_TO_OPEN,FXI   210521P00045000,Equity Option,Sold 2 FXI 05/21/21 Put 45.00 @ 0.52,104.0,2.0,52.0,-2.0,-0.284,100.0,FXI,2021-05-21,45.0,PUT,141825541.0
2021-04-06,Trade,BUY_TO_CLOSE,FXI   210430P00045000,Equity Option,Bought 2 FXI 04/30/21 Put 45.00 @ 0.30,-60.0,2.0,-30.0,0.0,-0.27,100.0,FXI,2021-04-30,45.0,PUT,139065929.0
2021-04-06,Trade,BUY_TO_CLOSE,SNAP  210430P00055000,Equity Option,Bought 1 SNAP 04/30/21 Put 55.00 @ 4.15,-415.0,1.0,-415.0,0.0,-0.13,100.0,SNAP,2021-04-30,55.0,PUT,141212940.0
2021-04-01,Trade,SELL_TO_OPEN,DIS   210521P00170000,Equity Option,Sold 1 DIS 05/21/21 Put 170.00 @ 2.55,255.0,1.0,255.0,-1.0,-0.142,100.0,DIS,2021-05-21,170.0,PUT,141376119.0
2021-04-01,Trade,SELL_TO_CLOSE,SPOT  210416P00230000,Equity Option,Sold 1 SPOT 04/16/21 Put 230.00 @ 0.50,50.0,1.0,50.0,0.0,-0.142,100.0,SPOT,2021-04-16,230.0,PUT,139889892.0
2021-04-01,Trade,BUY_TO_CLOSE,SPOT  210416P00250000,Equity Option,Bought 1 SPOT 04/16/21 Put 250.00 @ 1.90,-190.0,1.0,-190.0,0.0,-0.13,100.0,SPOT,2021-04-16,250.0,PUT,139889892.0
2021-03-31,Trade,BUY_TO_CLOSE,./ESM1 EW3K1 210521P3600,Future Option,Bought 1 /ESM1 EW3K1 05/21/21 Put 3600.00 @ 23.5,-1175.0,1.0,-1175.0,0.0,-0.87,1.0,/ESM1,2021-05-21,3600.0,PUT,141018114.0
2021-03-31,Trade,BUY_TO_CLOSE,./ESM1 EWJ1  210430P3560,Future Option,Bought 1 /ESM1 EWJ1 04/30/21 Put 3560.00 @ 10.5,-525.0,1.0,-525.0,0.0,-0.87,1.0,/ESM1,2021-04-30,3560.0,PUT,140809384.0
2021-03-26,Trade,SELL_TO_OPEN,FUBO  210521C00030000,Equity Option,Sold 1 FUBO 05/21/21 Call 30.00 @ 1.78,178.0,1.0,178.0,-1.0,-0.152,100.0,FUBO,2021-05-21,30.0,CALL,140203552.0
2021-03-26,Trade,BUY_TO_CLOSE,FUBO  210416C00030000,Equity Option,Bought 1 FUBO 04/16/21 Call 30.00 @ 0.65,-65.0,1.0,-65.0,0.0,-0.14,100.0,FUBO,2021-04-16,30.0,CALL,139653054.0
2021-03-25,Trade,SELL_TO_OPEN,CCL   210521C00030000,Equity Option,Sold 1 CCL 05/21/21 Call 30.00 @ 1.33,133.0,1.0,133.0,-1.0,-0.152,100.0,CCL,2021-05-21,30.0,CALL,139889551.0
2021-03-25,Trade,BUY_TO_CLOSE,AMD   210416C00085000,Equity Option,Bought 1 AMD 04/16/21 Call 85.00 @ 0.41,-41.0,1.0,-41.0,0.0,-0.14,100.0,AMD,2021-04-16,85.0,CALL,138506635.0
2021-03-24,Trade,SELL_TO_OPEN,FUBO  210416C00030000,Equity Option,Sold 1 FUBO 04/16/21 Call 30.00 @ 1.64,164.0,1.0,164.0,-1.0,-0.152,100.0,FUBO,2021-04-16,30.0,CALL,139652664.0
2021-03-24,Trade,BUY_TO_CLOSE,./ESM1 EWJ1  210430C4220,Future Option,Bought 1 /ESM1 EWJ1 04/30/21 Call 4220.00 @ 2.15,-107.5,1.0,-107.5,0.0,-0.87,1.0,/ESM1,2021-04-30,4220.0,CALL,139641083.0
2021-03-24,Trade,SELL_TO_CLOSE,SPOT  210416C00410000,Equity Option,Sold 1 SPOT 04/16/21 Call 410.00 @ 0.08,8.0,1.0,8.0,0.0,-0.152,100.0,SPOT,2021-04-16,410.0,CALL,139635455.0
2021-03-24,Trade,BUY_TO_CLOSE,SPOT  210416C00390000,Equity Option,Bought 1 SPOT 04/16/21 Call 390.00 @ 0.14,-14.0,1.0,-14.0,0.0,-0.14,100.0,SPOT,2021-04-16,390.0,CALL,139635455.0
2021-03-24,Trade,SELL_TO_CLOSE,TWTR  210416C00090000,Equity Option,Sold 1 TWTR 04/16/21 Call 90.00 @ 0.06,6.0,1.0,6.0,0.0,-0.152,100.0,TWTR,2021-04-16,90.0,CALL,139620339.0
2021-03-24,Trade,BUY_TO_CLOSE,TWTR  210416C00080000,Equity Option,Bought 1 TWTR 04/16/21 Call 80.00 @ 0.17,-17.0,1.0,-17.0,0.0,-0.14,100.0,TWTR,2021-04-16,80.0,CALL,139620339.0
2021-03-24,Trade,BUY_TO_CLOSE,CCL   210618C00027500,Equity Option,Bought 1 CCL 06/18/21 Call 27.50 @ 2.40,-240.0,1.0,-240.0,0.0,-0.14,100.0,CCL,2021-06-18,27.5,CALL,139278022.0
2021-03-24,Trade,SELL_TO_OPEN,./ESM1 EW3K1 210521C4300,Future Option,Sold 1 /ESM1 EW3K1 05/21/21 Call 4300.00 @ 3.5,175.0,1.0,175.0,-2.5,-0.87,1.0,/ESM1,2021-05-21,4300.0,CALL,139532562.0
2021-03-24,Trade,SELL_TO_OPEN,./ESM1 EW3K1 210521P3600,Future Option,Sold 1 /ESM1 EW3K1 05/21/21 Put 3600.00 @ 34.25,1712.5,1.0,1712.5,-2.5,-0.87,1.0,/ESM1,2021-05-21,3600.0,PUT,139532562.0
2021-03-24,Trade,SELL_TO_OPEN,AAPL  210430C00129000,Equity Option,Sold 1 AAPL 04/30/21 Call 129.00 @ 2.22,222.0,1.0,222.0,-1.0,-0.152,100.0,AAPL,2021-04-30,129.0,CALL,139498487.0
2021-03-24,Trade,BUY_TO_CLOSE,AAPL  210416C00127500,Equity Option,Bought 1 AAPL 04/16/21 Call 127.50 @ 1.35,-135.0,1.0,-135.0,0.0,-0.14,100.0,AAPL,2021-04-16,127.5,CALL,138506628.0
2021-03-24,Trade,SELL_TO_OPEN,SNAP  210430P00055000,Equity Option,Sold 1 SNAP 04/30/21 Put 55.00 @ 5.25,525.0,1.0,525.0,-1.0,-0.152,100.0,SNAP,2021-04-30,55.0,PUT,138952875.0
2021-03-23,Trade,SELL_TO_CLOSE,./ESM1 EWJ1  210430C4210,Future Option,Sold 1 /ESM1 EWJ1 04/30/21 Call 4210.00 @ 2.5,125.0,1.0,125.0,0.0,-0.87,1.0,/ESM1,2021-04-30,4210.0,CALL,139400749.0
2021-03-23,Trade,SELL_TO_CLOSE,./ESM1 EWJ1  210430P3550,Future Option,Sold 1 /ESM1 EWJ1 04/30/21 Put 3550.00 @ 19.25,962.5,1.0,962.5,0.0,-0.87,1.0,/ESM1,2021-04-30,3550.0,PUT,139400749.0
2021-03-23,Trade,BUY_TO_CLOSE,./ESM1 EWJ1  210430C4190,Future Option,Bought 1 /ESM1 EWJ1 04/30/21 Call 4190.00 @ 3.25,-162.5,1.0,-162.5,0.0,-0.87,1.0,/ESM1,2021-04-30,4190.0,CALL,139400749.0
2021-03-23,Trade,BUY_TO_CLOSE,./ESM1 EWJ1  210430P3570,Future Option,Bought 1 /ESM1 EWJ1 04/30/21 Put 3570.00 @ 20.75,-1037.5,1.0,-1037.5,0.0,-0.87,1.0,/ESM1,2021-04-30,3570.0,PUT,139400749.0
2021-03-22,Trade,SELL_TO_OPEN,FXI   210430P00045000,Equity Option,Sold 2 FXI 04/30/21 Put 45.00 @ 0.55,110.0,2.0,55.0,-2.0,-0.284,100.0,FXI,2021-04-30,45.0,PUT,139065161.0
2021-03-22,Trade,BUY_TO_CLOSE,SQ    210416P00195000,Equity Option,Bought 1 SQ 04/16/21 Put 195.00 @ 2.33,-233.0,1.0,-233.0,0.0,-0.14,100.0,SQ,2021-04-16,195.0,PUT,138448351.0
2021-03-18,Trade,SELL_TO_OPEN,SQ    210416P00195000,Equity Option,Sold 1 SQ 04/16/21 Put 195.00 @ 4.65,465.0,1.0,465.0,-1.0,-0.152,100.0,SQ,2021-04-16,195.0,PUT,138448121.0
2021-03-18,Trade,SELL_TO_OPEN,./ESM1 EWJ1  210430C4220,Future Option,Sold 1 /ESM1 EWJ1 04/30/21 Call 4220.00 @ 7.5,375.0,1.0,375.0,-2.5,-0.87,1.0,/ESM1,2021-04-30,4220.0,CALL,138323559.0
2021-03-18,Trade,SELL_TO_OPEN,./ESM1 EWJ1  210430P3560,Future Option,Sold 1 /ESM1 EWJ1 04/30/21 Put 3560.00 @ 20.75,1037.5,1.0,1037.5,-2.5,-0.87,1.0,/ESM1,2021-04-30,3560.0,PUT,138323559.0
2021-03-17,Trade,BUY_TO_CLOSE,AAPL  210416C00145000,Equity Option,Bought 1 AAPL 04/16/21 Call 145.00 @ 0.47,-47.0,1.0,-47.0,0.0,-0.14,100.0,AAPL,2021-04-16,145.0,CALL,135049404.0
2021-03-17,Trade,BUY_TO_CLOSE,AAPL  210416P00102500,Equity Option,Bought 1 AAPL 04/16/21 Put 102.50 @ 0.35,-35.0,1.0,-35.0,0.0,-0.14,100.0,AAPL,2021-04-16,102.5,PUT,135049404.0
2021-03-17,Trade,SELL_TO_CLOSE,./ESM1 EW3J1 210416C4300,Future Option,Sold 1 /ESM1 EW3J1 04/16/21 Call 4300.00 @ 1.25,62.5,1.0,62.5,0.0,-0.87,1.0,/ESM1,2021-04-16,4300.0,CALL,137918105.0
2021-03-17,Trade,SELL_TO_CLOSE,./ESM1 EW3J1 210416P3260,Future Option,Sold 1 /ESM1 EW3J1 04/16/21 Put 3260.00 @ 4.75,237.5,1.0,237.5,0.0,-0.87,1.0,/ESM1,2021-04-16,3260.0,PUT,137918105.0
2021-03-17,Trade,BUY_TO_CLOSE,./ESM1 EW3J1 210416C4200,Future Option,Bought 1 /ESM1 EW3J1 04/16/21 Call 4200.00 @ 3.75,-187.5,1.0,-187.5,0.0,-0.87,1.0,/ESM1,2021-04-16,4200.0,CALL,137918105.0
2021-03-17,Trade,BUY_TO_CLOSE,./ESM1 EW3J1 210416P3360,Future Option,Bought 1 /ESM1 EW3J1 04/16/21 Put 3360.00 @ 6.5,-325.0,1.0,-325.0,0.0,-0.87,1.0,/ESM1,2021-04-16,3360.0,PUT,137918105.0
2021-03-16,Trade,SELL_TO_OPEN,CCL   210618C00027500,Equity Option,Sold 1 CCL 06/18/21 Call 27.50 @ 4.87,487.0,1.0,487.0,-1.0,-0.152,100.0,CCL,2021-06-18,27.5,CALL,137766007.0
2021-03-16,Trade,BUY_TO_CLOSE,CCL   210416C00025000,Equity Option,Bought 1 CCL 04/16/21 Call 25.00 @ 4.57,-457.0,1.0,-457.0,0.0,-0.14,100.0,CCL,2021-04-16,25.0,CALL,137766007.0
2021-03-15,Trade,SELL_TO_CLOSE,GME   210326C00260000,Equity Option,Sold 2 GME 03/26/21 Call 260.00 @ 60.80,12160.0,2.0,6080.0,0.0,-0.344,100.0,GME,2021-03-26,260.0,CALL,137563979.0
2021-03-15,Trade,BUY_TO_CLOSE,GME   210326C00250000,Equity Option,Bought 2 GME 03/26/21 Call 250.00 @ 64.20,-12840.0,2.0,-6420.0,0.0,-0.27,100.0,GME,2021-03-26,250.0,CALL,137563979.0
2021-03-15,Trade,SELL_TO_OPEN,AAPL  210618C00200000,Equity Option,Sold 1 AAPL 06/18/21 Call 200.00 @ 0.39,39.0,1.0,39.0,-1.0,-0.152,100.0,AAPL,2021-06-18,200.0,CALL,137482736.0
2021-03-15,Trade,SELL_TO_CLOSE,GME   210326C00230000,Equity Option,Sold 2 GME 03/26/21 Call 230.00 @ 58.55,11710.0,2.0,5855.0,0.0,-0.334,100.0,GME,2021-03-26,230.0,CALL,137428672.0
2021-03-15,Trade,BUY_TO_CLOSE,GME   210326C00220000,Equity Option,Bought 2 GME 03/26/21 Call 220.00 @ 62.55,-12510.0,2.0,-6255.0,0.0,-0.27,100.0,GME,2021-03-26,220.0,CALL,137428672.0
2021-03-11,Trade,BUY_TO_OPEN,./ESM1 EWJ1  210430C4210,Future Option,Bought 1 /ESM1 EWJ1 04/30/21 Call 4210.00 @ 14.0,-700.0,1.0,-700.0,-2.5,-0.87,1.0,/ESM1,2021-04-30,4210.0,CALL,136948956.0
2021-03-11,Trade,BUY_TO_OPEN,./ESM1 EWJ1  210430P3550,Future Option,Bought 1 /ESM1 EWJ1 04/30/21 Put 3550.00 @ 29.5,-1475.0,1.0,-1475.0,-2.5,-0.87,1.0,/ESM1,2021-04-30,3550.0,PUT,136948956.0
2021-03-11,Trade,SELL_TO_OPEN,./ESM1 EWJ1  210430C4190,Future Option,Sold 1 /ESM1 EWJ1 04/30/21 Call 4190.00 @ 16.75,837.5,1.0,837.5,-2.5,-0.87,1.0,/ESM1,2021-04-30,4190.0,CALL,136948956.0
2021-03-11,Trade,SELL_TO_OPEN,./ESM1 EWJ1  210430P3570,Future Option,Sold 1 /ESM1 EWJ1 04/30/21 Put 3570.00 @ 31.15,1557.5,1.0,1557.5,-2.5,-0.87,1.0,/ESM1,2021-04-30,3570.0,PUT,136948956.0
2021-03-11,Trade,BUY_TO_CLOSE,AMD   210416C00085000,Equity Option,Bought 1 AMD 04/16/21 Call 85.00 @ 3.05,-305.0,1.0,-305.0,0.0,-0.14,100.0,AMD,2021-04-16,85.0,CALL,136927274.0
2021-03-11,Trade,SELL_TO_CLOSE,AMD   210416C00082500,Equity Option,Sold 1 AMD 04/16/21 Call 82.50 @ 4.04,404.0,1.0,404.0,0.0,-0.152,100.0,AMD,2021-04-16,82.5,CALL,136927274.0
2021-03-10,Trade,BUY_TO_CLOSE,CCL   210319C00025000,Equity Option,Bought 1 CCL 03/19/21 Call 25.00 @ 2.29,-229.0,1.0,-229.0,0.0,-0.14,100.0,CCL,2021-03-19,25.0,CALL,136683467.0
2021-03-10,Trade,SELL_TO_OPEN,CCL   210416C00025000,Equity Option,Sold 1 CCL 04/16/21 Call 25.00 @ 3.51,351.0,1.0,351.0,-1.0,-0.152,100.0,CCL,2021-04-16,25.0,CALL,136683467.0
2021-03-10,Trade,BUY_TO_OPEN,GME   210326C00230000,Equity Option,Bought 2 GME 03/26/21 Call 230.00 @ 108.52,-21704.0,2.0,-10852.0,-2.0,-0.27,100.0,GME,2021-03-26,230.0,CALL,136659333.0
2021-03-10,Trade,SELL_TO_OPEN,GME   210326C00220000,Equity Option,Sold 2 GME 03/26/21 Call 220.00 @ 112.62,22524.0,2.0,11262.0,-2.0,-0.394,100.0,GME,2021-03-26,220.0,CALL,136659333.0
2021-03-10,Trade,SELL_TO_OPEN,GME   210326C00250000,Equity Option,Sold 2 GME 03/26/21 Call 250.00 @ 103.60,20720.0,2.0,10360.0,-2.0,-0.384,100.0,GME,2021-03-26,250.0,CALL,136603760.0
2021-03-10,Trade,BUY_TO_OPEN,GME   210326C00260000,Equity Option,Bought 2 GME 03/26/21 Call 260.00 @ 100.10,-20020.0,2.0,-10010.0,-2.0,-0.27,100.0,GME,2021-03-26,260.0,CALL,136603760.0
2021-03-10,Trade,SELL_TO_CLOSE,GME   210326C00300000,Equity Option,Sold 1 GME 03/26/21 Call 300.00 @ 31.97,3197.0,1.0,3197.0,0.0,-0.162,100.0,GME,2021-03-26,300.0,CALL,136548962.0
2021-03-10,Trade,BUY_TO_CLOSE,GME   210326C00290000,Equity Option,Bought 1 GME 03/26/21 Call 290.00 @ 34.72,-3472.0,1.0,-3472.0,0.0,-0.14,100.0,GME,2021-03-26,290.0,CALL,136548962.0
2021-03-10,Trade,SELL_TO_CLOSE,GME   210326C00300000,Equity Option,Sold 1 GME 03/26/21 Call 300.00 @ 31.97,3197.0,1.0,3197.0,0.0,-0.162,100.0,GME,2021-03-26,300.0,CALL,136548962.0
2021-03-10,Trade,BUY_TO_CLOSE,GME   210326C00290000,Equity Option,Bought 1 GME 03/26/21 Call 290.00 @ 34.72,-3472.0,1.0,-3472.0,0.0,-0.14,100.0,GME,2021-03-26,290.0,CALL,136548962.0
2021-03-10,Trade,SELL_TO_OPEN,GME   210326C00290000,Equity Option,Sold 2 GME 03/26/21 Call 290.00 @ 127.08,25416.0,2.0,12708.0,-2.0,-0.404,100.0,GME,2021-03-26,290.0,CALL,136527016.0
2021-03-10,Trade,BUY_TO_OPEN,GME   210326C00300000,Equity Option,Bought 2 GME 03/26/21 Call 300.00 @ 123.33,-24666.0,2.0,-12333.0,-2.0,-0.27,100.0,GME,2021-03-26,300.0,CALL,136527016.0
2021-03-10,Trade,SELL_TO_CLOSE,./ESM1 EW3J1 210416C4270,Future Option,Sold 10 /ESM1 EW3J1 04/16/21 Call 4270.00 @ 2.0,1000.0,10.0,100.0,0.0,-8.7,1.0,/ESM1,2021-04-16,4270.0,CALL,136388188.0
2021-03-10,Trade,SELL_TO_CLOSE,./ESM1 EW3J1 210416P3250,Future Option,Sold 10 /ESM1 EW3J1 04/16/21 Put 3250.00 @ 10.75,5375.0,10.0,537.5,0.0,-8.7,1.0,/ESM1,2021-04-16,3250.0,PUT,136388188.0
2021-03-10,Trade,BUY_TO_CLOSE,./ESM1 EW3J1 210416C4220,Future Option,Bought 10 /ESM1 EW3J1 04/16/21 Call 4220.00 @ 3.25,-1625.0,10.0,-162.5,0.0,-8.7,1.0,/ESM1,2021-04-16,4220.0,CALL,136388188.0
2021-03-10,Trade,BUY_TO_CLOSE,./ESM1 EW3J1 210416P3300,Future Option,Bought 10 /ESM1 EW3J1 04/16/21 Put 3300.00 @ 12.5,-6250.0,10.0,-625.0,0.0,-8.7,1.0,/ESM1,2021-04-16,3300.0,PUT,136388188.0
2021-03-09,Trade,SELL_TO_CLOSE,./ESM1 EW3J1 210416P3000,Future Option,Sold 10 /ESM1 EW3J1 04/16/21 Put 3000.00 @ 6.0,3000.0,10.0,300.0,0.0,-8.7,1.0,/ESM1,2021-04-16,3000.0,PUT,136084951.0
2021-03-09,Trade,BUY_TO_CLOSE,./ESM1 EW3J1 210416P3050,Future Option,Bought 10 /ESM1 EW3J1 04/16/21 Put 3050.00 @ 6.75,-3375.0,10.0,-337.5,0.0,-8.7,1.0,/ESM1,2021-04-16,3050.0,PUT,136084951.0
2021-03-08,Trade,SELL_TO_CLOSE,./ESM1 EW1J1 210401C4300,Future Option,Sold 1 /ESM1 EW1J1 04/01/21 Call 4300.00 @ 0.5,25.0,1.0,25.0,0.0,-0.87,1.0,/ESM1,2021-04-01,4300.0,CALL,135819199.0
2021-03-08,Trade,SELL_TO_CLOSE,./ESM1 EW1J1 210401P3300,Future Option,Sold 1 /ESM1 EW1J1 04/01/21 Put 3300.00 @ 7.25,362.5,1.0,362.5,0.0,-0.87,1.0,/ESM1,2021-04-01,3300.0,PUT,135819199.0
2021-03-08,Trade,BUY_TO_CLOSE,./ESM1 EW1J1 210401C4150,Future Option,Bought 1 /ESM1 EW1J1 04/01/21 Call 4150.00 @ 2.0,-100.0,1.0,-100.0,0.0,-0.87,1.0,/ESM1,2021-04-01,4150.0,CALL,135819199.0
2021-03-08,Trade,BUY_TO_CLOSE,./ESM1 EW1J1 210401P3450,Future Option,Bought 1 /ESM1 EW1J1 04/01/21 Put 3450.00 @ 13.25,-662.5,1.0,-662.5,0.0,-0.87,1.0,/ESM1,2021-04-01,3450.0,PUT,135819199.0
2021-03-05,Trade,SELL_TO_CLOSE,PTON  210416P00110000,Equity Option,Sold 2 PTON 04/16/21 Put 110.00 @ 18.03,3606.0,2.0,1803.0,0.0,-0.294,100.0,PTON,2021-04-16,110.0,PUT,135582249.0
2021-03-05,Trade,BUY_TO_CLOSE,PTON  210416P00125000,Equity Option,Bought 2 PTON 04/16/21 Put 125.00 @ 29.93,-5986.0,2.0,-2993.0,0.0,-0.27,100.0,PTON,2021-04-16,125.0,PUT,135582249.0
2021-03-05,Trade,SELL_TO_OPEN,AMD   210416C00085000,Equity Option,Sold 1 AMD 04/16/21 Call 85.00 @ 1.51,151.0,1.0,151.0,-1.0,-0.152,100.0,AMD,2021-04-16,85.0,CALL,135606791.0
2021-03-05,Trade,SELL_TO_OPEN,AMD   210416C00085000,Equity Option,Sold 1 AMD 04/16/21 Call 85.00 @ 1.50,150.0,1.0,150.0,-1.0,-0.152,100.0,AMD,2021-04-16,85.0,CALL,135606791.0
2021-03-05,Trade,BUY_TO_OPEN,AMD   210416C00082500,Equity Option,Bought 1 AMD 04/16/21 Call 82.50 @ 2.04,-204.0,1.0,-204.0,-1.0,-0.14,100.0,AMD,2021-04-16,82.5,CALL,135606791.0
2021-03-05,Trade,SELL_TO_OPEN,AAPL  210416C00127500,Equity Option,Sold 1 AAPL 04/16/21 Call 127.50 @ 2.70,270.0,1.0,270.0,-1.0,-0.152,100.0,AAPL,2021-04-16,127.5,CALL,135549552.0
2021-03-05,Trade,SELL_TO_CLOSE,PYPL  210416C00270000,Equity Option,Sold 1 PYPL 04/16/21 Call 270.00 @ 2.60,260.0,1.0,260.0,0.0,-0.152,100.0,PYPL,2021-04-16,270.0,CALL,135548410.0
2021-03-05,Trade,BUY_TO_CLOSE,AAPL  210401C00131000,Equity Option,Bought 2 AAPL 04/01/21 Call 131.00 @ 1.14,-228.0,2.0,-114.0,0.0,-0.27,100.0,AAPL,2021-04-01,131.0,CALL,132918827.0
2021-03-05,Trade,BUY_TO_CLOSE,PYPL  210401C00275000,Equity Option,Bought 1 PYPL 04/01/21 Call 275.00 @ 1.25,-125.0,1.0,-125.0,0.0,-0.14,100.0,PYPL,2021-04-01,275.0,CALL,135283167.0
2021-03-04,Trade,SELL_TO_CLOSE,TWTR  210416C00110000,Equity Option,Sold 1 TWTR 04/16/21 Call 110.00 @ 0.10,10.0,1.0,10.0,0.0,-0.152,100.0,TWTR,2021-04-16,110.0,CALL,135342077.0
2021-03-04,Trade,SELL_TO_OPEN,TWTR  210416C00080000,Equity Option,Sold 1 TWTR 04/16/21 Call 80.00 @ 1.23,123.0,1.0,123.0,-1.0,-0.152,100.0,TWTR,2021-04-16,80.0,CALL,135342077.0
2021-03-04,Trade,BUY_TO_CLOSE,TWTR  210416C00100000,Equity Option,Bought 1 TWTR 04/16/21 Call 100.00 @ 0.21,-21.0,1.0,-21.0,0.0,-0.14,100.0,TWTR,2021-04-16,100.0,CALL,135342077.0
2021-03-04,Trade,BUY_TO_OPEN,TWTR  210416C00090000,Equity Option,Bought 1 TWTR 04/16/21 Call 90.00 @ 0.47,-47.0,1.0,-47.0,-1.0,-0.14,100.0,TWTR,2021-04-16,90.0,CALL,135342077.0
2021-03-04,Trade,SELL_TO_OPEN,PYPL  210401C00275000,Equity Option,Sold 1 PYPL 04/01/21 Call 275.00 @ 2.50,250.0,1.0,250.0,-1.0,-0.152,100.0,PYPL,2021-04-01,275.0,CALL,135282229.0
2021-03-04,Trade,BUY_TO_CLOSE,PYPL  210326C00275000,Equity Option,Bought 1 PYPL 03/26/21 Call 275.00 @ 1.93,-193.0,1.0,-193.0,0.0,-0.14,100.0,PYPL,2021-03-26,275.0,CALL,135177266.0
2021-03-03,Trade,SELL_TO_CLOSE,./ESM1 EWH1  210331C4090,Future Option,Sold 1 /ESM1 EWH1 03/31/21 Call 4090.00 @ 3.5,175.0,1.0,175.0,0.0,-0.87,1.0,/ESM1,2021-03-31,4090.0,CALL,135059669.0
2021-03-03,Trade,BUY_TO_CLOSE,./ESM1 EWH1  210331C4040,Future Option,Bought 1 /ESM1 EWH1 03/31/21 Call 4040.00 @ 6.5,-325.0,1.0,-325.0,0.0,-0.87,1.0,/ESM1,2021-03-31,4040.0,CALL,135059669.0
2021-03-03,Trade,SELL_TO_OPEN,AAPL  210416P00102500,Equity Option,Sold 1 AAPL 04/16/21 Put 102.50 @ 1.00,100.0,1.0,100.0,-1.0,-0.152,100.0,AAPL,2021-04-16,102.5,PUT,135044312.0
2021-03-03,Trade,SELL_TO_OPEN,AAPL  210416C00145000,Equity Option,Sold 1 AAPL 04/16/21 Call 145.00 @ 0.64,64.0,1.0,64.0,-1.0,-0.152,100.0,AAPL,2021-04-16,145.0,CALL,135044312.0
2021-03-03,Trade,SELL_TO_OPEN,PYPL  210326C00275000,Equity Option,Sold 1 PYPL 03/26/21 Call 275.00 @ 3.85,385.0,1.0,385.0,-1.0,-0.152,100.0,PYPL,2021-03-26,275.0,CALL,135006422.0
2021-03-03,Trade,BUY_TO_CLOSE,PYPL  210319C00272500,Equity Option,Bought 1 PYPL 03/19/21 Call 272.50 @ 3.05,-305.0,1.0,-305.0,0.0,-0.14,100.0,PYPL,2021-03-19,272.5,CALL,132966162.0
2021-03-03,Trade,BUY_TO_OPEN,./ESM1 EW3J1 210416P3000,Future Option,Bought 10 /ESM1 EW3J1 04/16/21 Put 3000.00 @ 10.0,-5000.0,10.0,-500.0,-25.0,-8.7,1.0,/ESM1,2021-04-16,3000.0,PUT,134980756.0
2021-03-03,Trade,SELL_TO_OPEN,./ESM1 EW3J1 210416P3050,Future Option,Sold 10 /ESM1 EW3J1 04/16/21 Put 3050.00 @ 11.25,5625.0,10.0,562.5,-25.0,-8.7,1.0,/ESM1,2021-04-16,3050.0,PUT,134980756.0
2021-03-03,Trade,SELL_TO_CLOSE,./ESM1 EWH1  210331C4170,Future Option,Sold 1 /ESM1 EWH1 03/31/21 Call 4170.00 @ 2.25,112.5,1.0,112.5,0.0,-0.87,1.0,/ESM1,2021-03-31,4170.0,CALL,134743487.0
2021-03-03,Trade,SELL_TO_CLOSE,./ESM1 EWH1  210331P3500,Future Option,Sold 1 /ESM1 EWH1 03/31/21 Put 3500.00 @ 16.75,837.5,1.0,837.5,0.0,-0.87,1.0,/ESM1,2021-03-31,3500.0,PUT,134743487.0
2021-03-03,Trade,BUY_TO_CLOSE,./ESM1 EWH1  210331C4120,Future Option,Bought 1 /ESM1 EWH1 03/31/21 Call 4120.00 @ 4.0,-200.0,1.0,-200.0,0.0,-0.87,1.0,/ESM1,2021-03-31,4120.0,CALL,134743487.0
2021-03-03,Trade,BUY_TO_CLOSE,./ESM1 EWH1  210331P3550,Future Option,Bought 1 /ESM1 EWH1 03/31/21 Put 3550.00 @ 20.5,-1025.0,1.0,-1025.0,0.0,-0.87,1.0,/ESM1,2021-03-31,3550.0,PUT,134743487.0
2021-03-03,Trade,BUY_TO_OPEN,./ESM1 EW3J1 210416C4270,Future Option,Bought 5 /ESM1 EW3J1 04/16/21 Call 4270.00 @ 2.65,-662.5,5.0,-132.5,-12.5,-4.35,1.0,/ESM1,2021-04-16,4270.0,CALL,134748974.0
2021-03-03,Trade,BUY_TO_OPEN,./ESM1 EW3J1 210416P3250,Future Option,Bought 5 /ESM1 EW3J1 04/16/21 Put 3250.00 @ 15.3,-3825.0,5.0,-765.0,-12.5,-4.35,1.0,/ESM1,2021-04-16,3250.0,PUT,134748974.0
2021-03-03,Trade,SELL_TO_OPEN,./ESM1 EW3J1 210416C4220,Future Option,Sold 5 /ESM1 EW3J1 04/16/21 Call 4220.00 @ 4.15,1037.5,5.0,207.5,-12.5,-4.35,1.0,/ESM1,2021-04-16,4220.0,CALL,134748974.0
2021-03-03,Trade,SELL_TO_OPEN,./ESM1 EW3J1 210416P3300,Future Option,Sold 5 /ESM1 EW3J1 04/16/21 Put 3300.00 @ 17.45,4362.5,5.0,872.5,-12.5,-4.35,1.0,/ESM1,2021-04-16,3300.0,PUT,134748974.0
2021-03-03,Trade,BUY_TO_OPEN,./ESM1 EW3J1 210416C4270,Future Option,Bought 5 /ESM1 EW3J1 04/16/21 Call 4270.00 @ 2.6,-650.0,5.0,-130.0,-12.5,-4.35,1.0,/ESM1,2021-04-16,4270.0,CALL,134748917.0
2021-03-03,Trade,BUY_TO_OPEN,./ESM1 EW3J1 210416P3250,Future Option,Bought 5 /ESM1 EW3J1 04/16/21 Put 3250.00 @ 15.25,-3812.5,5.0,-762.5,-12.5,-4.35,1.0,/ESM1,2021-04-16,3250.0,PUT,134748917.0
2021-03-03,Trade,SELL_TO_OPEN,./ESM1 EW3J1 210416C4220,Future Option,Sold 5 /ESM1 EW3J1 04/16/21 Call 4220.00 @ 4.2,1050.0,5.0,210.0,-12.5,-4.35,1.0,/ESM1,2021-04-16,4220.0,CALL,134748917.0
2021-03-03,Trade,SELL_TO_OPEN,./ESM1 EW3J1 210416P3300,Future Option,Sold 5 /ESM1 EW3J1 04/16/21 Put 3300.00 @ 17.35,4337.5,5.0,867.5,-12.5,-4.35,1.0,/ESM1,2021-04-16,3300.0,PUT,134748917.0
2021-03-02,Trade,SELL_TO_CLOSE,PLTR  210319C00034000,Equity Option,Sold 1 PLTR 03/19/21 Call 34.00 @ 0.27,27.0,1.0,27.0,0.0,-0.152,100.0,PLTR,2021-03-19,34.0,CALL,134599679.0
2021-03-02,Trade,SELL_TO_CLOSE,PLTR  210319C00034000,Equity Option,Sold 1 PLTR 03/19/21 Call 34.00 @ 0.27,27.0,1.0,27.0,0.0,-0.152,100.0,PLTR,2021-03-19,34.0,CALL,134599679.0
2021-03-02,Trade,SELL_TO_CLOSE,PLTR  210319C00034000,Equity Option,Sold 2 PLTR 03/19/21 Call 34.00 @ 0.27,54.0,2.0,27.0,0.0,-0.284,100.0,PLTR,2021-03-19,34.0,CALL,134599679.0
2021-03-02,Trade,BUY_TO_CLOSE,PLTR  210305C00026500,Equity Option,Bought 2 PLTR 03/05/21 Call 26.50 @ 0.27,-54.0,2.0,-27.0,0.0,-0.27,100.0,PLTR,2021-03-05,26.5,CALL,134060614.0
2021-03-02,Trade,BUY_TO_CLOSE,PLTR  210305C00026500,Equity Option,Bought 2 PLTR 03/05/21 Call 26.50 @ 0.27,-54.0,2.0,-27.0,0.0,-0.27,100.0,PLTR,2021-03-05,26.5,CALL,134060614.0
2021-03-02,Trade,SELL_TO_CLOSE,NIO   210305C00060000,Equity Option,Sold 1 NIO 03/05/21 Call 60.00 @ 0.10,10.0,1.0,10.0,0.0,-0.152,100.0,NIO,2021-03-05,60.0,CALL,134360936.0
2021-03-02,Trade,SELL_TO_CLOSE,NIO   210305P00037000,Equity Option,Sold 1 NIO 03/05/21 Put 37.00 @ 0.08,8.0,1.0,8.0,0.0,-0.152,100.0,NIO,2021-03-05,37.0,PUT,134360936.0
2021-03-02,Trade,BUY_TO_CLOSE,NIO   210305P00041000,Equity Option,Bought 1 NIO 03/05/21 Put 41.00 @ 0.38,-38.0,1.0,-38.0,0.0,-0.14,100.0,NIO,2021-03-05,41.0,PUT,134360936.0
2021-03-02,Trade,BUY_TO_CLOSE,NIO   210305C00056000,Equity Option,Bought 1 NIO 03/05/21 Call 56.00 @ 0.20,-20.0,1.0,-20.0,0.0,-0.14,100.0,NIO,2021-03-05,56.0,CALL,134360936.0
2021-03-02,Trade,BUY_TO_OPEN,./ESM1 EW3J1 210416C4300,Future Option,Bought 1 /ESM1 EW3J1 04/16/21 Call 4300.00 @ 2.5,-125.0,1.0,-125.0,-2.5,-0.87,1.0,/ESM1,2021-04-16,4300.0,CALL,134456161.0
2021-03-02,Trade,BUY_TO_OPEN,./ESM1 EW3J1 210416P3260,Future Option,Bought 1 /ESM1 EW3J1 04/16/21 Put 3260.00 @ 16.0,-800.0,1.0,-800.0,-2.5,-0.87,1.0,/ESM1,2021-04-16,3260.0,PUT,134456161.0
2021-03-02,Trade,SELL_TO_OPEN,./ESM1 EW3J1 210416C4200,Future Option,Sold 1 /ESM1 EW3J1 04/16/21 Call 4200.00 @ 5.75,287.5,1.0,287.5,-2.5,-0.87,1.0,/ESM1,2021-04-16,4200.0,CALL,134456161.0
2021-03-02,Trade,SELL_TO_OPEN,./ESM1 EW3J1 210416P3360,Future Option,Sold 1 /ESM1 EW3J1 04/16/21 Put 3360.00 @ 21.0,1050.0,1.0,1050.0,-2.5,-0.87,1.0,/ESM1,2021-04-16,3360.0,PUT,134456161.0
2021-03-01,Trade,BUY_TO_CLOSE,SPY   210401C00400000,Equity Option,Bought 1 SPY 04/01/21 Call 400.00 @ 2.74,-274.0,1.0,-274.0,0.0,-0.14,100.0,SPY,2021-04-01,400.0,CALL,134420174.0
2021-03-01,Trade,BUY_TO_CLOSE,SPY   210401P00367500,Equity Option,Bought 1 SPY 04/01/21 Put 367.50 @ 3.51,-351.0,1.0,-351.0,0.0,-0.14,100.0,SPY,2021-04-01,367.5,PUT,134420174.0
2021-03-01,Trade,SELL_TO_OPEN,NIO   210305C00056000,Equity Option,Sold 1 NIO 03/05/21 Call 56.00 @ 0.86,86.0,1.0,86.0,-1.0,-0.152,100.0,NIO,2021-03-05,56.0,CALL,134349902.0
2021-03-01,Trade,SELL_TO_OPEN,NIO   210305P00041000,Equity Option,Sold 1 NIO 03/05/21 Put 41.00 @ 0.49,49.0,1.0,49.0,-1.0,-0.152,100.0,NIO,2021-03-05,41.0,PUT,134349902.0
2021-03-01,Trade,BUY_TO_OPEN,NIO   210305C00060000,Equity Option,Bought 1 NIO 03/05/21 Call 60.00 @ 0.36,-36.0,1.0,-36.0,-1.0,-0.14,100.0,NIO,2021-03-05,60.0,CALL,134349902.0
2021-03-01,Trade,BUY_TO_OPEN,NIO   210305P00037000,Equity Option,Bought 1 NIO 03/05/21 Put 37.00 @ 0.19,-19.0,1.0,-19.0,-1.0,-0.14,100.0,NIO,2021-03-05,37.0,PUT,134349902.0
2021-03-01,Trade,SELL_TO_CLOSE,AMD   210319C00105000,Equity Option,Sold 1 AMD 03/19/21 Call 105.00 @ 0.29,29.0,1.0,29.0,0.0,-0.152,100.0,AMD,2021-03-19,105.0,CALL,133983682.0
2021-03-01,Trade,SELL_TO_CLOSE,AMD   210319P00077500,Equity Option,Sold 1 AMD 03/19/21 Put 77.50 @ 0.85,85.0,1.0,85.0,0.0,-0.152,100.0,AMD,2021-03-19,77.5,PUT,133983682.0
2021-03-01,Trade,BUY_TO_CLOSE,AMD   210319P00082500,Equity Option,Bought 1 AMD 03/19/21 Put 82.50 @ 2.37,-237.0,1.0,-237.0,0.0,-0.14,100.0,AMD,2021-03-19,82.5,PUT,133983682.0
2021-03-01,Trade,BUY_TO_CLOSE,AMD   210319C00100000,Equity Option,Bought 1 AMD 03/19/21 Call 100.00 @ 0.35,-35.0,1.0,-35.0,0.0,-0.14,100.0,AMD,2021-03-19,100.0,CALL,133983682.0
2021-02-26,Trade,SELL_TO_OPEN,PLTR  210305C00026500,Equity Option,Sold 4 PLTR 03/05/21 Call 26.50 @ 0.53,212.0,4.0,53.0,-4.0,-0.558,100.0,PLTR,2021-03-05,26.5,CALL,134025528.0
2021-02-26,Trade,BUY_TO_CLOSE,PLTR  210305C00030000,Equity Option,Bought 4 PLTR 03/05/21 Call 30.00 @ 0.23,-92.0,4.0,-23.0,0.0,-0.54,100.0,PLTR,2021-03-05,30.0,CALL,133314292.0
2021-02-26,Trade,BUY_TO_OPEN,TWTR  210416P00055000,Equity Option,Bought 1 TWTR 04/16/21 Put 55.00 @ 0.68,-68.0,1.0,-68.0,-1.0,-0.14,100.0,TWTR,2021-04-16,55.0,PUT,133989615.0
2021-02-26,Trade,SELL_TO_OPEN,TWTR  210416P00065000,Equity Option,Sold 1 TWTR 04/16/21 Put 65.00 @ 1.85,185.0,1.0,185.0,-1.0,-0.152,100.0,TWTR,2021-04-16,65.0,PUT,133989615.0
2021-02-26,Trade,BUY_TO_OPEN,TWTR  210416C00110000,Equity Option,Bought 1 TWTR 04/16/21 Call 110.00 @ 0.70,-70.0,1.0,-70.0,-1.0,-0.14,100.0,TWTR,2021-04-16,110.0,CALL,133989615.0
2021-02-26,Trade,SELL_TO_OPEN,TWTR  210416C00100000,Equity Option,Sold 1 TWTR 04/16/21 Call 100.00 @ 1.29,129.0,1.0,129.0,-1.0,-0.152,100.0,TWTR,2021-04-16,100.0,CALL,133989615.0
2021-02-26,Trade,SELL_TO_OPEN,SPOT  210416C00390000,Equity Option,Sold 1 SPOT 04/16/21 Call 390.00 @ 4.80,480.0,1.0,480.0,-1.0,-0.162,100.0,SPOT,2021-04-16,390.0,CALL,133966821.0
2021-02-26,Trade,SELL_TO_OPEN,SPOT  210416P00250000,Equity Option,Sold 1 SPOT 04/16/21 Put 250.00 @ 6.11,611.0,1.0,611.0,-1.0,-0.162,100.0,SPOT,2021-04-16,250.0,PUT,133966821.0
2021-02-26,Trade,BUY_TO_OPEN,SPOT  210416C00410000,Equity Option,Bought 1 SPOT 04/16/21 Call 410.00 @ 3.23,-323.0,1.0,-323.0,-1.0,-0.14,100.0,SPOT,2021-04-16,410.0,CALL,133966821.0
2021-02-26,Trade,BUY_TO_OPEN,SPOT  210416P00230000,Equity Option,Bought 1 SPOT 04/16/21 Put 230.00 @ 3.38,-338.0,1.0,-338.0,-1.0,-0.14,100.0,SPOT,2021-04-16,230.0,PUT,133966821.0
2021-02-24,Trade,SELL_TO_OPEN,PLTR  210305C00030000,Equity Option,Sold 1 PLTR 03/05/21 Call 30.00 @ 0.60,60.0,1.0,60.0,-1.0,-0.152,100.0,PLTR,2021-03-05,30.0,CALL,133306986.0
2021-02-24,Trade,SELL_TO_OPEN,PLTR  210305C00030000,Equity Option,Sold 1 PLTR 03/05/21 Call 30.00 @ 0.60,60.0,1.0,60.0,-1.0,-0.152,100.0,PLTR,2021-03-05,30.0,CALL,133306986.0
2021-02-24,Trade,SELL_TO_OPEN,PLTR  210305C00030000,Equity Option,Sold 1 PLTR 03/05/21 Call 30.00 @ 0.60,60.0,1.0,60.0,-1.0,-0.152,100.0,PLTR,2021-03-05,30.0,CALL,133306986.0
2021-02-24,Trade,SELL_TO_OPEN,PLTR  210305C00030000,Equity Option,Sold 1 PLTR 03/05/21 Call 30.00 @ 0.61,61.0,1.0,61.0,-1.0,-0.152,100.0,PLTR,2021-03-05,30.0,CALL,133306986.0
2021-02-24,Trade,BUY_TO_CLOSE,PLTR  210305C00031500,Equity Option,Bought 3 PLTR 03/05/21 Call 31.50 @ 0.43,-129.0,3.0,-43.0,0.0,-0.41,100.0,PLTR,2021-03-05,31.5,CALL,132822250.0
2021-02-24,Trade,BUY_TO_CLOSE,PLTR  210305C00031500,Equity Option,Bought 1 PLTR 03/05/21 Call 31.50 @ 0.43,-43.0,1.0,-43.0,0.0,-0.14,100.0,PLTR,2021-03-05,31.5,CALL,132822250.0
2021-02-23,Trade,SELL_TO_OPEN,PYPL  210319C00272500,Equity Option,Sold 1 PYPL 03/19/21 Call 272.50 @ 6.10,610.0,1.0,610.0,-1.0,-0.162,100.0,PYPL,2021-03-19,272.5,CALL,132921115.0
2021-02-23,Trade,BUY_TO_CLOSE,PYPL  210416C00290000,Equity Option,Bought 1 PYPL 04/16/21 Call 290.00 @ 5.95,-595.0,1.0,-595.0,0.0,-0.14,100.0,PYPL,2021-04-16,290.0,CALL,132921115.0
2021-02-23,Trade,BUY_TO_OPEN,./ESM1 EWH1  210331C4090,Future Option,Bought 1 /ESM1 EWH1 03/31/21 Call 4090.00 @ 6.75,-337.5,1.0,-337.5,-2.5,-0.87,1.0,/ESM1,2021-03-31,4090.0,CALL,132906746.0
2021-02-23,Trade,SELL_TO_OPEN,./ESM1 EWH1  210331C4040,Future Option,Sold 1 /ESM1 EWH1 03/31/21 Call 4040.00 @ 12.5,625.0,1.0,625.0,-2.5,-0.87,1.0,/ESM1,2021-03-31,4040.0,CALL,132906746.0
2021-02-23,Trade,SELL_TO_OPEN,PLTR  210305C00031500,Equity Option,Sold 2 PLTR 03/05/21 Call 31.50 @ 0.85,170.0,2.0,85.0,-2.0,-0.284,100.0,PLTR,2021-03-05,31.5,CALL,132821295.0
2021-02-23,Trade,SELL_TO_OPEN,PLTR  210305C00031500,Equity Option,Sold 2 PLTR 03/05/21 Call 31.50 @ 0.85,170.0,2.0,85.0,-2.0,-0.284,100.0,PLTR,2021-03-05,31.5,CALL,132821295.0
2021-02-23,Trade,SELL_TO_CLOSE,SPY   210319C00409000,Equity Option,Sold 1 SPY 03/19/21 Call 409.00 @ 0.23,23.0,1.0,23.0,0.0,-0.152,100.0,SPY,2021-03-19,409.0,CALL,127910856.0
2021-02-23,Trade,SELL_TO_CLOSE,SPY   210319P00342000,Equity Option,Sold 1 SPY 03/19/21 Put 342.00 @ 1.53,153.0,1.0,153.0,0.0,-0.152,100.0,SPY,2021-03-19,342.0,PUT,127910856.0
2021-02-23,Trade,BUY_TO_CLOSE,SPY   210319C00401000,Equity Option,Bought 1 SPY 03/19/21 Call 401.00 @ 0.86,-86.0,1.0,-86.0,0.0,-0.14,100.0,SPY,2021-03-19,401.0,CALL,127910856.0
2021-02-23,Trade,BUY_TO_CLOSE,SPY   210319P00350000,Equity Option,Bought 1 SPY 03/19/21 Put 350.00 @ 2.13,-213.0,1.0,-213.0,0.0,-0.14,100.0,SPY,2021-03-19,350.0,PUT,127910856.0
2021-02-23,Trade,SELL_TO_OPEN,AAPL  210401C00131000,Equity Option,Sold 2 AAPL 04/01/21 Call 131.00 @ 2.27,454.0,2.0,227.0,-2.0,-0.294,100.0,AAPL,2021-04-01,131.0,CALL,132751696.0
2021-02-23,Trade,BUY_TO_CLOSE,AAPL  210521C00155000,Equity Option,Bought 1 AAPL 05/21/21 Call 155.00 @ 1.45,-145.0,1.0,-145.0,0.0,-0.14,100.0,AAPL,2021-05-21,155.0,CALL,131306414.0
2021-02-23,Trade,BUY_TO_CLOSE,AAPL  210401C00138000,Equity Option,Bought 1 AAPL 04/01/21 Call 138.00 @ 1.18,-118.0,1.0,-118.0,0.0,-0.14,100.0,AAPL,2021-04-01,138.0,CALL,131974419.0
2021-02-22,Trade,SELL_TO_OPEN,SPY   210401C00400000,Equity Option,Sold 1 SPY 04/01/21 Call 400.00 @ 2.79,279.0,1.0,279.0,-1.0,-0.152,100.0,SPY,2021-04-01,400.0,CALL,132507551.0
2021-02-22,Trade,BUY_TO_CLOSE,SPY   210401C00411000,Equity Option,Bought 1 SPY 04/01/21 Call 411.00 @ 0.75,-75.0,1.0,-75.0,0.0,-0.14,100.0,SPY,2021-04-01,411.0,CALL,132507551.0
2021-02-22,Trade,BUY_TO_CLOSE,CCIV  210319P00050000,Equity Option,Bought 1 CCIV 03/19/21 Put 50.00 @ 10.95,-1095.0,1.0,-1095.0,0.0,-0.14,100.0,CCIV,2021-03-19,50.0,PUT,132285857.0
2021-02-18,Trade,SELL_TO_OPEN,AAPL  210401C00138000,Equity Option,Sold 1 AAPL 04/01/21 Call 138.00 @ 2.35,235.0,1.0,235.0,-1.0,-0.152,100.0,AAPL,2021-04-01,138.0,CALL,131741289.0
2021-02-18,Trade,BUY_TO_CLOSE,AAPL  210326C00145000,Equity Option,Bought 1 AAPL 03/26/21 Call 145.00 @ 1.05,-105.0,1.0,-105.0,0.0,-0.14,100.0,AAPL,2021-03-26,145.0,CALL,130796753.0
2021-02-18,Trade,BUY_TO_OPEN,./ESM1 EW1J1 210401C4300,Future Option,Bought 1 /ESM1 EW1J1 04/01/21 Call 4300.00 @ 2.0,-100.0,1.0,-100.0,-2.5,-0.87,1.0,/ESM1,2021-04-01,4300.0,CALL,131662992.0
2021-02-18,Trade,BUY_TO_OPEN,./ESM1 EW1J1 210401P3300,Future Option,Bought 1 /ESM1 EW1J1 04/01/21 Put 3300.00 @ 12.25,-612.5,1.0,-612.5,-2.5,-0.87,1.0,/ESM1,2021-04-01,3300.0,PUT,131662992.0
2021-02-18,Trade,SELL_TO_OPEN,./ESM1 EW1J1 210401C4150,Future Option,Sold 1 /ESM1 EW1J1 04/01/21 Call 4150.00 @ 10.0,500.0,1.0,500.0,-2.5,-0.87,1.0,/ESM1,2021-04-01,4150.0,CALL,131662992.0
2021-02-18,Trade,SELL_TO_OPEN,./ESM1 EW1J1 210401P3450,Future Option,Sold 1 /ESM1 EW1J1 04/01/21 Put 3450.00 @ 19.0,950.0,1.0,950.0,-2.5,-0.87,1.0,/ESM1,2021-04-01,3450.0,PUT,131662992.0
2021-02-18,Trade,SELL_TO_CLOSE,./ESH1 E1CH1 210303C4200,Future Option,Sold 1 /ESH1 E1CH1 03/03/21 Call 4200.00 @ 0.5,25.0,1.0,25.0,0.0,-0.87,1.0,/ESH1,2021-03-03,4200.0,CALL,131662281.0
2021-02-18,Trade,SELL_TO_CLOSE,./ESH1 E1CH1 210303P3500,Future Option,Sold 1 /ESH1 E1CH1 03/03/21 Put 3500.00 @ 3.0,150.0,1.0,150.0,0.0,-0.87,1.0,/ESH1,2021-03-03,3500.0,PUT,131662281.0
2021-02-18,Trade,BUY_TO_CLOSE,./ESH1 E1CH1 210303C4100,Future Option,Bought 1 /ESH1 E1CH1 03/03/21 Call 4100.00 @ 1.5,-75.0,1.0,-75.0,0.0,-0.87,1.0,/ESH1,2021-03-03,4100.0,CALL,131662281.0
2021-02-18,Trade,BUY_TO_CLOSE,./ESH1 E1CH1 210303P3600,Future Option,Bought 1 /ESH1 E1CH1 03/03/21 Put 3600.00 @ 4.75,-237.5,1.0,-237.5,0.0,-0.87,1.0,/ESH1,2021-03-03,3600.0,PUT,131662281.0
2021-02-17,Trade,SELL_TO_OPEN,CCIV  210319P00050000,Equity Option,Sold 1 CCIV 03/19/21 Put 50.00 @ 11.55,1155.0,1.0,1155.0,-1.0,-0.172,100.0,CCIV,2021-03-19,50.0,PUT,131588042.0
2021-02-17,Trade,SELL_TO_OPEN,PTON  210416P00125000,Equity Option,Sold 1 PTON 04/16/21 Put 125.00 @ 8.96,896.0,1.0,896.0,-1.0,-0.162,100.0,PTON,2021-04-16,125.0,PUT,131515366.0
2021-02-17,Trade,BUY_TO_OPEN,PTON  210416P00110000,Equity Option,Bought 1 PTON 04/16/21 Put 110.00 @ 4.17,-417.0,1.0,-417.0,-1.0,-0.14,100.0,PTON,2021-04-16,110.0,PUT,131515366.0
2021-02-17,Trade,SELL_TO_OPEN,PTON  210416P00125000,Equity Option,Sold 1 PTON 04/16/21 Put 125.00 @ 8.90,890.0,1.0,890.0,-1.0,-0.162,100.0,PTON,2021-04-16,125.0,PUT,131515366.0
2021-02-17,Trade,BUY_TO_OPEN,PTON  210416P00110000,Equity Option,Bought 1 PTON 04/16/21 Put 110.00 @ 4.11,-411.0,1.0,-411.0,-1.0,-0.14,100.0,PTON,2021-04-16,110.0,PUT,131515366.0
2021-02-16,Trade,SELL_TO_OPEN,AAPL  210521C00155000,Equity Option,Sold 1 AAPL 05/21/21 Call 155.00 @ 2.90,290.0,1.0,290.0,-1.0,-0.152,100.0,AAPL,2021-05-21,155.0,CALL,131293952.0
2021-02-16,Trade,BUY_TO_CLOSE,AAPL  210416C00180000,Equity Option,Bought 1 AAPL 04/16/21 Call 180.00 @ 0.36,-36.0,1.0,-36.0,0.0,-0.14,100.0,AAPL,2021-04-16,180.0,CALL,131293952.0
2021-02-16,Trade,SELL_TO_CLOSE,CCIV  210319P00020000,Equity Option,Sold 3 CCIV 03/19/21 Put 20.00 @ 1.57,471.0,3.0,157.0,0.0,-0.436,100.0,CCIV,2021-03-19,20.0,PUT,131238417.0
2021-02-16,Trade,BUY_TO_CLOSE,CCIV  210319P00025000,Equity Option,Bought 3 CCIV 03/19/21 Put 25.00 @ 3.32,-996.0,3.0,-332.0,0.0,-0.41,100.0,CCIV,2021-03-19,25.0,PUT,131238417.0
2021-02-16,Trade,SELL_TO_CLOSE,TLRY  210226P00030000,Equity Option,Sold 1 TLRY 02/26/21 Put 30.00 @ 3.50,350.0,1.0,350.0,0.0,-0.152,100.0,TLRY,2021-02-26,30.0,PUT,131136353.0
2021-02-16,Trade,BUY_TO_CLOSE,TLRY  210226P00034000,Equity Option,Bought 1 TLRY 02/26/21 Put 34.00 @ 6.20,-620.0,1.0,-620.0,0.0,-0.14,100.0,TLRY,2021-02-26,34.0,PUT,131136353.0
2021-02-16,Trade,SELL_TO_CLOSE,APPS  210219C00095000,Equity Option,Sold 1 APPS 02/19/21 Call 95.00 @ 0.47,47.0,1.0,47.0,0.0,-0.152,100.0,APPS,2021-02-19,95.0,CALL,128667012.0
2021-02-16,Trade,SELL_TO_CLOSE,APPS  210219P00065000,Equity Option,Sold 1 APPS 02/19/21 Put 65.00 @ 0.07,7.0,1.0,7.0,0.0,-0.152,100.0,APPS,2021-02-19,65.0,PUT,128667012.0
2021-02-16,Trade,BUY_TO_CLOSE,APPS  210219C00085000,Equity Option,Bought 1 APPS 02/19/21 Call 85.00 @ 2.42,-242.0,1.0,-242.0,0.0,-0.14,100.0,APPS,2021-02-19,85.0,CALL,128667012.0
2021-02-16,Trade,BUY_TO_CLOSE,APPS  210219P00075000,Equity Option,Bought 1 APPS 02/19/21 Put 75.00 @ 0.52,-52.0,1.0,-52.0,0.0,-0.14,100.0,APPS,2021-02-19,75.0,PUT,128667012.0
2021-02-16,Trade,BUY_TO_OPEN,PLTR  210319C00034000,Equity Option,Bought 3 PLTR 03/19/21 Call 34.00 @ 2.30,-690.0,3.0,-230.0,-3.0,-0.41,100.0,PLTR,2021-03-19,34.0,CALL,131195270.0
2021-02-16,Trade,SELL_TO_OPEN,SPY   210401C00411000,Equity Option,Sold 1 SPY 04/01/21 Call 411.00 @ 2.09,209.0,1.0,209.0,-1.0,-0.152,100.0,SPY,2021-04-01,411.0,CALL,131122355.0
2021-02-16,Trade,SELL_TO_OPEN,SPY   210401P00367500,Equity Option,Sold 1 SPY 04/01/21 Put 367.50 @ 4.01,401.0,1.0,401.0,-1.0,-0.152,100.0,SPY,2021-04-01,367.5,PUT,131122355.0
2021-02-16,Trade,BUY_TO_CLOSE,SPY   210305C00395000,Equity Option,Bought 1 SPY 03/05/21 Call 395.00 @ 4.80,-480.0,1.0,-480.0,0.0,-0.14,100.0,SPY,2021-03-05,395.0,CALL,131122355.0
2021-02-16,Trade,BUY_TO_CLOSE,SPY   210305P00359000,Equity Option,Bought 1 SPY 03/05/21 Put 359.00 @ 0.73,-73.0,1.0,-73.0,0.0,-0.14,100.0,SPY,2021-03-05,359.0,PUT,131122355.0
2021-02-12,Trade,SELL_TO_OPEN,AMD   210319P00082500,Equity Option,Sold 1 AMD 03/19/21 Put 82.50 @ 1.42,142.0,1.0,142.0,-1.0,-0.152,100.0,AMD,2021-03-19,82.5,PUT,130896722.0
2021-02-12,Trade,SELL_TO_CLOSE,AMD   210319P00070000,Equity Option,Sold 1 AMD 03/19/21 Put 70.00 @ 0.23,23.0,1.0,23.0,0.0,-0.152,100.0,AMD,2021-03-19,70.0,PUT,130896722.0
2021-02-12,Trade,BUY_TO_OPEN,AMD   210319P00077500,Equity Option,Bought 1 AMD 03/19/21 Put 77.50 @ 0.68,-68.0,1.0,-68.0,-1.0,-0.14,100.0,AMD,2021-03-19,77.5,PUT,130896722.0
2021-02-12,Trade,BUY_TO_CLOSE,AMD   210319P00075000,Equity Option,Bought 1 AMD 03/19/21 Put 75.00 @ 0.47,-47.0,1.0,-47.0,0.0,-0.14,100.0,AMD,2021-03-19,75.0,PUT,130896722.0
2021-02-12,Trade,BUY_TO_OPEN,./ESM1 EWH1  210331C4170,Future Option,Bought 1 /ESM1 EWH1 03/31/21 Call 4170.00 @ 8.25,-412.5,1.0,-412.5,-2.5,-0.87,1.0,/ESM1,2021-03-31,4170.0,CALL,130790161.0
2021-02-12,Trade,BUY_TO_OPEN,./ESM1 EWH1  210331P3500,Future Option,Bought 1 /ESM1 EWH1 03/31/21 Put 3500.00 @ 25.75,-1287.5,1.0,-1287.5,-2.5,-0.87,1.0,/ESM1,2021-03-31,3500.0,PUT,130790161.0
2021-02-12,Trade,SELL_TO_OPEN,./ESM1 EWH1  210331C4120,Future Option,Sold 1 /ESM1 EWH1 03/31/21 Call 4120.00 @ 15.0,750.0,1.0,750.0,-2.5,-0.87,1.0,/ESM1,2021-03-31,4120.0,CALL,130790161.0
2021-02-12,Trade,SELL_TO_OPEN,./ESM1 EWH1  210331P3550,Future Option,Sold 1 /ESM1 EWH1 03/31/21 Put 3550.00 @ 30.0,1500.0,1.0,1500.0,-2.5,-0.87,1.0,/ESM1,2021-03-31,3550.0,PUT,130790161.0
2021-02-12,Trade,BUY_TO_CLOSE,./ESH1 ESH1  210319C4150,Future Option,Bought 1 /ESH1 ESH1 03/19/21 Call 4150.00 @ 5.5,-275.0,1.0,-275.0,0.0,-0.87,1.0,/ESH1,2021-03-19,4150.0,CALL,130776789.0
2021-02-12,Trade,BUY_TO_CLOSE,./ESH1 ESH1  210319P3450,Future Option,Bought 1 /ESH1 ESH1 03/19/21 Put 3450.00 @ 12.5,-625.0,1.0,-625.0,0.0,-0.87,1.0,/ESH1,2021-03-19,3450.0,PUT,130776789.0
2021-02-12,Trade,SELL_TO_OPEN,AAPL  210326C00145000,Equity Option,Sold 1 AAPL 03/26/21 Call 145.00 @ 2.10,210.0,1.0,210.0,-1.0,-0.152,100.0,AAPL,2021-03-26,145.0,CALL,130699796.0
2021-02-12,Trade,BUY_TO_CLOSE,AAPL  210312C00146000,Equity Option,Bought 1 AAPL 03/12/21 Call 146.00 @ 1.05,-105.0,1.0,-105.0,0.0,-0.14,100.0,AAPL,2021-03-12,146.0,CALL,130106592.0
2021-02-12,Trade,BUY_TO_OPEN,./ESH1 E1CH1 210303P3500,Future Option,Bought 1 /ESH1 E1CH1 03/03/21 Put 3500.00 @ 6.0,-300.0,1.0,-300.0,-2.5,-0.87,1.0,/ESH1,2021-03-03,3500.0,PUT,130606936.0
2021-02-12,Trade,SELL_TO_OPEN,./ESH1 E1CH1 210303P3600,Future Option,Sold 1 /ESH1 E1CH1 03/03/21 Put 3600.00 @ 9.75,487.5,1.0,487.5,-2.5,-0.87,1.0,/ESH1,2021-03-03,3600.0,PUT,130606936.0
2021-02-11,Trade,BUY_TO_OPEN,./ESH1 E1CH1 210303C4200,Future Option,Bought 1 /ESH1 E1CH1 03/03/21 Call 4200.00 @ 0.4,-20.0,1.0,-20.0,-2.5,-0.87,1.0,/ESH1,2021-03-03,4200.0,CALL,130606178.0
2021-02-11,Trade,SELL_TO_OPEN,./ESH1 E1CH1 210303C4100,Future Option,Sold 1 /ESH1 E1CH1 03/03/21 Call 4100.00 @ 2.2,110.0,1.0,110.0,-2.5,-0.87,1.0,/ESH1,2021-03-03,4100.0,CALL,130606178.0
2021-02-11,Trade,SELL_TO_OPEN,ACB   210219C00015000,Equity Option,Sold 2 ACB 02/19/21 Call 15.00 @ 2.00,400.0,2.0,200.0,-2.0,-0.284,100.0,ACB,2021-02-19,15.0,CALL,130533330.0
2021-02-11,Trade,BUY_TO_OPEN,ACB   210219C00017000,Equity Option,Bought 1 ACB 02/19/21 Call 17.00 @ 1.45,-145.0,1.0,-145.0,-1.0,-0.14,100.0,ACB,2021-02-19,17.0,CALL,130533330.0
2021-02-11,Trade,BUY_TO_OPEN,ACB   210219C00013000,Equity Option,Bought 1 ACB 02/19/21 Call 13.00 @ 2.85,-285.0,1.0,-285.0,-1.0,-0.14,100.0,ACB,2021-02-19,13.0,CALL,130533330.0
2021-02-11,Trade,BUY_TO_OPEN,PLTR  210319C00034000,Equity Option,Bought 1 PLTR 03/19/21 Call 34.00 @ 5.30,-530.0,1.0,-530.0,-1.0,-0.14,100.0,PLTR,2021-03-19,34.0,CALL,130527148.0
2021-02-11,Trade,BUY_TO_CLOSE,PYPL  210319C00280000,Equity Option,Bought 1 PYPL 03/19/21 Call 280.00 @ 26.60,-2660.0,1.0,-2660.0,0.0,-0.14,100.0,PYPL,2021-03-19,280.0,CALL,130405264.0
2021-02-11,Trade,SELL_TO_OPEN,PYPL  210416C00290000,Equity Option,Sold 1 PYPL 04/16/21 Call 290.00 @ 25.45,2545.0,1.0,2545.0,-1.0,-0.202,100.0,PYPL,2021-04-16,290.0,CALL,130405264.0
2021-02-10,Trade,SELL_TO_OPEN,CCIV  210319P00025000,Equity Option,Sold 3 CCIV 03/19/21 Put 25.00 @ 5.15,1545.0,3.0,515.0,-3.0,-0.456,100.0,CCIV,2021-03-19,25.0,PUT,130250186.0
2021-02-10,Trade,BUY_TO_OPEN,CCIV  210319P00020000,Equity Option,Bought 3 CCIV 03/19/21 Put 20.00 @ 2.62,-786.0,3.0,-262.0,-3.0,-0.41,100.0,CCIV,2021-03-19,20.0,PUT,130250186.0
2021-02-10,Trade,SELL_TO_CLOSE,SLV   210319C00032000,Equity Option,Sold 1 SLV 03/19/21 Call 32.00 @ 0.26,26.0,1.0,26.0,0.0,-0.152,100.0,SLV,2021-03-19,32.0,CALL,130247922.0
2021-02-10,Trade,BUY_TO_CLOSE,SLV   210319C00033000,Equity Option,Bought 2 SLV 03/19/21 Call 33.00 @ 0.23,-46.0,2.0,-23.0,0.0,-0.27,100.0,SLV,2021-03-19,33.0,CALL,130247922.0
2021-02-10,Trade,BUY_TO_CLOSE,SLV   210319C00033000,Equity Option,Bought 2 SLV 03/19/21 Call 33.00 @ 0.23,-46.0,2.0,-23.0,0.0,-0.27,100.0,SLV,2021-03-19,33.0,CALL,130247922.0
2021-02-10,Trade,SELL_TO_CLOSE,SLV   210319C00032000,Equity Option,Sold 1 SLV 03/19/21 Call 32.00 @ 0.26,26.0,1.0,26.0,0.0,-0.152,100.0,SLV,2021-03-19,32.0,CALL,130247922.0
2021-02-10,Trade,BUY_TO_CLOSE,SLV   210319C00033000,Equity Option,Bought 2 SLV 03/19/21 Call 33.00 @ 0.23,-46.0,2.0,-23.0,0.0,-0.27,100.0,SLV,2021-03-19,33.0,CALL,130247922.0
2021-02-10,Trade,SELL_TO_CLOSE,SLV   210319C00032000,Equity Option,Sold 1 SLV 03/19/21 Call 32.00 @ 0.26,26.0,1.0,26.0,0.0,-0.152,100.0,SLV,2021-03-19,32.0,CALL,130247922.0
2021-02-10,Trade,SELL_TO_OPEN,CCL   210319C00025000,Equity Option,Sold 1 CCL 03/19/21 Call 25.00 @ 0.82,82.0,1.0,82.0,-1.0,-0.152,100.0,CCL,2021-03-19,25.0,CALL,130195408.0
2021-02-10,Trade,BUY_TO_CLOSE,CCL   210219C00023000,Equity Option,Bought 1 CCL 02/19/21 Call 23.00 @ 0.24,-24.0,1.0,-24.0,0.0,-0.14,100.0,CCL,2021-02-19,23.0,CALL,130106639.0
2021-02-10,Trade,BUY_TO_CLOSE,AAPL  210416C00200000,Equity Option,Bought 1 AAPL 04/16/21 Call 200.00 @ 0.30,-30.0,1.0,-30.0,0.0,-0.14,100.0,AAPL,2021-04-16,200.0,CALL,130131684.0
2021-02-10,Trade,SELL_TO_OPEN,AAPL  210416C00180000,Equity Option,Sold 1 AAPL 04/16/21 Call 180.00 @ 0.54,54.0,1.0,54.0,-1.0,-0.152,100.0,AAPL,2021-04-16,180.0,CALL,130131684.0
2021-02-10,Trade,SELL_TO_OPEN,PYPL  210319C00280000,Equity Option,Sold 1 PYPL 03/19/21 Call 280.00 @ 15.13,1513.0,1.0,1513.0,-1.0,-0.182,100.0,PYPL,2021-03-19,280.0,CALL,130074316.0
2021-02-10,Trade,BUY_TO_OPEN,PYPL  210416C00270000,Equity Option,Bought 1 PYPL 04/16/21 Call 270.00 @ 25.18,-2518.0,1.0,-2518.0,-1.0,-0.14,100.0,PYPL,2021-04-16,270.0,CALL,130074316.0
2021-02-10,Trade,SELL_TO_OPEN,TLRY  210226P00034000,Equity Option,Sold 1 TLRY 02/26/21 Put 34.00 @ 5.65,565.0,1.0,565.0,-1.0,-0.162,100.0,TLRY,2021-02-26,34.0,PUT,130016760.0
2021-02-10,Trade,BUY_TO_OPEN,TLRY  210226P00030000,Equity Option,Bought 1 TLRY 02/26/21 Put 30.00 @ 3.70,-370.0,1.0,-370.0,-1.0,-0.14,100.0,TLRY,2021-02-26,30.0,PUT,130016760.0
2021-02-10,Trade,BUY_TO_CLOSE,TWTR  210212P00070000,Equity Option,Bought 1 TWTR 02/12/21 Put 70.00 @ 4.50,-450.0,1.0,-450.0,0.0,-0.14,100.0,TWTR,2021-02-12,70.0,PUT,130028235.0
2021-02-10,Trade,BUY_TO_CLOSE,TWTR  210212C00059500,Equity Option,Bought 1 TWTR 02/12/21 Call 59.50 @ 6.70,-670.0,1.0,-670.0,0.0,-0.14,100.0,TWTR,2021-02-12,59.5,CALL,130028235.0
2021-02-10,Trade,SELL_TO_OPEN,TWTR  210212P00070000,Equity Option,Sold 1 TWTR 02/12/21 Put 70.00 @ 3.95,395.0,1.0,395.0,-1.0,-0.152,100.0,TWTR,2021-02-12,70.0,PUT,129990857.0
2021-02-10,Trade,BUY_TO_CLOSE,TWTR  210219P00070000,Equity Option,Bought 1 TWTR 02/19/21 Put 70.00 @ 4.60,-460.0,1.0,-460.0,0.0,-0.14,100.0,TWTR,2021-02-19,70.0,PUT,129990857.0
2021-02-10,Trade,BUY_TO_CLOSE,TWTR  210212P00059500,Equity Option,Bought 1 TWTR 02/12/21 Put 59.50 @ 0.14,-14.0,1.0,-14.0,0.0,-0.14,100.0,TWTR,2021-02-12,59.5,PUT,129955774.0
2021-02-10,Trade,SELL_TO_OPEN,TWTR  210219P00070000,Equity Option,Sold 1 TWTR 02/19/21 Put 70.00 @ 4.00,400.0,1.0,400.0,-1.0,-0.152,100.0,TWTR,2021-02-19,70.0,PUT,129955774.0
2021-02-10,Trade,BUY_TO_CLOSE,TLRY  210226P00034000,Equity Option,Bought 3 TLRY 02/26/21 Put 34.00 @ 2.41,-723.0,3.0,-241.0,0.0,-0.41,100.0,TLRY,2021-02-26,34.0,PUT,129760834.0
2021-02-10,Trade,SELL_TO_CLOSE,TLRY  210226P00030000,Equity Option,Sold 2 TLRY 02/26/21 Put 30.00 @ 1.51,302.0,2.0,151.0,0.0,-0.284,100.0,TLRY,2021-02-26,30.0,PUT,129760834.0
2021-02-10,Trade,BUY_TO_CLOSE,TLRY  210226P00034000,Equity Option,Bought 2 TLRY 02/26/21 Put 34.00 @ 2.41,-482.0,2.0,-241.0,0.0,-0.27,100.0,TLRY,2021-02-26,34.0,PUT,129760834.0
2021-02-10,Trade,SELL_TO_CLOSE,TLRY  210226P00030000,Equity Option,Sold 3 TLRY 02/26/21 Put 30.00 @ 1.51,453.0,3.0,151.0,0.0,-0.436,100.0,TLRY,2021-02-26,30.0,PUT,129760834.0
2021-02-09,Trade,SELL_TO_OPEN,SPY   210305P00359000,Equity Option,Sold 1 SPY 03/05/21 Put 359.00 @ 1.38,138.0,1.0,138.0,-1.0,-0.152,100.0,SPY,2021-03-05,359.0,PUT,129861525.0
2021-02-09,Trade,BUY_TO_CLOSE,SPY   210305P00345000,Equity Option,Bought 1 SPY 03/05/21 Put 345.00 @ 0.75,-75.0,1.0,-75.0,0.0,-0.14,100.0,SPY,2021-03-05,345.0,PUT,129861525.0
2021-02-09,Trade,BUY_TO_OPEN,TLRY  210226P00030000,Equity Option,Bought 5 TLRY 02/26/21 Put 30.00 @ 2.95,-1475.0,5.0,-295.0,-5.0,-0.68,100.0,TLRY,2021-02-26,30.0,PUT,129760322.0
2021-02-09,Trade,SELL_TO_OPEN,TLRY  210226P00034000,Equity Option,Sold 5 TLRY 02/26/21 Put 34.00 @ 4.71,2355.0,5.0,471.0,-5.0,-0.75,100.0,TLRY,2021-02-26,34.0,PUT,129760322.0
2021-02-09,Trade,SELL_TO_OPEN,TWTR  210212P00059500,Equity Option,Sold 1 TWTR 02/12/21 Put 59.50 @ 3.51,351.0,1.0,351.0,-1.0,-0.152,100.0,TWTR,2021-02-12,59.5,PUT,129682341.0
2021-02-09,Trade,SELL_TO_OPEN,TWTR  210212C00059500,Equity Option,Sold 1 TWTR 02/12/21 Call 59.50 @ 3.92,392.0,1.0,392.0,-1.0,-0.152,100.0,TWTR,2021-02-12,59.5,CALL,129682341.0
2021-02-09,Trade,SELL_TO_CLOSE,GME   210219C00085000,Equity Option,Sold 1 GME 02/19/21 Call 85.00 @ 4.57,457.0,1.0,457.0,0.0,-0.162,100.0,GME,2021-02-19,85.0,CALL,128636668.0
2021-02-09,Trade,BUY_TO_CLOSE,GME   210219C00075000,Equity Option,Bought 1 GME 02/19/21 Call 75.00 @ 5.87,-587.0,1.0,-587.0,0.0,-0.14,100.0,GME,2021-02-19,75.0,CALL,128636668.0
2021-02-08,Trade,BUY_TO_CLOSE,./ESH1 ESH1  210319P3200,Future Option,Bought 1 /ESH1 ESH1 03/19/21 Put 3200.00 @ 7.5,-375.0,1.0,-375.0,0.0,-0.87,1.0,/ESH1,2021-03-19,3200.0,PUT,129543945.0
2021-02-08,Trade,SELL_TO_OPEN,./ESH1 ESH1  210319P3450,Future Option,Sold 1 /ESH1 ESH1 03/19/21 Put 3450.00 @ 16.75,837.5,1.0,837.5,-2.5,-0.87,1.0,/ESH1,2021-03-19,3450.0,PUT,129543945.0
2021-02-08,Trade,BUY_TO_CLOSE,SPY   210319P00350000,Equity Option,Bought 1 SPY 03/19/21 Put 350.00 @ 2.21,-221.0,1.0,-221.0,0.0,-0.14,100.0,SPY,2021-03-19,350.0,PUT,129535611.0
2021-02-08,Trade,BUY_TO_CLOSE,SPY   210319C00403000,Equity Option,Bought 1 SPY 03/19/21 Call 403.00 @ 2.90,-290.0,1.0,-290.0,0.0,-0.14,100.0,SPY,2021-03-19,403.0,CALL,129535611.0
2021-02-04,Trade,SELL_TO_OPEN,APPS  210219C00085000,Equity Option,Sold 1 APPS 02/19/21 Call 85.00 @ 4.99,499.0,1.0,499.0,-1.0,-0.162,100.0,APPS,2021-02-19,85.0,CALL,128665167.0
2021-02-04,Trade,SELL_TO_OPEN,APPS  210219P00075000,Equity Option,Sold 1 APPS 02/19/21 Put 75.00 @ 2.72,272.0,1.0,272.0,-1.0,-0.152,100.0,APPS,2021-02-19,75.0,PUT,128665167.0
2021-02-04,Trade,BUY_TO_OPEN,APPS  210219C00095000,Equity Option,Bought 1 APPS 02/19/21 Call 95.00 @ 2.23,-223.0,1.0,-223.0,-1.0,-0.14,100.0,APPS,2021-02-19,95.0,CALL,128665167.0
2021-02-04,Trade,BUY_TO_OPEN,APPS  210219P00065000,Equity Option,Bought 1 APPS 02/19/21 Put 65.00 @ 0.68,-68.0,1.0,-68.0,-1.0,-0.14,100.0,APPS,2021-02-19,65.0,PUT,128665167.0
2021-02-04,Trade,SELL_TO_OPEN,GME   210219C00075000,Equity Option,Sold 1 GME 02/19/21 Call 75.00 @ 15.85,1585.0,1.0,1585.0,-1.0,-0.182,100.0,GME,2021-02-19,75.0,CALL,128636395.0
2021-02-04,Trade,BUY_TO_OPEN,GME   210219C00085000,Equity Option,Bought 1 GME 02/19/21 Call 85.00 @ 13.25,-1325.0,1.0,-1325.0,-1.0,-0.14,100.0,GME,2021-02-19,85.0,CALL,128636395.0
2021-02-03,Trade,SELL_TO_OPEN,./ESH1 ESH1  210319C4150,Future Option,Sold 1 /ESH1 ESH1 03/19/21 Call 4150.00 @ 5.5,275.0,1.0,275.0,-2.5,-0.87,1.0,/ESH1,2021-03-19,4150.0,CALL,128441322.0
2021-02-03,Trade,SELL_TO_OPEN,./ESH1 ESH1  210319P3200,Future Option,Sold 1 /ESH1 ESH1 03/19/21 Put 3200.00 @ 12.25,612.5,1.0,612.5,-2.5,-0.87,1.0,/ESH1,2021-03-19,3200.0,PUT,128441322.0
2021-02-03,Trade,SELL_TO_OPEN,AMD   210319C00100000,Equity Option,Sold 1 AMD 03/19/21 Call 100.00 @ 2.20,220.0,1.0,220.0,-1.0,-0.152,100.0,AMD,2021-03-19,100.0,CALL,128334073.0
2021-02-03,Trade,SELL_TO_OPEN,AMD   210319P00075000,Equity Option,Sold 1 AMD 03/19/21 Put 75.00 @ 1.20,120.0,1.0,120.0,-1.0,-0.152,100.0,AMD,2021-03-19,75.0,PUT,128334073.0
2021-02-03,Trade,BUY_TO_OPEN,AMD   210319C00105000,Equity Option,Bought 1 AMD 03/19/21 Call 105.00 @ 1.47,-147.0,1.0,-147.0,-1.0,-0.14,100.0,AMD,2021-03-19,105.0,CALL,128334073.0
2021-02-03,Trade,BUY_TO_OPEN,AMD   210319P00070000,Equity Option,Bought 1 AMD 03/19/21 Put 70.00 @ 0.58,-58.0,1.0,-58.0,-1.0,-0.14,100.0,AMD,2021-03-19,70.0,PUT,128334073.0
2021-02-03,Trade,SELL_TO_OPEN,AAPL  210312C00146000,Equity Option,Sold 1 AAPL 03/12/21 Call 146.00 @ 2.10,210.0,1.0,210.0,-1.0,-0.152,100.0,AAPL,2021-03-12,146.0,CALL,128264082.0
2021-02-03,Trade,BUY_TO_CLOSE,AAPL  210212C00139000,Equity Option,Bought 1 AAPL 02/12/21 Call 139.00 @ 1.13,-113.0,1.0,-113.0,0.0,-0.14,100.0,AAPL,2021-02-12,139.0,CALL,128264082.0
2021-02-02,Trade,SELL_TO_OPEN,AAPL  210416C00200000,Equity Option,Sold 1 AAPL 04/16/21 Call 200.00 @ 0.40,40.0,1.0,40.0,-1.0,-0.152,100.0,AAPL,2021-04-16,200.0,CALL,128044578.0
2021-02-02,Trade,SELL_TO_OPEN,CCL   210219C00023000,Equity Option,Sold 1 CCL 02/19/21 Call 23.00 @ 0.48,48.0,1.0,48.0,-1.0,-0.152,100.0,CCL,2021-02-19,23.0,CALL,128043658.0
2021-02-02,Trade,BUY_TO_OPEN,SLV   210319C00032000,Equity Option,Bought 1 SLV 03/19/21 Call 32.00 @ 0.52,-52.0,1.0,-52.0,-1.0,-0.14,100.0,SLV,2021-03-19,32.0,CALL,127913248.0
2021-02-02,Trade,SELL_TO_OPEN,SLV   210319C00033000,Equity Option,Sold 2 SLV 03/19/21 Call 33.00 @ 0.45,90.0,2.0,45.0,-2.0,-0.284,100.0,SLV,2021-03-19,33.0,CALL,127913248.0
2021-02-02,Trade,BUY_TO_OPEN,SLV   210319C00032000,Equity Option,Bought 2 SLV 03/19/21 Call 32.00 @ 0.52,-104.0,2.0,-52.0,-2.0,-0.27,100.0,SLV,2021-03-19,32.0,CALL,127913248.0
2021-02-02,Trade,SELL_TO_OPEN,SLV   210319C00033000,Equity Option,Sold 4 SLV 03/19/21 Call 33.00 @ 0.45,180.0,4.0,45.0,-4.0,-0.558,100.0,SLV,2021-03-19,33.0,CALL,127913248.0
2021-02-02,Trade,BUY_TO_OPEN,SPY   210319P00342000,Equity Option,Bought 1 SPY 03/19/21 Put 342.00 @ 3.55,-355.0,1.0,-355.0,-1.0,-0.14,100.0,SPY,2021-03-19,342.0,PUT,127902256.0
2021-02-02,Trade,BUY_TO_OPEN,SPY   210319C00409000,Equity Option,Bought 1 SPY 03/19/21 Call 409.00 @ 1.36,-136.0,1.0,-136.0,-1.0,-0.14,100.0,SPY,2021-03-19,409.0,CALL,127902256.0
2021-02-02,Trade,SELL_TO_OPEN,SPY   210319P00350000,Equity Option,Sold 1 SPY 03/19/21 Put 350.00 @ 4.46,446.0,1.0,446.0,-1.0,-0.152,100.0,SPY,2021-03-19,350.0,PUT,127902256.0
2021-02-02,Trade,SELL_TO_OPEN,SPY   210319C00401000,Equity Option,Sold 1 SPY 03/19/21 Call 401.00 @ 2.88,288.0,1.0,288.0,-1.0,-0.152,100.0,SPY,2021-03-19,401.0,CALL,127902256.0
2021-02-02,Trade,BUY_TO_CLOSE,SPY   210212P00352000,Equity Option,Bought 1 SPY 02/12/21 Put 352.00 @ 0.64,-64.0,1.0,-64.0,0.0,-0.14,100.0,SPY,2021-02-12,352.0,PUT,127892815.0
2021-02-02,Trade,BUY_TO_CLOSE,SPY   210212C00390000,Equity Option,Bought 1 SPY 02/12/21 Call 390.00 @ 1.35,-135.0,1.0,-135.0,0.0,-0.14,100.0,SPY,2021-02-12,390.0,CALL,127892815.0
2021-02-02,Trade,SELL_TO_OPEN,SPY   210319P00350000,Equity Option,Sold 1 SPY 03/19/21 Put 350.00 @ 4.41,441.0,1.0,441.0,-1.0,-0.152,100.0,SPY,2021-03-19,350.0,PUT,127892815.0
2021-02-02,Trade,SELL_TO_OPEN,SPY   210319C00403000,Equity Option,Sold 1 SPY 03/19/21 Call 403.00 @ 2.33,233.0,1.0,233.0,-1.0,-0.152,100.0,SPY,2021-03-19,403.0,CALL,127892815.0
2021-02-02,Trade,SELL_TO_CLOSE,SPY   210205P00352500,Equity Option,Sold 1 SPY 02/05/21 Put 352.50 @ 0.10,10.0,1.0,10.0,0.0,-0.152,100.0,SPY,2021-02-05,352.5,PUT,127863288.0
2021-02-02,Trade,BUY_TO_CLOSE,SPY   210205P00360000,Equity Option,Bought 1 SPY 02/05/21 Put 360.00 @ 0.23,-23.0,1.0,-23.0,0.0,-0.14,100.0,SPY,2021-02-05,360.0,PUT,127863288.0
2021-02-02,Trade,BUY_TO_CLOSE,SPY   210212P00336000,Equity Option,Bought 1 SPY 02/12/21 Put 336.00 @ 0.32,-32.0,1.0,-32.0,0.0,-0.14,100.0,SPY,2021-02-12,336.0,PUT,127859733.0
2021-02-02,Trade,SELL_TO_OPEN,SPY   210212P00352000,Equity Option,Sold 1 SPY 02/12/21 Put 352.00 @ 0.72,72.0,1.0,72.0,-1.0,-0.152,100.0,SPY,2021-02-12,352.0,PUT,127859733.0
2021-02-01,Trade,BUY_TO_CLOSE,AAPL  210305C00150000,Equity Option,Bought 1 AAPL 03/05/21 Call 150.00 @ 1.59,-159.0,1.0,-159.0,0.0,-0.14,100.0,AAPL,2021-03-05,150.0,CALL,127673771.0
2021-01-29,Trade,SELL_TO_CLOSE,SPY   210205P00363000,Equity Option,Sold 2 SPY 02/05/21 Put 363.00 @ 3.60,720.0,2.0,360.0,0.0,-0.294,100.0,SPY,2021-02-05,363.0,PUT,127263223.0
2021-01-29,Trade,BUY_TO_CLOSE,SPY   210205P00373000,Equity Option,Bought 2 SPY 02/05/21 Put 373.00 @ 6.75,-1350.0,2.0,-675.0,0.0,-0.27,100.0,SPY,2021-02-05,373.0,PUT,127263223.0
2021-01-29,Trade,SELL_TO_OPEN,SPY   210212C00390000,Equity Option,Sold 1 SPY 02/12/21 Call 390.00 @ 0.52,52.0,1.0,52.0,-1.0,-0.152,100.0,SPY,2021-02-12,390.0,CALL,127227542.0
2021-01-29,Trade,BUY_TO_CLOSE,SPY   210212C00401000,Equity Option,Bought 1 SPY 02/12/21 Call 401.00 @ 0.10,-10.0,1.0,-10.0,0.0,-0.14,100.0,SPY,2021-02-12,401.0,CALL,127227542.0
2021-01-29,Trade,SELL_TO_OPEN,AAPL  210305C00150000,Equity Option,Sold 1 AAPL 03/05/21 Call 150.00 @ 2.18,218.0,1.0,218.0,-1.0,-0.152,100.0,AAPL,2021-03-05,150.0,CALL,127088855.0
2021-01-29,Trade,SELL_TO_OPEN,AAPL  210212C00139000,Equity Option,Sold 1 AAPL 02/12/21 Call 139.00 @ 2.66,266.0,1.0,266.0,-1.0,-0.152,100.0,AAPL,2021-02-12,139.0,CALL,127083918.0
2021-01-29,Trade,BUY_TO_CLOSE,AAPL  210205C00136000,Equity Option,Bought 1 AAPL 02/05/21 Call 136.00 @ 2.52,-252.0,1.0,-252.0,0.0,-0.14,100.0,AAPL,2021-02-05,136.0,CALL,127083918.0
2021-01-28,Trade,SELL_TO_OPEN,SPY   210212P00336000,Equity Option,Sold 1 SPY 02/12/21 Put 336.00 @ 0.74,74.0,1.0,74.0,-1.0,-0.152,100.0,SPY,2021-02-12,336.0,PUT,126812857.0
2021-01-28,Trade,SELL_TO_OPEN,SPY   210212C00401000,Equity Option,Sold 1 SPY 02/12/21 Call 401.00 @ 0.24,24.0,1.0,24.0,-1.0,-0.152,100.0,SPY,2021-02-12,401.0,CALL,126812857.0
2021-01-28,Trade,SELL_TO_CLOSE,AMC   220121C00003000,Equity Option,Sold 6 AMC 01/21/22 Call 3.00 @ 8.00,4800.0,6.0,800.0,0.0,-0.932,100.0,AMC,2022-01-21,3.0,CALL,126790301.0
2021-01-28,Trade,BUY_TO_CLOSE,AMC   220121C00004500,Equity Option,Bought 5 AMC 01/21/22 Call 4.50 @ 7.41,-3705.0,5.0,-741.0,0.0,-0.68,100.0,AMC,2022-01-21,4.5,CALL,126790301.0
2021-01-28,Trade,BUY_TO_CLOSE,BB    210212C00015000,Equity Option,Bought 1 BB 02/12/21 Call 15.00 @ 3.80,-380.0,1.0,-380.0,0.0,-0.14,100.0,BB,2021-02-12,15.0,CALL,126745531.0
2021-01-28,Trade,SELL_TO_OPEN,BB    210212C00015000,Equity Option,Sold 1 BB 02/12/21 Call 15.00 @ 3.87,387.0,1.0,387.0,-1.0,-0.152,100.0,BB,2021-02-12,15.0,CALL,126728853.0
2021-01-28,Trade,BUY_TO_CLOSE,BB    210205C00040000,Equity Option,Bought 1 BB 02/05/21 Call 40.00 @ 0.72,-72.0,1.0,-72.0,0.0,-0.14,100.0,BB,2021-02-05,40.0,CALL,126728853.0
2021-01-27,Trade,SELL_TO_OPEN,SPY   210205P00373000,Equity Option,Sold 1 SPY 02/05/21 Put 373.00 @ 7.30,730.0,1.0,730.0,-1.0,-0.162,100.0,SPY,2021-02-05,373.0,PUT,126508746.0
2021-01-27,Trade,SELL_TO_CLOSE,SPY   210129P00363000,Equity Option,Sold 1 SPY 01/29/21 Put 363.00 @ 1.67,167.0,1.0,167.0,0.0,-0.152,100.0,SPY,2021-01-29,363.0,PUT,126508746.0
2021-01-27,Trade,BUY_TO_OPEN,SPY   210205P00363000,Equity Option,Bought 1 SPY 02/05/21 Put 363.00 @ 4.33,-433.0,1.0,-433.0,-1.0,-0.14,100.0,SPY,2021-02-05,363.0,PUT,126508746.0
2021-01-27,Trade,BUY_TO_CLOSE,SPY   210129P00373000,Equity Option,Bought 1 SPY 01/29/21 Put 373.00 @ 4.45,-445.0,1.0,-445.0,0.0,-0.14,100.0,SPY,2021-01-29,373.0,PUT,126508746.0
2021-01-27,Trade,SELL_TO_OPEN,SPY   210205P00373000,Equity Option,Sold 1 SPY 02/05/21 Put 373.00 @ 7.30,730.0,1.0,730.0,-1.0,-0.162,100.0,SPY,2021-02-05,373.0,PUT,126508746.0
2021-01-27,Trade,SELL_TO_CLOSE,SPY   210129P00363000,Equity Option,Sold 1 SPY 01/29/21 Put 363.00 @ 1.67,167.0,1.0,167.0,0.0,-0.152,100.0,SPY,2021-01-29,363.0,PUT,126508746.0
2021-01-27,Trade,BUY_TO_OPEN,SPY   210205P00363000,Equity Option,Bought 1 SPY 02/05/21 Put 363.00 @ 4.33,-433.0,1.0,-433.0,-1.0,-0.14,100.0,SPY,2021-02-05,363.0,PUT,126508746.0
2021-01-27,Trade,BUY_TO_CLOSE,SPY   210129P00373000,Equity Option,Bought 1 SPY 01/29/21 Put 373.00 @ 4.45,-445.0,1.0,-445.0,0.0,-0.14,100.0,SPY,2021-01-29,373.0,PUT,126508746.0
2021-01-27,Trade,SELL_TO_OPEN,SPY   210305C00395000,Equity Option,Sold 1 SPY 03/05/21 Call 395.00 @ 2.33,233.0,1.0,233.0,-1.0,-0.152,100.0,SPY,2021-03-05,395.0,CALL,126497303.0
2021-01-27,Trade,SELL_TO_OPEN,SPY   210305P00345000,Equity Option,Sold 1 SPY 03/05/21 Put 345.00 @ 4.92,492.0,1.0,492.0,-1.0,-0.162,100.0,SPY,2021-03-05,345.0,PUT,126497303.0
2021-01-27,Trade,BUY_TO_CLOSE,SPY   210201C00385000,Equity Option,Bought 1 SPY 02/01/21 Call 385.00 @ 0.66,-66.0,1.0,-66.0,0.0,-0.14,100.0,SPY,2021-02-01,385.0,CALL,126497303.0
2021-01-27,Trade,BUY_TO_CLOSE,SPY   210201P00373000,Equity Option,Bought 1 SPY 02/01/21 Put 373.00 @ 4.54,-454.0,1.0,-454.0,0.0,-0.14,100.0,SPY,2021-02-01,373.0,PUT,126497303.0
2021-01-27,Trade,SELL_TO_CLOSE,BB    220121C00012500,Equity Option,Sold 4 BB 01/21/22 Call 12.50 @ 18.21,7284.0,4.0,1821.0,0.0,-0.718,100.0,BB,2022-01-21,12.5,CALL,126422225.0
2021-01-27,Trade,BUY_TO_CLOSE,BB    220121C00020000,Equity Option,Bought 2 BB 01/21/22 Call 20.00 @ 16.72,-3344.0,2.0,-1672.0,0.0,-0.27,100.0,BB,2022-01-21,20.0,CALL,126422225.0
2021-01-27,Trade,BUY_TO_CLOSE,AMC   220121C00004500,Equity Option,Bought 2 AMC 01/21/22 Call 4.50 @ 12.45,-2490.0,2.0,-1245.0,0.0,-0.27,100.0,AMC,2022-01-21,4.5,CALL,126387158.0
2021-01-27,Trade,SELL_TO_CLOSE,AMC   220121C00003000,Equity Option,Sold 6 AMC 01/21/22 Call 3.00 @ 12.65,7590.0,6.0,1265.0,0.0,-0.992,100.0,AMC,2022-01-21,3.0,CALL,126387158.0
2021-01-27,Trade,SELL_TO_OPEN,BB    210205C00040000,Equity Option,Sold 1 BB 02/05/21 Call 40.00 @ 4.10,410.0,1.0,410.0,-1.0,-0.152,100.0,BB,2021-02-05,40.0,CALL,126277474.0
2021-01-27,Trade,BUY_TO_CLOSE,SPY   210129P00376000,Equity Option,Bought 1 SPY 01/29/21 Put 376.00 @ 3.12,-312.0,1.0,-312.0,0.0,-0.14,100.0,SPY,2021-01-29,376.0,PUT,126142241.0
2021-01-27,Trade,BUY_TO_CLOSE,SPY   210129C00388000,Equity Option,Bought 1 SPY 01/29/21 Call 388.00 @ 0.33,-33.0,1.0,-33.0,0.0,-0.14,100.0,SPY,2021-01-29,388.0,CALL,126142241.0
2021-01-27,Trade,SELL_TO_OPEN,SPY   210201P00373000,Equity Option,Sold 1 SPY 02/01/21 Put 373.00 @ 2.79,279.0,1.0,279.0,-1.0,-0.152,100.0,SPY,2021-02-01,373.0,PUT,126142241.0
2021-01-27,Trade,SELL_TO_OPEN,SPY   210201C00385000,Equity Option,Sold 1 SPY 02/01/21 Call 385.00 @ 1.16,116.0,1.0,116.0,-1.0,-0.152,100.0,SPY,2021-02-01,385.0,CALL,126142241.0
2021-01-26,Trade,SELL_TO_OPEN,AAPL  210205C00136000,Equity Option,Sold 1 AAPL 02/05/21 Call 136.00 @ 9.85,985.0,1.0,985.0,-1.0,-0.172,100.0,AAPL,2021-02-05,136.0,CALL,126068822.0
2021-01-26,Trade,BUY_TO_CLOSE,AAPL  210129C00133000,Equity Option,Bought 1 AAPL 01/29/21 Call 133.00 @ 11.10,-1110.0,1.0,-1110.0,0.0,-0.14,100.0,AAPL,2021-01-29,133.0,CALL,126068822.0
2021-01-26,Trade,BUY_TO_OPEN,SPY   210129P00363000,Equity Option,Bought 2 SPY 01/29/21 Put 363.00 @ 0.10,-20.0,2.0,-10.0,-2.0,-0.27,100.0,SPY,2021-01-29,363.0,PUT,126049406.0
2021-01-26,Trade,SELL_TO_OPEN,SPY   210129P00373000,Equity Option,Sold 2 SPY 01/29/21 Put 373.00 @ 0.34,68.0,2.0,34.0,-2.0,-0.284,100.0,SPY,2021-01-29,373.0,PUT,126049406.0
2021-01-26,Trade,BUY_TO_OPEN,SPY   210205P00352500,Equity Option,Bought 1 SPY 02/05/21 Put 352.50 @ 0.40,-40.0,1.0,-40.0,-1.0,-0.14,100.0,SPY,2021-02-05,352.5,PUT,126002657.0
2021-01-26,Trade,SELL_TO_OPEN,SPY   210205P00360000,Equity Option,Sold 1 SPY 02/05/21 Put 360.00 @ 0.63,63.0,1.0,63.0,-1.0,-0.152,100.0,SPY,2021-02-05,360.0,PUT,126002657.0
2021-01-26,Trade,BUY_TO_CLOSE,PLTR  210820C00026000,Equity Option,Bought 1 PLTR 08/20/21 Call 26.00 @ 14.07,-1407.0,1.0,-1407.0,0.0,-0.14,100.0,PLTR,2021-08-20,26.0,CALL,125957242.0
2021-01-25,Trade,SELL_TO_OPEN,SPY   210129C00388000,Equity Option,Sold 1 SPY 01/29/21 Call 388.00 @ 0.86,86.0,1.0,86.0,-1.0,-0.152,100.0,SPY,2021-01-29,388.0,CALL,125759080.0
2021-01-25,Trade,SELL_TO_OPEN,SPY   210129P00376000,Equity Option,Sold 1 SPY 01/29/21 Put 376.00 @ 0.95,95.0,1.0,95.0,-1.0,-0.152,100.0,SPY,2021-01-29,376.0,PUT,125759080.0
2021-01-25,Trade,BUY_TO_CLOSE,GME   210129P00065000,Equity Option,Bought 1 GME 01/29/21 Put 65.00 @ 11.75,-1175.0,1.0,-1175.0,0.0,-0.14,100.0,GME,2021-01-29,65.0,PUT,125751872.0
2021-01-25,Trade,BUY_TO_CLOSE,SPY   210226P00315000,Equity Option,Bought 1 SPY 02/26/21 Put 315.00 @ 0.73,-73.0,1.0,-73.0,0.0,-0.14,100.0,SPY,2021-02-26,315.0,PUT,125751417.0
2021-01-25,Trade,BUY_TO_CLOSE,SPY   210226C00410000,Equity Option,Bought 1 SPY 02/26/21 Call 410.00 @ 0.44,-44.0,1.0,-44.0,0.0,-0.14,100.0,SPY,2021-02-26,410.0,CALL,125751417.0
2021-01-25,Trade,BUY_TO_CLOSE,AAPL  210416C00122500,Equity Option,Bought 1 AAPL 04/16/21 Call 122.50 @ 23.19,-2319.0,1.0,-2319.0,0.0,-0.14,100.0,AAPL,2021-04-16,122.5,CALL,125751178.0
2021-01-25,Trade,BUY_TO_OPEN,AMC   220121C00003000,Equity Option,Bought 9 AMC 01/21/22 Call 3.00 @ 2.86,-2574.0,9.0,-286.0,-7.0,-1.22,100.0,AMC,2022-01-21,3.0,CALL,125476063.0
2021-01-25,Trade,BUY_TO_OPEN,AMC   220121C00003000,Equity Option,Bought 3 AMC 01/21/22 Call 3.00 @ 2.87,-861.0,3.0,-287.0,-3.0,-0.41,100.0,AMC,2022-01-21,3.0,CALL,125476063.0
2021-01-25,Trade,SELL_TO_OPEN,AMC   220121C00004500,Equity Option,Sold 7 AMC 01/21/22 Call 4.50 @ 2.50,1750.0,7.0,250.0,-7.0,-1.004,100.0,AMC,2022-01-21,4.5,CALL,125476063.0
2021-01-25,Trade,SELL_TO_OPEN,GME   210129P00065000,Equity Option,Sold 1 GME 01/29/21 Put 65.00 @ 8.65,865.0,1.0,865.0,-1.0,-0.162,100.0,GME,2021-01-29,65.0,PUT,125467910.0
2021-01-25,Trade,BUY_TO_CLOSE,GME   210129P00045000,Equity Option,Bought 1 GME 01/29/21 Put 45.00 @ 2.44,-244.0,1.0,-244.0,0.0,-0.14,100.0,GME,2021-01-29,45.0,PUT,125467910.0
2021-01-25,Trade,BUY_TO_CLOSE,GME   210129C00060000,Equity Option,Bought 1 GME 01/29/21 Call 60.00 @ 33.15,-3315.0,1.0,-3315.0,0.0,-0.14,100.0,GME,2021-01-29,60.0,CALL,125467022.0
2021-01-25,Trade,BUY_TO_CLOSE,AMD   210129P00091500,Equity Option,Bought 1 AMD 01/29/21 Put 91.50 @ 2.38,-238.0,1.0,-238.0,0.0,-0.14,100.0,AMD,2021-01-29,91.5,PUT,125445669.0
2021-01-25,Trade,BUY_TO_OPEN,BB    220121C00012500,Equity Option,Bought 2 BB 01/21/22 Call 12.50 @ 10.91,-2182.0,2.0,-1091.0,-2.0,-0.27,100.0,BB,2022-01-21,12.5,CALL,125441715.0
2021-01-25,Trade,BUY_TO_OPEN,BB    220121C00012500,Equity Option,Bought 2 BB 01/21/22 Call 12.50 @ 10.92,-2184.0,2.0,-1092.0,-2.0,-0.27,100.0,BB,2022-01-21,12.5,CALL,125441715.0
2021-01-25,Trade,SELL_TO_OPEN,BB    220121C00020000,Equity Option,Sold 2 BB 01/21/22 Call 20.00 @ 8.68,1736.0,2.0,868.0,-2.0,-0.314,100.0,BB,2022-01-21,20.0,CALL,125441715.0
2021-01-22,Trade,SELL_TO_OPEN,AMD   210129P00091500,Equity Option,Sold 1 AMD 01/29/21 Put 91.50 @ 3.30,330.0,1.0,330.0,-1.0,-0.152,100.0,AMD,2021-01-29,91.5,PUT,125363991.0
2021-01-22,Trade,BUY_TO_CLOSE,AMD   210219P00087000,Equity Option,Bought 1 AMD 02/19/21 Put 87.00 @ 3.20,-320.0,1.0,-320.0,0.0,-0.14,100.0,AMD,2021-02-19,87.0,PUT,125363991.0
2021-01-22,Trade,SELL_TO_CLOSE,SPY   210122C00386000,Equity Option,Sold 5 SPY 01/22/21 Call 386.00 @ 0.01,5.0,5.0,1.0,0.0,-0.7,100.0,SPY,2021-01-22,386.0,CALL,125226120.0
2021-01-22,Trade,BUY_TO_CLOSE,SPY   210122C00384000,Equity Option,Bought 5 SPY 01/22/21 Call 384.00 @ 0.14,-70.0,5.0,-14.0,0.0,-0.68,100.0,SPY,2021-01-22,384.0,CALL,125226120.0
2021-01-22,Trade,BUY_TO_CLOSE,GME   210129P00040000,Equity Option,Bought 1 GME 01/29/21 Put 40.00 @ 2.50,-250.0,1.0,-250.0,0.0,-0.14,100.0,GME,2021-01-29,40.0,PUT,125247405.0
2021-01-22,Trade,SELL_TO_OPEN,GME   210129P00045000,Equity Option,Sold 1 GME 01/29/21 Put 45.00 @ 4.22,422.0,1.0,422.0,-1.0,-0.152,100.0,GME,2021-01-29,45.0,PUT,125247405.0
2021-01-22,Trade,SELL_TO_OPEN,GME   210129C00060000,Equity Option,Sold 1 GME 01/29/21 Call 60.00 @ 5.17,517.0,1.0,517.0,-1.0,-0.162,100.0,GME,2021-01-29,60.0,CALL,125247405.0
2021-01-22,Trade,BUY_TO_CLOSE,GME   210129C00055000,Equity Option,Bought 1 GME 01/29/21 Call 55.00 @ 6.77,-677.0,1.0,-677.0,0.0,-0.14,100.0,GME,2021-01-29,55.0,CALL,125247405.0
2021-01-22,Trade,BUY_TO_CLOSE,GME   210129P00035000,Equity Option,Bought 1 GME 01/29/21 Put 35.00 @ 1.27,-127.0,1.0,-127.0,0.0,-0.14,100.0,GME,2021-01-29,35.0,PUT,125220780.0
2021-01-22,Trade,SELL_TO_OPEN,GME   210129P00040000,Equity Option,Sold 1 GME 01/29/21 Put 40.00 @ 2.47,247.0,1.0,247.0,-1.0,-0.152,100.0,GME,2021-01-29,40.0,PUT,125220780.0
2021-01-21,Trade,SELL_TO_OPEN,GME   210129C00055000,Equity Option,Sold 1 GME 01/29/21 Call 55.00 @ 1.16,116.0,1.0,116.0,-1.0,-0.152,100.0,GME,2021-01-29,55.0,CALL,124959010.0
2021-01-21,Trade,SELL_TO_OPEN,GME   210129P00035000,Equity Option,Sold 1 GME 01/29/21 Put 35.00 @ 2.59,259.0,1.0,259.0,-1.0,-0.152,100.0,GME,2021-01-29,35.0,PUT,124959010.0
2021-01-21,Trade,BUY_TO_CLOSE,AAPL  210219C00120000,Equity Option,Bought 1 AAPL 02/19/21 Call 120.00 @ 17.10,-1710.0,1.0,-1710.0,0.0,-0.14,100.0,AAPL,2021-02-19,120.0,CALL,124946524.0
2021-01-21,Trade,SELL_TO_OPEN,AAPL  210416C00122500,Equity Option,Sold 1 AAPL 04/16/21 Call 122.50 @ 17.80,1780.0,1.0,1780.0,-1.0,-0.182,100.0,AAPL,2021-04-16,122.5,CALL,124946524.0
2021-01-20,Trade,BUY_TO_CLOSE,T     210319C00030000,Equity Option,Bought 2 T 03/19/21 Call 30.00 @ 0.66,-132.0,2.0,-66.0,0.0,-0.27,100.0,T,2021-03-19,30.0,CALL,124673374.0
2021-01-19,Trade,SELL_TO_OPEN,SPY   210226C00410000,Equity Option,Sold 1 SPY 02/26/21 Call 410.00 @ 0.27,27.0,1.0,27.0,-1.0,-0.152,100.0,SPY,2021-02-26,410.0,CALL,124348286.0
2021-01-19,Trade,SELL_TO_OPEN,SPY   210226P00315000,Equity Option,Sold 1 SPY 02/26/21 Put 315.00 @ 1.00,100.0,1.0,100.0,-1.0,-0.152,100.0,SPY,2021-02-26,315.0,PUT,124348286.0
2021-01-19,Trade,SELL_TO_OPEN,AMD   210219P00087000,Equity Option,Sold 1 AMD 02/19/21 Put 87.00 @ 5.06,506.0,1.0,506.0,-1.0,-0.162,100.0,AMD,2021-02-19,87.0,PUT,124347643.0
2021-01-19,Trade,BUY_TO_CLOSE,AMD   210122P00092000,Equity Option,Bought 1 AMD 01/22/21 Put 92.00 @ 4.49,-449.0,1.0,-449.0,0.0,-0.14,100.0,AMD,2021-01-22,92.0,PUT,124347643.0
2021-01-19,Trade,BUY_TO_CLOSE,AAPL  210122C00131000,Equity Option,Bought 1 AAPL 01/22/21 Call 131.00 @ 0.53,-53.0,1.0,-53.0,0.0,-0.14,100.0,AAPL,2021-01-22,131.0,CALL,124342888.0
2021-01-19,Trade,SELL_TO_OPEN,AAPL  210129C00133000,Equity Option,Sold 1 AAPL 01/29/21 Call 133.00 @ 1.94,194.0,1.0,194.0,-1.0,-0.152,100.0,AAPL,2021-01-29,133.0,CALL,124342888.0
2021-01-15,Trade,SELL_TO_OPEN,AMD   210122P00092000,Equity Option,Sold 1 AMD 01/22/21 Put 92.00 @ 4.39,439.0,1.0,439.0,-1.0,-0.152,100.0,AMD,2021-01-22,92.0,PUT,124169255.0
2021-01-15,Trade,BUY_TO_CLOSE,AMD   210115P00092500,Equity Option,Bought 1 AMD 01/15/21 Put 92.50 @ 4.08,-408.0,1.0,-408.0,0.0,-0.14,100.0,AMD,2021-01-15,92.5,PUT,124169255.0
2021-01-15,Trade,BUY_TO_OPEN,SPY   210122P00364000,Equity Option,Bought 5 SPY 01/22/21 Put 364.00 @ 0.93,-465.0,5.0,-93.0,-5.0,-0.68,100.0,SPY,2021-01-22,364.0,PUT,124152262.0
2021-01-15,Trade,BUY_TO_OPEN,SPY   210122C00386000,Equity Option,Bought 5 SPY 01/22/21 Call 386.00 @ 0.29,-145.0,5.0,-29.0,-5.0,-0.68,100.0,SPY,2021-01-22,386.0,CALL,124152262.0
2021-01-15,Trade,SELL_TO_OPEN,SPY   210122P00366000,Equity Option,Sold 5 SPY 01/22/21 Put 366.00 @ 1.12,560.0,5.0,112.0,-5.0,-0.71,100.0,SPY,2021-01-22,366.0,PUT,124152262.0
2021-01-15,Trade,SELL_TO_OPEN,SPY   210122C00384000,Equity Option,Sold 5 SPY 01/22/21 Call 384.00 @ 0.55,275.0,5.0,55.0,-5.0,-0.7,100.0,SPY,2021-01-22,384.0,CALL,124152262.0
2021-01-15,Trade,SELL_TO_OPEN,GME   210122P00022000,Equity Option,Sold 1 GME 01/22/21 Put 22.00 @ 0.48,48.0,1.0,48.0,-1.0,-0.152,100.0,GME,2021-01-22,22.0,PUT,124037029.0
2021-01-15,Trade,BUY_TO_OPEN,GME   210122P00021000,Equity Option,Bought 1 GME 01/22/21 Put 21.00 @ 0.38,-38.0,1.0,-38.0,-1.0,-0.14,100.0,GME,2021-01-22,21.0,PUT,124037029.0
2021-01-15,Trade,SELL_TO_OPEN,GME   210122P00022000,Equity Option,Sold 1 GME 01/22/21 Put 22.00 @ 0.44,44.0,1.0,44.0,-1.0,-0.152,100.0,GME,2021-01-22,22.0,PUT,124037029.0
2021-01-15,Trade,BUY_TO_OPEN,GME   210122P00021000,Equity Option,Bought 1 GME 01/22/21 Put 21.00 @ 0.34,-34.0,1.0,-34.0,-1.0,-0.14,100.0,GME,2021-01-22,21.0,PUT,124037029.0
2021-01-15,Trade,SELL_TO_OPEN,GME   210122P00022000,Equity Option,Sold 1 GME 01/22/21 Put 22.00 @ 0.44,44.0,1.0,44.0,-1.0,-0.152,100.0,GME,2021-01-22,22.0,PUT,124037029.0
2021-01-15,Trade,BUY_TO_OPEN,GME   210122P00021000,Equity Option,Bought 1 GME 01/22/21 Put 21.00 @ 0.34,-34.0,1.0,-34.0,-1.0,-0.14,100.0,GME,2021-01-22,21.0,PUT,124037029.0
2021-01-15,Trade,SELL_TO_OPEN,GME   210122P00022000,Equity Option,Sold 1 GME 01/22/21 Put 22.00 @ 0.44,44.0,1.0,44.0,-1.0,-0.152,100.0,GME,2021-01-22,22.0,PUT,124037029.0
2021-01-15,Trade,BUY_TO_OPEN,GME   210122P00021000,Equity Option,Bought 1 GME 01/22/21 Put 21.00 @ 0.34,-34.0,1.0,-34.0,-1.0,-0.14,100.0,GME,2021-01-22,21.0,PUT,124037029.0
2021-01-15,Trade,SELL_TO_OPEN,GME   210122P00022000,Equity Option,Sold 1 GME 01/22/21 Put 22.00 @ 0.44,44.0,1.0,44.0,-1.0,-0.152,100.0,GME,2021-01-22,22.0,PUT,124037029.0
2021-01-15,Trade,BUY_TO_OPEN,GME   210122P00021000,Equity Option,Bought 1 GME 01/22/21 Put 21.00 @ 0.34,-34.0,1.0,-34.0,-1.0,-0.14,100.0,GME,2021-01-22,21.0,PUT,124037029.0
2021-01-15,Trade,SELL_TO_OPEN,GME   210122P00022000,Equity Option,Sold 1 GME 01/22/21 Put 22.00 @ 0.44,44.0,1.0,44.0,-1.0,-0.152,100.0,GME,2021-01-22,22.0,PUT,124037029.0
2021-01-15,Trade,BUY_TO_OPEN,GME   210122P00021000,Equity Option,Bought 1 GME 01/22/21 Put 21.00 @ 0.34,-34.0,1.0,-34.0,-1.0,-0.14,100.0,GME,2021-01-22,21.0,PUT,124037029.0
2021-01-15,Trade,SELL_TO_OPEN,GME   210122P00022000,Equity Option,Sold 1 GME 01/22/21 Put 22.00 @ 0.44,44.0,1.0,44.0,-1.0,-0.152,100.0,GME,2021-01-22,22.0,PUT,124037029.0
2021-01-15,Trade,BUY_TO_OPEN,GME   210122P00021000,Equity Option,Bought 1 GME 01/22/21 Put 21.00 @ 0.34,-34.0,1.0,-34.0,-1.0,-0.14,100.0,GME,2021-01-22,21.0,PUT,124037029.0
2021-01-15,Trade,SELL_TO_OPEN,GME   210122P00022000,Equity Option,Sold 1 GME 01/22/21 Put 22.00 @ 0.44,44.0,1.0,44.0,-1.0,-0.152,100.0,GME,2021-01-22,22.0,PUT,124037029.0
2021-01-15,Trade,BUY_TO_OPEN,GME   210122P00021000,Equity Option,Bought 1 GME 01/22/21 Put 21.00 @ 0.34,-34.0,1.0,-34.0,-1.0,-0.14,100.0,GME,2021-01-22,21.0,PUT,124037029.0
2021-01-15,Trade,SELL_TO_OPEN,PLTR  210122P00024000,Equity Option,Sold 1 PLTR 01/22/21 Put 24.00 @ 0.30,30.0,1.0,30.0,-1.0,-0.152,100.0,PLTR,2021-01-22,24.0,PUT,124035772.0
2021-01-15,Trade,BUY_TO_OPEN,PLTR  210122P00022500,Equity Option,Bought 1 PLTR 01/22/21 Put 22.50 @ 0.10,-10.0,1.0,-10.0,-1.0,-0.14,100.0,PLTR,2021-01-22,22.5,PUT,124035772.0
2021-01-15,Trade,SELL_TO_OPEN,PLTR  210122P00024000,Equity Option,Sold 4 PLTR 01/22/21 Put 24.00 @ 0.30,120.0,4.0,30.0,-4.0,-0.558,100.0,PLTR,2021-01-22,24.0,PUT,124035772.0
2021-01-15,Trade,BUY_TO_OPEN,PLTR  210122P00022500,Equity Option,Bought 4 PLTR 01/22/21 Put 22.50 @ 0.10,-40.0,4.0,-10.0,-4.0,-0.54,100.0,PLTR,2021-01-22,22.5,PUT,124035772.0
2021-01-15,Trade,SELL_TO_OPEN,PLTR  210122P00024000,Equity Option,Sold 1 PLTR 01/22/21 Put 24.00 @ 0.30,30.0,1.0,30.0,-1.0,-0.152,100.0,PLTR,2021-01-22,24.0,PUT,124035772.0
2021-01-15,Trade,BUY_TO_OPEN,PLTR  210122P00022500,Equity Option,Bought 1 PLTR 01/22/21 Put 22.50 @ 0.10,-10.0,1.0,-10.0,-1.0,-0.14,100.0,PLTR,2021-01-22,22.5,PUT,124035772.0
2021-01-15,Trade,SELL_TO_OPEN,PLTR  210122P00024000,Equity Option,Sold 2 PLTR 01/22/21 Put 24.00 @ 0.30,60.0,2.0,30.0,-2.0,-0.284,100.0,PLTR,2021-01-22,24.0,PUT,124035772.0
2021-01-15,Trade,BUY_TO_OPEN,PLTR  210122P00022500,Equity Option,Bought 2 PLTR 01/22/21 Put 22.50 @ 0.10,-20.0,2.0,-10.0,-2.0,-0.27,100.0,PLTR,2021-01-22,22.5,PUT,124035772.0
2021-01-15,Trade,SELL_TO_OPEN,PLTR  210122P00024000,Equity Option,Sold 1 PLTR 01/22/21 Put 24.00 @ 0.30,30.0,1.0,30.0,-1.0,-0.152,100.0,PLTR,2021-01-22,24.0,PUT,124035772.0
2021-01-15,Trade,BUY_TO_OPEN,PLTR  210122P00022500,Equity Option,Bought 1 PLTR 01/22/21 Put 22.50 @ 0.10,-10.0,1.0,-10.0,-1.0,-0.14,100.0,PLTR,2021-01-22,22.5,PUT,124035772.0
2021-01-15,Trade,SELL_TO_OPEN,PLTR  210122P00024000,Equity Option,Sold 1 PLTR 01/22/21 Put 24.00 @ 0.30,30.0,1.0,30.0,-1.0,-0.152,100.0,PLTR,2021-01-22,24.0,PUT,124035772.0
2021-01-15,Trade,BUY_TO_OPEN,PLTR  210122P00022500,Equity Option,Bought 1 PLTR 01/22/21 Put 22.50 @ 0.10,-10.0,1.0,-10.0,-1.0,-0.14,100.0,PLTR,2021-01-22,22.5,PUT,124035772.0
2021-01-15,Trade,BUY_TO_CLOSE,AAPL  210122C00135000,Equity Option,Bought 1 AAPL 01/22/21 Call 135.00 @ 0.66,-66.0,1.0,-66.0,0.0,-0.14,100.0,AAPL,2021-01-22,135.0,CALL,123953024.0
2021-01-15,Trade,SELL_TO_OPEN,AAPL  210122C00131000,Equity Option,Sold 1 AAPL 01/22/21 Call 131.00 @ 1.57,157.0,1.0,157.0,-1.0,-0.152,100.0,AAPL,2021-01-22,131.0,CALL,123953024.0
2021-01-15,Trade,SELL_TO_CLOSE,SPY   210115C00382000,Equity Option,Sold 1 SPY 01/15/21 Call 382.00 @ 0.03,3.0,1.0,3.0,0.0,-0.152,100.0,SPY,2021-01-15,382.0,CALL,122303203.0
2021-01-15,Trade,BUY_TO_CLOSE,SPY   210115C00379000,Equity Option,Bought 1 SPY 01/15/21 Call 379.00 @ 0.26,-26.0,1.0,-26.0,0.0,-0.14,100.0,SPY,2021-01-15,379.0,CALL,122303203.0
2021-01-14,Trade,BUY_TO_CLOSE,GME   210115P00023500,Equity Option,Bought 9 GME 01/15/21 Put 23.50 @ 0.06,-54.0,9.0,-6.0,0.0,-1.22,100.0,GME,2021-01-15,23.5,PUT,123441053.0
2021-01-14,Trade,SELL_TO_CLOSE,GME   210115P00022000,Equity Option,Sold 9 GME 01/15/21 Put 22.00 @ 0.03,27.0,9.0,3.0,0.0,-1.248,100.0,GME,2021-01-15,22.0,PUT,123441053.0
2021-01-14,Trade,BUY_TO_CLOSE,GME   210115P00025000,Equity Option,Bought 1 GME 01/15/21 Put 25.00 @ 0.26,-26.0,1.0,-26.0,0.0,-0.14,100.0,GME,2021-01-15,25.0,PUT,123441251.0
2021-01-14,Trade,SELL_TO_CLOSE,GME   210115P00023000,Equity Option,Sold 6 GME 01/15/21 Put 23.00 @ 0.11,66.0,6.0,11.0,0.0,-0.832,100.0,GME,2021-01-15,23.0,PUT,123441251.0
2021-01-14,Trade,SELL_TO_CLOSE,GME   210115P00023000,Equity Option,Sold 1 GME 01/15/21 Put 23.00 @ 0.11,11.0,1.0,11.0,0.0,-0.152,100.0,GME,2021-01-15,23.0,PUT,123441251.0
2021-01-14,Trade,BUY_TO_CLOSE,GME   210115P00025000,Equity Option,Bought 6 GME 01/15/21 Put 25.00 @ 0.26,-156.0,6.0,-26.0,0.0,-0.81,100.0,GME,2021-01-15,25.0,PUT,123441251.0
2021-01-13,Trade,BUY_TO_OPEN,GME   210115P00023000,Equity Option,Bought 1 GME 01/15/21 Put 23.00 @ 0.55,-55.0,1.0,-55.0,-1.0,-0.14,100.0,GME,2021-01-15,23.0,PUT,123434611.0
2021-01-13,Trade,SELL_TO_OPEN,GME   210115P00025000,Equity Option,Sold 1 GME 01/15/21 Put 25.00 @ 0.95,95.0,1.0,95.0,-1.0,-0.152,100.0,GME,2021-01-15,25.0,PUT,123434611.0
2021-01-13,Trade,BUY_TO_OPEN,GME   210115P00023000,Equity Option,Bought 1 GME 01/15/21 Put 23.00 @ 0.55,-55.0,1.0,-55.0,-1.0,-0.14,100.0,GME,2021-01-15,23.0,PUT,123434611.0
2021-01-13,Trade,SELL_TO_OPEN,GME   210115P00025000,Equity Option,Sold 1 GME 01/15/21 Put 25.00 @ 0.95,95.0,1.0,95.0,-1.0,-0.152,100.0,GME,2021-01-15,25.0,PUT,123434611.0
2021-01-13,Trade,BUY_TO_OPEN,GME   210115P00023000,Equity Option,Bought 1 GME 01/15/21 Put 23.00 @ 0.55,-55.0,1.0,-55.0,-1.0,-0.14,100.0,GME,2021-01-15,23.0,PUT,123434611.0
2021-01-13,Trade,SELL_TO_OPEN,GME   210115P00025000,Equity Option,Sold 1 GME 01/15/21 Put 25.00 @ 0.95,95.0,1.0,95.0,-1.0,-0.152,100.0,GME,2021-01-15,25.0,PUT,123434611.0
2021-01-13,Trade,BUY_TO_OPEN,GME   210115P00023000,Equity Option,Bought 1 GME 01/15/21 Put 23.00 @ 0.55,-55.0,1.0,-55.0,-1.0,-0.14,100.0,GME,2021-01-15,23.0,PUT,123434611.0
2021-01-13,Trade,SELL_TO_OPEN,GME   210115P00025000,Equity Option,Sold 1 GME 01/15/21 Put 25.00 @ 0.95,95.0,1.0,95.0,-1.0,-0.152,100.0,GME,2021-01-15,25.0,PUT,123434611.0
2021-01-13,Trade,BUY_TO_OPEN,GME   210115P00023000,Equity Option,Bought 1 GME 01/15/21 Put 23.00 @ 0.55,-55.0,1.0,-55.0,-1.0,-0.14,100.0,GME,2021-01-15,23.0,PUT,123434611.0
2021-01-13,Trade,SELL_TO_OPEN,GME   210115P00025000,Equity Option,Sold 1 GME 01/15/21 Put 25.00 @ 0.95,95.0,1.0,95.0,-1.0,-0.152,100.0,GME,2021-01-15,25.0,PUT,123434611.0
2021-01-13,Trade,BUY_TO_OPEN,GME   210115P00023000,Equity Option,Bought 1 GME 01/15/21 Put 23.00 @ 0.55,-55.0,1.0,-55.0,-1.0,-0.14,100.0,GME,2021-01-15,23.0,PUT,123434611.0
2021-01-13,Trade,SELL_TO_OPEN,GME   210115P00025000,Equity Option,Sold 1 GME 01/15/21 Put 25.00 @ 0.95,95.0,1.0,95.0,-1.0,-0.152,100.0,GME,2021-01-15,25.0,PUT,123434611.0
2021-01-13,Trade,BUY_TO_OPEN,GME   210115P00023000,Equity Option,Bought 1 GME 01/15/21 Put 23.00 @ 0.55,-55.0,1.0,-55.0,-1.0,-0.14,100.0,GME,2021-01-15,23.0,PUT,123434611.0
2021-01-13,Trade,SELL_TO_OPEN,GME   210115P00025000,Equity Option,Sold 1 GME 01/15/21 Put 25.00 @ 0.95,95.0,1.0,95.0,-1.0,-0.152,100.0,GME,2021-01-15,25.0,PUT,123434611.0
2021-01-13,Trade,SELL_TO_OPEN,GME   210115P00023500,Equity Option,Sold 3 GME 01/15/21 Put 23.50 @ 0.68,204.0,3.0,68.0,0.0,-0.426,100.0,GME,2021-01-15,23.5,PUT,123431119.0
2021-01-13,Trade,BUY_TO_OPEN,GME   210115P00022000,Equity Option,Bought 3 GME 01/15/21 Put 22.00 @ 0.46,-138.0,3.0,-46.0,0.0,-0.41,100.0,GME,2021-01-15,22.0,PUT,123431119.0
2021-01-13,Trade,SELL_TO_OPEN,GME   210115P00023500,Equity Option,Sold 17 GME 01/15/21 Put 23.50 @ 0.71,1207.0,17.0,71.0,-10.0,-2.374,100.0,GME,2021-01-15,23.5,PUT,123431119.0
2021-01-13,Trade,BUY_TO_OPEN,GME   210115P00022000,Equity Option,Bought 17 GME 01/15/21 Put 22.00 @ 0.46,-782.0,17.0,-46.0,-10.0,-2.31,100.0,GME,2021-01-15,22.0,PUT,123431119.0
2021-01-12,Trade,SELL_TO_OPEN,AMD   210115P00092500,Equity Option,Sold 1 AMD 01/15/21 Put 92.50 @ 0.84,84.0,1.0,84.0,-1.0,-0.152,100.0,AMD,2021-01-15,92.5,PUT,123192687.0
2021-01-12,Trade,SELL_TO_CLOSE,GME   210115C00015000,Equity Option,Sold 3 GME 01/15/21 Call 15.00 @ 5.13,1539.0,3.0,513.0,0.0,-0.456,100.0,GME,2021-01-15,15.0,CALL,122996224.0
2021-01-12,Trade,BUY_TO_CLOSE,GME   210115C00016000,Equity Option,Bought 3 GME 01/15/21 Call 16.00 @ 4.16,-1248.0,3.0,-416.0,0.0,-0.41,100.0,GME,2021-01-15,16.0,CALL,122996224.0
2021-01-08,Trade,BUY_TO_CLOSE,SPY   210115P00359000,Equity Option,Bought 3 SPY 01/15/21 Put 359.00 @ 0.41,-123.0,3.0,-41.0,0.0,-0.41,100.0,SPY,2021-01-15,359.0,PUT,122302660.0
2021-01-08,Trade,SELL_TO_CLOSE,SPY   210115P00356000,Equity Option,Sold 3 SPY 01/15/21 Put 356.00 @ 0.33,99.0,3.0,33.0,0.0,-0.426,100.0,SPY,2021-01-15,356.0,PUT,122302660.0
2021-01-06,Trade,BUY_TO_CLOSE,AAPL  210115C00137000,Equity Option,Bought 1 AAPL 01/15/21 Call 137.00 @ 0.48,-48.0,1.0,-48.0,0.0,-0.14,100.0,AAPL,2021-01-15,137.0,CALL,122038929.0
2021-01-06,Trade,SELL_TO_OPEN,AAPL  210122C00135000,Equity Option,Sold 1 AAPL 01/22/21 Call 135.00 @ 1.27,127.0,1.0,127.0,-1.0,-0.152,100.0,AAPL,2021-01-22,135.0,CALL,122038929.0
2021-01-06,Trade,SELL_TO_OPEN,SPY   210115P00359000,Equity Option,Sold 2 SPY 01/15/21 Put 359.00 @ 1.71,342.0,2.0,171.0,-2.0,-0.284,100.0,SPY,2021-01-15,359.0,PUT,122039350.0
2021-01-06,Trade,BUY_TO_OPEN,SPY   210115P00356000,Equity Option,Bought 2 SPY 01/15/21 Put 356.00 @ 1.43,-286.0,2.0,-143.0,-2.0,-0.27,100.0,SPY,2021-01-15,356.0,PUT,122039350.0
2021-01-06,Trade,SELL_TO_CLOSE,SPY   210115P00356000,Equity Option,Sold 1 SPY 01/15/21 Put 356.00 @ 0.64,64.0,1.0,64.0,0.0,-0.152,100.0,SPY,2021-01-15,356.0,PUT,121350113.0
2021-01-06,Trade,BUY_TO_CLOSE,SPY   210115P00359000,Equity Option,Bought 1 SPY 01/15/21 Put 359.00 @ 0.79,-79.0,1.0,-79.0,0.0,-0.14,100.0,SPY,2021-01-15,359.0,PUT,121350113.0
2021-01-04,Trade,SELL_TO_OPEN,SPY   210115C00379000,Equity Option,Sold 1 SPY 01/15/21 Call 379.00 @ 1.03,103.0,1.0,103.0,-1.0,-0.152,100.0,SPY,2021-01-15,379.0,CALL,121425850.0
2021-01-04,Trade,BUY_TO_OPEN,SPY   210115C00382000,Equity Option,Bought 1 SPY 01/15/21 Call 382.00 @ 0.60,-60.0,1.0,-60.0,-1.0,-0.14,100.0,SPY,2021-01-15,382.0,CALL,121425850.0
2021-01-04,Trade,BUY_TO_OPEN,SPY   210115P00356000,Equity Option,Bought 1 SPY 01/15/21 Put 356.00 @ 2.39,-239.0,1.0,-239.0,-1.0,-0.14,100.0,SPY,2021-01-15,356.0,PUT,121385029.0
2021-01-04,Trade,SELL_TO_OPEN,SPY   210115P00359000,Equity Option,Sold 1 SPY 01/15/21 Put 359.00 @ 2.89,289.0,1.0,289.0,-1.0,-0.152,100.0,SPY,2021-01-15,359.0,PUT,121385029.0
2021-01-04,Trade,BUY_TO_OPEN,SPY   210115P00356000,Equity Option,Bought 1 SPY 01/15/21 Put 356.00 @ 1.89,-189.0,1.0,-189.0,-1.0,-0.14,100.0,SPY,2021-01-15,356.0,PUT,121342360.0
2021-01-04,Trade,SELL_TO_OPEN,SPY   210115P00359000,Equity Option,Sold 1 SPY 01/15/21 Put 359.00 @ 2.26,226.0,1.0,226.0,-1.0,-0.152,100.0,SPY,2021-01-15,359.0,PUT,121342360.0
2021-01-04,Trade,BUY_TO_CLOSE,AAPL  210108C00138000,Equity Option,Bought 1 AAPL 01/08/21 Call 138.00 @ 0.36,-36.0,1.0,-36.0,0.0,-0.14,100.0,AAPL,2021-01-08,138.0,CALL,121342094.0
2021-01-04,Trade,SELL_TO_OPEN,AAPL  210115C00137000,Equity Option,Sold 1 AAPL 01/15/21 Call 137.00 @ 1.21,121.0,1.0,121.0,-1.0,-0.152,100.0,AAPL,2021-01-15,137.0,CALL,121342094.0
2020-12-31,Trade,SELL_TO_OPEN,T     210319C00030000,Equity Option,Sold 1 T 03/19/21 Call 30.00 @ 0.58,58.0,1.0,58.0,-1.0,-0.152,100.0,T,2021-03-19,30.0,CALL,121159358.0
2020-12-30,Trade,BUY_TO_CLOSE,AAPL  201231C00135000,Equity Option,Bought 1 AAPL 12/31/20 Call 135.00 @ 0.39,-39.0,1.0,-39.0,0.0,-0.14,100.0,AAPL,2020-12-31,135.0,CALL,120981716.0
2020-12-30,Trade,SELL_TO_OPEN,AAPL  210108C00138000,Equity Option,Sold 1 AAPL 01/08/21 Call 138.00 @ 1.26,126.0,1.0,126.0,-1.0,-0.152,100.0,AAPL,2021-01-08,138.0,CALL,120981716.0
2020-12-30,Trade,SELL_TO_OPEN,AAPL  210219C00120000,Equity Option,Sold 1 AAPL 02/19/21 Call 120.00 @ 16.05,1605.0,1.0,1605.0,-1.0,-0.182,100.0,AAPL,2021-02-19,120.0,CALL,120978773.0
2020-12-30,Trade,BUY_TO_CLOSE,AAPL  201231C00118000,Equity Option,Bought 1 AAPL 12/31/20 Call 118.00 @ 15.55,-1555.0,1.0,-1555.0,0.0,-0.14,100.0,AAPL,2020-12-31,118.0,CALL,120978773.0
2020-12-29,Trade,BUY_TO_CLOSE,T     210108C00029500,Equity Option,Bought 1 T 01/08/21 Call 29.50 @ 0.13,-13.0,1.0,-13.0,0.0,-0.14,100.0,T,2021-01-08,29.5,CALL,120753523.0
2020-12-29,Trade,SELL_TO_OPEN,T     210319C00030000,Equity Option,Sold 1 T 03/19/21 Call 30.00 @ 0.65,65.0,1.0,65.0,-1.0,-0.152,100.0,T,2021-03-19,30.0,CALL,120753523.0
2020-12-29,Trade,SELL_TO_OPEN,GME   210115C00016000,Equity Option,Sold 3 GME 01/15/21 Call 16.00 @ 4.55,1365.0,3.0,455.0,-3.0,-0.456,100.0,GME,2021-01-15,16.0,CALL,120736699.0
2020-12-29,Trade,BUY_TO_OPEN,GME   210115C00015000,Equity Option,Bought 3 GME 01/15/21 Call 15.00 @ 5.30,-1590.0,3.0,-530.0,-3.0,-0.41,100.0,GME,2021-01-15,15.0,CALL,120736699.0
2020-12-29,Trade,SELL_TO_CLOSE,CCL   210716C00022500,Equity Option,Sold 4 CCL 07/16/21 Call 22.50 @ 4.65,1860.0,4.0,465.0,0.0,-0.598,100.0,CCL,2021-07-16,22.5,CALL,119743575.0
2020-12-28,Trade,SELL_TO_OPEN,PLTR  210820C00026000,Equity Option,Sold 1 PLTR 08/20/21 Call 26.00 @ 7.35,735.0,1.0,735.0,-1.0,-0.162,100.0,PLTR,2021-08-20,26.0,CALL,120526607.0
2020-12-24,Trade,SELL_TO_OPEN,AAPL  201231C00135000,Equity Option,Sold 1 AAPL 12/31/20 Call 135.00 @ 0.88,88.0,1.0,88.0,-1.0,-0.152,100.0,AAPL,2020-12-31,135.0,CALL,120218151.0
2020-12-22,Trade,BUY_TO_OPEN,CCL   210716C00022500,Equity Option,Bought 5 CCL 07/16/21 Call 22.50 @ 3.70,-1850.0,5.0,-370.0,-5.0,-0.68,100.0,CCL,2021-07-16,22.5,CALL,119738627.0
2020-12-18,Trade,BUY_TO_CLOSE,T     201218C00029000,Equity Option,Bought 1 T 12/18/20 Call 29.00 @ 0.37,-37.0,1.0,-37.0,0.0,-0.14,100.0,T,2020-12-18,29.0,CALL,119123033.0
2020-12-18,Trade,SELL_TO_OPEN,T     210108C00029500,Equity Option,Sold 1 T 01/08/21 Call 29.50 @ 0.57,57.0,1.0,57.0,-1.0,-0.152,100.0,T,2021-01-08,29.5,CALL,119123033.0
2020-12-07,Trade,SELL_TO_OPEN,AAPL  201231C00118000,Equity Option,Sold 1 AAPL 12/31/20 Call 118.00 @ 7.28,728.0,1.0,728.0,-1.0,-0.162,100.0,AAPL,2020-12-31,118.0,CALL,116865272.0
2020-12-07,Trade,BUY_TO_CLOSE,AAPL  201218C00117000,Equity Option,Bought 1 AAPL 12/18/20 Call 117.00 @ 7.19,-719.0,1.0,-719.0,0.0,-0.14,100.0,AAPL,2020-12-18,117.0,CALL,116865272.0
2020-12-03,Trade,BUY_TO_CLOSE,AMD   201204P00096000,Equity Option,Bought 1 AMD 12/04/20 Put 96.00 @ 3.57,-357.0,1.0,-357.0,0.0,-0.14,100.0,AMD,2020-12-04,96.0,PUT,115875146.0
2020-12-03,Trade,SELL_TO_CLOSE,AMD   201204P00097000,Equity Option,Sold 1 AMD 12/04/20 Put 97.00 @ 4.52,452.0,1.0,452.0,0.0,-0.152,100.0,AMD,2020-12-04,97.0,PUT,115875146.0
2020-12-03,Trade,BUY_TO_CLOSE,AMD   201204P00096000,Equity Option,Bought 1 AMD 12/04/20 Put 96.00 @ 3.57,-357.0,1.0,-357.0,0.0,-0.14,100.0,AMD,2020-12-04,96.0,PUT,115875146.0
2020-12-03,Trade,SELL_TO_CLOSE,AMD   201204P00097000,Equity Option,Sold 1 AMD 12/04/20 Put 97.00 @ 4.52,452.0,1.0,452.0,0.0,-0.152,100.0,AMD,2020-12-04,97.0,PUT,115875146.0
2020-12-03,Trade,BUY_TO_CLOSE,AMD   201204P00096000,Equity Option,Bought 1 AMD 12/04/20 Put 96.00 @ 3.57,-357.0,1.0,-357.0,0.0,-0.14,100.0,AMD,2020-12-04,96.0,PUT,115875146.0
2020-12-03,Trade,SELL_TO_CLOSE,AMD   201204P00097000,Equity Option,Sold 1 AMD 12/04/20 Put 97.00 @ 4.52,452.0,1.0,452.0,0.0,-0.152,100.0,AMD,2020-12-04,97.0,PUT,115875146.0
2020-12-03,Trade,BUY_TO_CLOSE,AMD   201204P00096000,Equity Option,Bought 4 AMD 12/04/20 Put 96.00 @ 3.57,-1428.0,4.0,-357.0,0.0,-0.54,100.0,AMD,2020-12-04,96.0,PUT,115875146.0
2020-12-03,Trade,SELL_TO_CLOSE,AMD   201204P00097000,Equity Option,Sold 4 AMD 12/04/20 Put 97.00 @ 4.52,1808.0,4.0,452.0,0.0,-0.588,100.0,AMD,2020-12-04,97.0,PUT,115875146.0
2020-12-03,Trade,BUY_TO_CLOSE,AMD   201204P00096000,Equity Option,Bought 2 AMD 12/04/20 Put 96.00 @ 3.57,-714.0,2.0,-357.0,0.0,-0.27,100.0,AMD,2020-12-04,96.0,PUT,115875146.0
2020-12-03,Trade,SELL_TO_CLOSE,AMD   201204P00097000,Equity Option,Sold 2 AMD 12/04/20 Put 97.00 @ 4.52,904.0,2.0,452.0,0.0,-0.294,100.0,AMD,2020-12-04,97.0,PUT,115875146.0
2020-12-03,Trade,BUY_TO_CLOSE,AMD   201204P00096000,Equity Option,Bought 1 AMD 12/04/20 Put 96.00 @ 3.97,-397.0,1.0,-397.0,0.0,-0.14,100.0,AMD,2020-12-04,96.0,PUT,115875146.0
2020-12-03,Trade,SELL_TO_CLOSE,AMD   201204P00097000,Equity Option,Sold 1 AMD 12/04/20 Put 97.00 @ 4.92,492.0,1.0,492.0,0.0,-0.162,100.0,AMD,2020-12-04,97.0,PUT,115875146.0
2020-12-01,Trade,SELL_TO_CLOSE,AAPL  220121C00200000,Equity Option,Sold 5 AAPL 01/21/22 Call 200.00 @ 3.25,1625.0,5.0,325.0,0.0,-0.73,100.0,AAPL,2022-01-21,200.0,CALL,114577121.0
2020-11-30,Trade,SELL_TO_OPEN,AMD   201204P00096000,Equity Option,Sold 2 AMD 12/04/20 Put 96.00 @ 4.86,972.0,2.0,486.0,-2.0,-0.304,100.0,AMD,2020-12-04,96.0,PUT,115498062.0
2020-11-30,Trade,BUY_TO_OPEN,AMD   201204P00097000,Equity Option,Bought 2 AMD 12/04/20 Put 97.00 @ 5.67,-1134.0,2.0,-567.0,-2.0,-0.27,100.0,AMD,2020-12-04,97.0,PUT,115498062.0
2020-11-30,Trade,SELL_TO_OPEN,AMD   201204P00096000,Equity Option,Sold 1 AMD 12/04/20 Put 96.00 @ 5.17,517.0,1.0,517.0,-1.0,-0.162,100.0,AMD,2020-12-04,96.0,PUT,115498062.0
2020-11-30,Trade,BUY_TO_OPEN,AMD   201204P00097000,Equity Option,Bought 1 AMD 12/04/20 Put 97.00 @ 5.98,-598.0,1.0,-598.0,-1.0,-0.14,100.0,AMD,2020-12-04,97.0,PUT,115498062.0
2020-11-30,Trade,SELL_TO_OPEN,AMD   201204P00096000,Equity Option,Sold 1 AMD 12/04/20 Put 96.00 @ 5.17,517.0,1.0,517.0,-1.0,-0.162,100.0,AMD,2020-12-04,96.0,PUT,115498062.0
2020-11-30,Trade,BUY_TO_OPEN,AMD   201204P00097000,Equity Option,Bought 1 AMD 12/04/20 Put 97.00 @ 5.98,-598.0,1.0,-598.0,-1.0,-0.14,100.0,AMD,2020-12-04,97.0,PUT,115498062.0
2020-11-30,Trade,SELL_TO_OPEN,AMD   201204P00096000,Equity Option,Sold 1 AMD 12/04/20 Put 96.00 @ 5.17,517.0,1.0,517.0,-1.0,-0.162,100.0,AMD,2020-12-04,96.0,PUT,115498062.0
2020-11-30,Trade,BUY_TO_OPEN,AMD   201204P00097000,Equity Option,Bought 1 AMD 12/04/20 Put 97.00 @ 5.98,-598.0,1.0,-598.0,-1.0,-0.14,100.0,AMD,2020-12-04,97.0,PUT,115498062.0
2020-11-30,Trade,SELL_TO_OPEN,AMD   201204P00096000,Equity Option,Sold 1 AMD 12/04/20 Put 96.00 @ 5.17,517.0,1.0,517.0,-1.0,-0.162,100.0,AMD,2020-12-04,96.0,PUT,115498062.0
2020-11-30,Trade,BUY_TO_OPEN,AMD   201204P00097000,Equity Option,Bought 1 AMD 12/04/20 Put 97.00 @ 5.98,-598.0,1.0,-598.0,-1.0,-0.14,100.0,AMD,2020-12-04,97.0,PUT,115498062.0
2020-11-30,Trade,SELL_TO_OPEN,AMD   201204P00096000,Equity Option,Sold 1 AMD 12/04/20 Put 96.00 @ 5.17,517.0,1.0,517.0,-1.0,-0.162,100.0,AMD,2020-12-04,96.0,PUT,115498062.0
2020-11-30,Trade,BUY_TO_OPEN,AMD   201204P00097000,Equity Option,Bought 1 AMD 12/04/20 Put 97.00 @ 5.98,-598.0,1.0,-598.0,-1.0,-0.14,100.0,AMD,2020-12-04,97.0,PUT,115498062.0
2020-11-30,Trade,SELL_TO_OPEN,AMD   201204P00096000,Equity Option,Sold 1 AMD 12/04/20 Put 96.00 @ 5.21,521.0,1.0,521.0,-1.0,-0.162,100.0,AMD,2020-12-04,96.0,PUT,115498062.0
2020-11-30,Trade,BUY_TO_OPEN,AMD   201204P00097000,Equity Option,Bought 1 AMD 12/04/20 Put 97.00 @ 6.02,-602.0,1.0,-602.0,-1.0,-0.14,100.0,AMD,2020-12-04,97.0,PUT,115498062.0
2020-11-30,Trade,SELL_TO_OPEN,AMD   201204P00096000,Equity Option,Sold 1 AMD 12/04/20 Put 96.00 @ 5.21,521.0,1.0,521.0,-1.0,-0.162,100.0,AMD,2020-12-04,96.0,PUT,115498062.0
2020-11-30,Trade,BUY_TO_OPEN,AMD   201204P00097000,Equity Option,Bought 1 AMD 12/04/20 Put 97.00 @ 6.02,-602.0,1.0,-602.0,-1.0,-0.14,100.0,AMD,2020-12-04,97.0,PUT,115498062.0
2020-11-30,Trade,SELL_TO_OPEN,AMD   201204P00096000,Equity Option,Sold 1 AMD 12/04/20 Put 96.00 @ 5.21,521.0,1.0,521.0,-1.0,-0.162,100.0,AMD,2020-12-04,96.0,PUT,115498062.0
2020-11-30,Trade,BUY_TO_OPEN,AMD   201204P00097000,Equity Option,Bought 1 AMD 12/04/20 Put 97.00 @ 6.02,-602.0,1.0,-602.0,-1.0,-0.14,100.0,AMD,2020-12-04,97.0,PUT,115498062.0
2020-11-23,Trade,BUY_TO_OPEN,AAPL  220121C00200000,Equity Option,Bought 4 AAPL 01/21/22 Call 200.00 @ 1.85,-740.0,4.0,-185.0,-4.0,-0.54,100.0,AAPL,2022-01-21,200.0,CALL,114541627.0
2020-11-23,Trade,SELL_TO_OPEN,AAPL  201218C00117000,Equity Option,Sold 1 AAPL 12/18/20 Call 117.00 @ 2.86,286.0,1.0,286.0,-1.0,-0.152,100.0,AAPL,2020-12-18,117.0,CALL,114480545.0
2020-11-23,Trade,SELL_TO_OPEN,T     201218C00029000,Equity Option,Sold 1 T 12/18/20 Call 29.00 @ 0.35,35.0,1.0,35.0,-1.0,-0.152,100.0,T,2020-12-18,29.0,CALL,114467215.0
2020-11-09,Trade,SELL_TO_CLOSE,CCL   210416C00025000,Equity Option,Sold 20 CCL 04/16/21 Call 25.00 @ 2.10,4200.0,20.0,210.0,0.0,-2.85,100.0,CCL,2021-04-16,25.0,CALL,111899273.0
2020-11-03,Trade,BUY_TO_CLOSE,AAPL  201106C00104000,Equity Option,Bought 10 AAPL 11/06/20 Call 104.00 @ 7.45,-7450.0,10.0,-745.0,0.0,-1.36,100.0,AAPL,2020-11-06,104.0,CALL,110737780.0
2020-11-03,Trade,SELL_TO_CLOSE,AAPL  201106C00103000,Equity Option,Sold 10 AAPL 11/06/20 Call 103.00 @ 8.35,8350.0,10.0,835.0,0.0,-1.57,100.0,AAPL,2020-11-06,103.0,CALL,110737780.0
2020-11-02,Trade,SELL_TO_OPEN,AAPL  201106C00104000,Equity Option,Sold 3 AAPL 11/06/20 Call 104.00 @ 4.70,1410.0,3.0,470.0,-3.0,-0.456,100.0,AAPL,2020-11-06,104.0,CALL,110699838.0
2020-11-02,Trade,BUY_TO_OPEN,AAPL  201106C00103000,Equity Option,Bought 3 AAPL 11/06/20 Call 103.00 @ 5.45,-1635.0,3.0,-545.0,-3.0,-0.41,100.0,AAPL,2020-11-06,103.0,CALL,110699838.0
2020-11-02,Trade,SELL_TO_OPEN,AAPL  201106C00104000,Equity Option,Sold 7 AAPL 11/06/20 Call 104.00 @ 4.70,3290.0,7.0,470.0,-7.0,-1.044,100.0,AAPL,2020-11-06,104.0,CALL,110699838.0
2020-11-02,Trade,BUY_TO_OPEN,AAPL  201106C00103000,Equity Option,Bought 7 AAPL 11/06/20 Call 103.00 @ 5.45,-3815.0,7.0,-545.0,-7.0,-0.95,100.0,AAPL,2020-11-06,103.0,CALL,110699838.0
2020-10-30,Trade,SELL_TO_CLOSE,AAPL  201030C00107000,Equity Option,Sold 6 AAPL 10/30/20 Call 107.00 @ 1.37,822.0,6.0,137.0,0.0,-0.842,100.0,AAPL,2020-10-30,107.0,CALL,110561840.0
2020-10-30,Trade,BUY_TO_CLOSE,AAPL  201030C00108000,Equity Option,Bought 6 AAPL 10/30/20 Call 108.00 @ 0.46,-276.0,6.0,-46.0,0.0,-0.81,100.0,AAPL,2020-10-30,108.0,CALL,110561840.0
2020-10-30,Trade,BUY_TO_CLOSE,AAPL  201030C00108000,Equity Option,Bought 6 AAPL 10/30/20 Call 108.00 @ 0.47,-282.0,6.0,-47.0,0.0,-0.81,100.0,AAPL,2020-10-30,108.0,CALL,110561728.0
2020-10-30,Trade,SELL_TO_CLOSE,AAPL  201030C00107000,Equity Option,Sold 6 AAPL 10/30/20 Call 107.00 @ 1.39,834.0,6.0,139.0,0.0,-0.842,100.0,AAPL,2020-10-30,107.0,CALL,110561728.0
2020-10-30,Trade,BUY_TO_CLOSE,AAPL  201030C00108000,Equity Option,Bought 1 AAPL 10/30/20 Call 108.00 @ 0.47,-47.0,1.0,-47.0,0.0,-0.14,100.0,AAPL,2020-10-30,108.0,CALL,110561728.0
2020-10-30,Trade,SELL_TO_CLOSE,AAPL  201030C00107000,Equity Option,Sold 1 AAPL 10/30/20 Call 107.00 @ 1.39,139.0,1.0,139.0,0.0,-0.152,100.0,AAPL,2020-10-30,107.0,CALL,110561728.0
2020-10-30,Trade,BUY_TO_CLOSE,AAPL  201030C00108000,Equity Option,Bought 17 AAPL 10/30/20 Call 108.00 @ 0.48,-816.0,17.0,-48.0,0.0,-2.31,100.0,AAPL,2020-10-30,108.0,CALL,110561728.0
2020-10-30,Trade,SELL_TO_CLOSE,AAPL  201030C00107000,Equity Option,Sold 17 AAPL 10/30/20 Call 107.00 @ 1.40,2380.0,17.0,140.0,0.0,-2.404,100.0,AAPL,2020-10-30,107.0,CALL,110561728.0
2020-10-30,Trade,BUY_TO_CLOSE,AAPL  201030C00108000,Equity Option,Bought 3 AAPL 10/30/20 Call 108.00 @ 0.46,-138.0,3.0,-46.0,0.0,-0.41,100.0,AAPL,2020-10-30,108.0,CALL,110543508.0
2020-10-30,Trade,SELL_TO_CLOSE,AAPL  201030C00107000,Equity Option,Sold 3 AAPL 10/30/20 Call 107.00 @ 1.37,411.0,3.0,137.0,0.0,-0.426,100.0,AAPL,2020-10-30,107.0,CALL,110543508.0
2020-10-30,Trade,BUY_TO_CLOSE,AAPL  201030C00108000,Equity Option,Bought 1 AAPL 10/30/20 Call 108.00 @ 0.46,-46.0,1.0,-46.0,0.0,-0.14,100.0,AAPL,2020-10-30,108.0,CALL,110543508.0
2020-10-30,Trade,SELL_TO_CLOSE,AAPL  201030C00107000,Equity Option,Sold 1 AAPL 10/30/20 Call 107.00 @ 1.37,137.0,1.0,137.0,0.0,-0.152,100.0,AAPL,2020-10-30,107.0,CALL,110543508.0
2020-10-30,Trade,BUY_TO_CLOSE,AAPL  201030C00108000,Equity Option,Bought 3 AAPL 10/30/20 Call 108.00 @ 0.46,-138.0,3.0,-46.0,0.0,-0.41,100.0,AAPL,2020-10-30,108.0,CALL,110543508.0
2020-10-30,Trade,SELL_TO_CLOSE,AAPL  201030C00107000,Equity Option,Sold 3 AAPL 10/30/20 Call 107.00 @ 1.37,411.0,3.0,137.0,0.0,-0.426,100.0,AAPL,2020-10-30,107.0,CALL,110543508.0
2020-10-30,Trade,BUY_TO_CLOSE,AAPL  201030C00108000,Equity Option,Bought 1 AAPL 10/30/20 Call 108.00 @ 0.46,-46.0,1.0,-46.0,0.0,-0.14,100.0,AAPL,2020-10-30,108.0,CALL,110543508.0
2020-10-30,Trade,SELL_TO_CLOSE,AAPL  201030C00107000,Equity Option,Sold 1 AAPL 10/30/20 Call 107.00 @ 1.37,137.0,1.0,137.0,0.0,-0.152,100.0,AAPL,2020-10-30,107.0,CALL,110543508.0
2020-10-30,Trade,BUY_TO_CLOSE,AAPL  201030C00108000,Equity Option,Bought 2 AAPL 10/30/20 Call 108.00 @ 0.45,-90.0,2.0,-45.0,0.0,-0.27,100.0,AAPL,2020-10-30,108.0,CALL,110543508.0
2020-10-30,Trade,SELL_TO_CLOSE,AAPL  201030C00107000,Equity Option,Sold 2 AAPL 10/30/20 Call 107.00 @ 1.36,272.0,2.0,136.0,0.0,-0.284,100.0,AAPL,2020-10-30,107.0,CALL,110543508.0
2020-10-30,Trade,BUY_TO_CLOSE,AAPL  201030C00108000,Equity Option,Bought 7 AAPL 10/30/20 Call 108.00 @ 0.45,-315.0,7.0,-45.0,0.0,-0.95,100.0,AAPL,2020-10-30,108.0,CALL,110543508.0
2020-10-30,Trade,SELL_TO_CLOSE,AAPL  201030C00107000,Equity Option,Sold 7 AAPL 10/30/20 Call 107.00 @ 1.36,952.0,7.0,136.0,0.0,-0.994,100.0,AAPL,2020-10-30,107.0,CALL,110543508.0
2020-10-30,Trade,BUY_TO_CLOSE,AAPL  201030C00108000,Equity Option,Bought 8 AAPL 10/30/20 Call 108.00 @ 0.45,-360.0,8.0,-45.0,0.0,-1.09,100.0,AAPL,2020-10-30,108.0,CALL,110543508.0
2020-10-30,Trade,SELL_TO_CLOSE,AAPL  201030C00107000,Equity Option,Sold 8 AAPL 10/30/20 Call 107.00 @ 1.36,1088.0,8.0,136.0,0.0,-1.136,100.0,AAPL,2020-10-30,107.0,CALL,110543508.0
2020-10-30,Trade,BUY_TO_CLOSE,AAPL  201030C00108000,Equity Option,Bought 5 AAPL 10/30/20 Call 108.00 @ 0.46,-230.0,5.0,-46.0,0.0,-0.68,100.0,AAPL,2020-10-30,108.0,CALL,110543508.0
2020-10-30,Trade,SELL_TO_CLOSE,AAPL  201030C00107000,Equity Option,Sold 5 AAPL 10/30/20 Call 107.00 @ 1.37,685.0,5.0,137.0,0.0,-0.71,100.0,AAPL,2020-10-30,107.0,CALL,110543508.0
2020-10-30,Trade,BUY_TO_CLOSE,AAPL  201030C00110000,Equity Option,Bought 1 AAPL 10/30/20 Call 110.00 @ 0.02,-2.0,1.0,-2.0,0.0,-0.14,100.0,AAPL,2020-10-30,110.0,CALL,110537171.0
2020-10-30,Trade,SELL_TO_CLOSE,AAPL  201030C00100000,Equity Option,Sold 1 AAPL 10/30/20 Call 100.00 @ 8.52,852.0,1.0,852.0,0.0,-0.162,100.0,AAPL,2020-10-30,100.0,CALL,110537171.0
2020-10-29,Trade,SELL_TO_OPEN,TWTR  201030C00044500,Equity Option,Sold 20 TWTR 10/30/20 Call 44.50 @ 8.75,17500.0,20.0,875.0,-10.0,-3.14,100.0,TWTR,2020-10-30,44.5,CALL,110263960.0
2020-10-29,Trade,BUY_TO_OPEN,TWTR  201030C00044000,Equity Option,Bought 20 TWTR 10/30/20 Call 44.00 @ 9.16,-18320.0,20.0,-916.0,-10.0,-2.71,100.0,TWTR,2020-10-30,44.0,CALL,110263960.0
2020-10-28,Trade,SELL_TO_OPEN,T     201120C00029000,Equity Option,Sold 1 T 11/20/20 Call 29.00 @ 0.11,11.0,1.0,11.0,-1.0,-0.152,100.0,T,2020-11-20,29.0,CALL,109945387.0
2020-10-28,Trade,BUY_TO_OPEN,CCL   210416C00025000,Equity Option,Bought 9 CCL 04/16/21 Call 25.00 @ 0.70,-630.0,9.0,-70.0,-9.0,-1.22,100.0,CCL,2021-04-16,25.0,CALL,109934466.0
2020-10-28,Trade,BUY_TO_OPEN,CCL   210416C00025000,Equity Option,Bought 1 CCL 04/16/21 Call 25.00 @ 0.70,-70.0,1.0,-70.0,-1.0,-0.14,100.0,CCL,2021-04-16,25.0,CALL,109934466.0
2020-10-23,Trade,SELL_TO_OPEN,AAPL  201030C00108000,Equity Option,Sold 60 AAPL 10/30/20 Call 108.00 @ 7.84,47040.0,60.0,784.0,-10.0,-9.3,100.0,AAPL,2020-10-30,108.0,CALL,109288475.0
2020-10-23,Trade,BUY_TO_OPEN,AAPL  201030C00107000,Equity Option,Bought 60 AAPL 10/30/20 Call 107.00 @ 8.65,-51900.0,60.0,-865.0,-10.0,-8.14,100.0,AAPL,2020-10-30,107.0,CALL,109288475.0
2020-10-16,Trade,BUY_TO_CLOSE,DIS   201016C00130000,Equity Option,Bought 1 DIS 10/16/20 Call 130.00 @ 0.01,-1.0,1.0,-1.0,0.0,-0.14,100.0,DIS,2020-10-16,130.0,CALL,108134370.0
2020-10-16,Trade,SELL_TO_CLOSE,DIS   201016C00125000,Equity Option,Sold 1 DIS 10/16/20 Call 125.00 @ 1.86,186.0,1.0,186.0,0.0,-0.152,100.0,DIS,2020-10-16,125.0,CALL,108134370.0
2020-10-12,Trade,BUY_TO_CLOSE,T     201016C00029500,Equity Option,Bought 1 T 10/16/20 Call 29.50 @ 0.01,-1.0,1.0,-1.0,0.0,-0.14,100.0,T,2020-10-16,29.5,CALL,104825429.0
2020-10-12,Trade,BUY_TO_CLOSE,NVDA  201016C00520000,Equity Option,Bought 1 NVDA 10/16/20 Call 520.00 @ 40.18,-4018.0,1.0,-4018.0,0.0,-0.14,100.0,NVDA,2020-10-16,520.0,CALL,106962728.0
2020-10-12,Trade,SELL_TO_CLOSE,NVDA  201016C00510000,Equity Option,Sold 1 NVDA 10/16/20 Call 510.00 @ 49.83,4983.0,1.0,4983.0,0.0,-0.262,100.0,NVDA,2020-10-16,510.0,CALL,106962728.0
2020-10-09,Trade,SELL_TO_OPEN,GME   201016C00013000,Equity Option,Sold 2 GME 10/16/20 Call 13.00 @ 0.77,154.0,2.0,77.0,-2.0,-0.284,100.0,GME,2020-10-16,13.0,CALL,106985794.0
2020-10-09,Trade,SELL_TO_OPEN,GME   201016C00011000,Equity Option,Sold 2 GME 10/16/20 Call 11.00 @ 1.62,324.0,2.0,162.0,-2.0,-0.284,100.0,GME,2020-10-16,11.0,CALL,106985563.0
2020-10-09,Trade,BUY_TO_CLOSE,UPS   201016C00160000,Equity Option,Bought 2 UPS 10/16/20 Call 160.00 @ 15.35,-3070.0,2.0,-1535.0,0.0,-0.27,100.0,UPS,2020-10-16,160.0,CALL,106961264.0
2020-10-09,Trade,SELL_TO_CLOSE,UPS   201016C00155000,Equity Option,Sold 2 UPS 10/16/20 Call 155.00 @ 20.30,4060.0,2.0,2030.0,0.0,-0.364,100.0,UPS,2020-10-16,155.0,CALL,106961264.0
2020-10-09,Trade,BUY_TO_CLOSE,UPS   201016C00160000,Equity Option,Bought 3 UPS 10/16/20 Call 160.00 @ 15.35,-4605.0,3.0,-1535.0,0.0,-0.41,100.0,UPS,2020-10-16,160.0,CALL,106961264.0
2020-10-09,Trade,SELL_TO_CLOSE,UPS   201016C00155000,Equity Option,Sold 3 UPS 10/16/20 Call 155.00 @ 20.30,6090.0,3.0,2030.0,0.0,-0.556,100.0,UPS,2020-10-16,155.0,CALL,106961264.0
2020-10-08,Trade,SELL_TO_OPEN,NVDA  201016C00520000,Equity Option,Sold 1 NVDA 10/16/20 Call 520.00 @ 34.62,3462.0,1.0,3462.0,-1.0,-0.222,100.0,NVDA,2020-10-16,520.0,CALL,106522909.0
2020-10-08,Trade,BUY_TO_OPEN,NVDA  201016C00510000,Equity Option,Bought 1 NVDA 10/16/20 Call 510.00 @ 43.12,-4312.0,1.0,-4312.0,-1.0,-0.14,100.0,NVDA,2020-10-16,510.0,CALL,106522909.0
2020-10-07,Trade,SELL_TO_CLOSE,NVDA  201016C00495000,Equity Option,Sold 1 NVDA 10/16/20 Call 495.00 @ 62.00,6200.0,1.0,6200.0,0.0,-0.282,100.0,NVDA,2020-10-16,495.0,CALL,104824953.0
2020-10-07,Trade,BUY_TO_CLOSE,NVDA  201016C00500000,Equity Option,Bought 1 NVDA 10/16/20 Call 500.00 @ 57.10,-5710.0,1.0,-5710.0,0.0,-0.14,100.0,NVDA,2020-10-16,500.0,CALL,104824953.0
2020-10-05,Trade,BUY_TO_CLOSE,TGT   201016C00150000,Equity Option,Bought 1 TGT 10/16/20 Call 150.00 @ 11.30,-1130.0,1.0,-1130.0,0.0,-0.14,100.0,TGT,2020-10-16,150.0,CALL,104824687.0
2020-10-05,Trade,SELL_TO_CLOSE,TGT   201016C00145000,Equity Option,Sold 1 TGT 10/16/20 Call 145.00 @ 16.05,1605.0,1.0,1605.0,0.0,-0.182,100.0,TGT,2020-10-16,145.0,CALL,104824687.0
2020-09-29,Trade,SELL_TO_CLOSE,AAPL  201030C00105000,Equity Option,Sold 1 AAPL 10/30/20 Call 105.00 @ 11.66,1166.0,1.0,1166.0,0.0,-0.172,100.0,AAPL,2020-10-30,105.0,CALL,105006716.0
2020-09-29,Trade,BUY_TO_OPEN,AAPL  201030C00100000,Equity Option,Bought 1 AAPL 10/30/20 Call 100.00 @ 15.51,-1551.0,1.0,-1551.0,-1.0,-0.14,100.0,AAPL,2020-10-30,100.0,CALL,105006716.0
2020-09-29,Trade,SELL_TO_OPEN,AAPL  201030C00110000,Equity Option,Sold 1 AAPL 10/30/20 Call 110.00 @ 8.53,853.0,1.0,853.0,-1.0,-0.162,100.0,AAPL,2020-10-30,110.0,CALL,105007941.0
2020-09-29,Trade,BUY_TO_OPEN,AAPL  201030C00105000,Equity Option,Bought 1 AAPL 10/30/20 Call 105.00 @ 11.82,-1182.0,1.0,-1182.0,-1.0,-0.14,100.0,AAPL,2020-10-30,105.0,CALL,105007941.0
2020-09-29,Trade,SELL_TO_OPEN,UPS   201016C00160000,Equity Option,Sold 5 UPS 10/16/20 Call 160.00 @ 10.10,5050.0,5.0,1010.0,-5.0,-0.81,100.0,UPS,2020-10-16,160.0,CALL,104950209.0
2020-09-29,Trade,BUY_TO_OPEN,UPS   201016C00155000,Equity Option,Bought 5 UPS 10/16/20 Call 155.00 @ 14.35,-7175.0,5.0,-1435.0,-5.0,-0.68,100.0,UPS,2020-10-16,155.0,CALL,104950209.0
2020-09-28,Trade,SELL_TO_OPEN,T     201016C00029500,Equity Option,Sold 1 T 10/16/20 Call 29.50 @ 0.09,9.0,1.0,9.0,-1.0,-0.152,100.0,T,2020-10-16,29.5,CALL,104825236.0
2020-09-25,Trade,SELL_TO_CLOSE,NVDA  200925C00512500,Equity Option,Sold 1 NVDA 09/25/20 Call 512.50 @ 1.42,142.0,1.0,142.0,0.0,-0.152,100.0,NVDA,2020-09-25,512.5,CALL,104627640.0
2020-09-25,Trade,BUY_TO_CLOSE,NVDA  200925C00510000,Equity Option,Bought 1 NVDA 09/25/20 Call 510.00 @ 3.72,-372.0,1.0,-372.0,0.0,-0.14,100.0,NVDA,2020-09-25,510.0,CALL,104627640.0
2020-09-25,Trade,SELL_TO_CLOSE,TSLA  200925C00400000,Equity Option,Sold 1 TSLA 09/25/20 Call 400.00 @ 5.55,555.0,1.0,555.0,0.0,-0.162,100.0,TSLA,2020-09-25,400.0,CALL,104627437.0
2020-09-25,Trade,BUY_TO_CLOSE,TSLA  200925C00399000,Equity Option,Bought 1 TSLA 09/25/20 Call 399.00 @ 6.60,-660.0,1.0,-660.0,0.0,-0.14,100.0,TSLA,2020-09-25,399.0,CALL,104627437.0
2020-09-25,Trade,SELL_TO_CLOSE,UPS   201016C00180000,Equity Option,Sold 3 UPS 10/16/20 Call 180.00 @ 0.96,288.0,3.0,96.0,0.0,-0.426,100.0,UPS,2020-10-16,180.0,CALL,104069924.0
2020-09-25,Trade,BUY_TO_CLOSE,UPS   201016C00185000,Equity Option,Bought 3 UPS 10/16/20 Call 185.00 @ 0.57,-171.0,3.0,-57.0,0.0,-0.41,100.0,UPS,2020-10-16,185.0,CALL,104069924.0
2020-09-25,Trade,SELL_TO_CLOSE,UPS   201016C00180000,Equity Option,Sold 1 UPS 10/16/20 Call 180.00 @ 0.96,96.0,1.0,96.0,0.0,-0.152,100.0,UPS,2020-10-16,180.0,CALL,104069924.0
2020-09-25,Trade,BUY_TO_CLOSE,UPS   201016C00185000,Equity Option,Bought 1 UPS 10/16/20 Call 185.00 @ 0.57,-57.0,1.0,-57.0,0.0,-0.14,100.0,UPS,2020-10-16,185.0,CALL,104069924.0
2020-09-23,Trade,SELL_TO_OPEN,TSLA  200925C00399000,Equity Option,Sold 1 TSLA 09/25/20 Call 399.00 @ 5.14,514.0,1.0,514.0,-1.0,-0.162,100.0,TSLA,2020-09-25,399.0,CALL,104146603.0
2020-09-23,Trade,BUY_TO_OPEN,TSLA  200925C00400000,Equity Option,Bought 1 TSLA 09/25/20 Call 400.00 @ 4.89,-489.0,1.0,-489.0,-1.0,-0.14,100.0,TSLA,2020-09-25,400.0,CALL,104146603.0
2020-09-22,Trade,SELL_TO_OPEN,TGT   201016C00150000,Equity Option,Sold 1 TGT 10/16/20 Call 150.00 @ 6.10,610.0,1.0,610.0,-1.0,-0.162,100.0,TGT,2020-10-16,150.0,CALL,101203768.0
2020-09-21,Trade,SELL_TO_OPEN,AAL   200925C00013000,Equity Option,Sold 2 AAL 09/25/20 Call 13.00 @ 0.23,46.0,2.0,23.0,-2.0,-0.284,100.0,AAL,2020-09-25,13.0,CALL,103578612.0
2020-09-21,Trade,BUY_TO_OPEN,AAL   200925C00013500,Equity Option,Bought 2 AAL 09/25/20 Call 13.50 @ 0.14,-28.0,2.0,-14.0,-2.0,-0.27,100.0,AAL,2020-09-25,13.5,CALL,103578612.0
2020-09-21,Trade,SELL_TO_OPEN,VZ    200925C00060000,Equity Option,Sold 1 VZ 09/25/20 Call 60.00 @ 0.22,22.0,1.0,22.0,-1.0,-0.152,100.0,VZ,2020-09-25,60.0,CALL,103578914.0
2020-09-21,Trade,BUY_TO_OPEN,VZ    200925C00061000,Equity Option,Bought 1 VZ 09/25/20 Call 61.00 @ 0.07,-7.0,1.0,-7.0,-1.0,-0.14,100.0,VZ,2020-09-25,61.0,CALL,103578914.0
2020-09-21,Trade,SELL_TO_OPEN,NVDA  200925C00510000,Equity Option,Sold 1 NVDA 09/25/20 Call 510.00 @ 5.72,572.0,1.0,572.0,-1.0,-0.162,100.0,NVDA,2020-09-25,510.0,CALL,103577736.0
2020-09-21,Trade,BUY_TO_OPEN,NVDA  200925C00512500,Equity Option,Bought 1 NVDA 09/25/20 Call 512.50 @ 5.09,-509.0,1.0,-509.0,-1.0,-0.14,100.0,NVDA,2020-09-25,512.5,CALL,103577736.0
2020-09-21,Trade,SELL_TO_OPEN,AAPL  200925C00112500,Equity Option,Sold 1 AAPL 09/25/20 Call 112.50 @ 0.81,81.0,1.0,81.0,-1.0,-0.152,100.0,AAPL,2020-09-25,112.5,CALL,103577060.0
2020-09-21,Trade,BUY_TO_OPEN,AAPL  200925C00113750,Equity Option,Bought 1 AAPL 09/25/20 Call 113.75 @ 0.60,-60.0,1.0,-60.0,-1.0,-0.14,100.0,AAPL,2020-09-25,113.75,CALL,103577060.0
2020-09-21,Trade,BUY_TO_OPEN,TMUS  200925C00113000,Equity Option,Bought 1 TMUS 09/25/20 Call 113.00 @ 0.51,-51.0,1.0,-51.0,-1.0,-0.14,100.0,TMUS,2020-09-25,113.0,CALL,103579454.0
2020-09-21,Trade,SELL_TO_OPEN,TMUS  200925C00112000,Equity Option,Sold 1 TMUS 09/25/20 Call 112.00 @ 0.72,72.0,1.0,72.0,-1.0,-0.152,100.0,TMUS,2020-09-25,112.0,CALL,103579454.0
2020-09-21,Trade,BUY_TO_OPEN,SFIX  200925C00033000,Equity Option,Bought 1 SFIX 09/25/20 Call 33.00 @ 0.90,-90.0,1.0,-90.0,-1.0,-0.14,100.0,SFIX,2020-09-25,33.0,CALL,103578061.0
2020-09-21,Trade,SELL_TO_OPEN,SFIX  200925C00032000,Equity Option,Sold 1 SFIX 09/25/20 Call 32.00 @ 1.15,115.0,1.0,115.0,-1.0,-0.152,100.0,SFIX,2020-09-25,32.0,CALL,103578061.0
2020-09-21,Trade,BUY_TO_OPEN,AMD   200925C00082500,Equity Option,Bought 1 AMD 09/25/20 Call 82.50 @ 0.48,-48.0,1.0,-48.0,-1.0,-0.14,100.0,AMD,2020-09-25,82.5,CALL,103577406.0
2020-09-21,Trade,SELL_TO_OPEN,AMD   200925C00081500,Equity Option,Sold 1 AMD 09/25/20 Call 81.50 @ 0.64,64.0,1.0,64.0,-1.0,-0.152,100.0,AMD,2020-09-25,81.5,CALL,103577406.0
2020-09-21,Trade,SELL_TO_OPEN,T     200925C00029000,Equity Option,Sold 1 T 09/25/20 Call 29.00 @ 0.08,8.0,1.0,8.0,-1.0,-0.152,100.0,T,2020-09-25,29.0,CALL,103569021.0
2020-09-18,Trade,BUY_TO_OPEN,CCL   210416C00025000,Equity Option,Bought 10 CCL 04/16/21 Call 25.00 @ 1.44,-1440.0,10.0,-144.0,-10.0,-1.36,100.0,CCL,2021-04-16,25.0,CALL,103312096.0
2020-09-15,Trade,BUY_TO_CLOSE,TSM   200918C00085000,Equity Option,Bought 2 TSM 09/18/20 Call 85.00 @ 2.13,-426.0,2.0,-213.0,0.0,-0.27,100.0,TSM,2020-09-18,85.0,CALL,102537685.0
2020-09-15,Trade,SELL_TO_CLOSE,TSM   200918C00081000,Equity Option,Sold 2 TSM 09/18/20 Call 81.00 @ 5.48,1096.0,2.0,548.0,0.0,-0.304,100.0,TSM,2020-09-18,81.0,CALL,102537685.0
2020-09-14,Trade,SELL_TO_OPEN,T     200918C00029500,Equity Option,Sold 1 T 09/18/20 Call 29.50 @ 0.11,11.0,1.0,11.0,-1.0,-0.152,100.0,T,2020-09-18,29.5,CALL,102394809.0
2020-09-14,Trade,BUY_TO_OPEN,AAPL  220121C00200000,Equity Option,Bought 2 AAPL 01/21/22 Call 200.00 @ 4.05,-810.0,2.0,-405.0,-2.0,-0.27,100.0,AAPL,2022-01-21,200.0,CALL,102369850.0
2020-09-09,Trade,SELL_TO_OPEN,COST  200918C00355000,Equity Option,Sold 5 COST 09/18/20 Call 355.00 @ 3.22,1610.0,5.0,322.0,-5.0,-0.73,100.0,COST,2020-09-18,355.0,CALL,101616850.0
2020-09-09,Trade,SELL_TO_CLOSE,COST  200911C00350000,Equity Option,Sold 5 COST 09/11/20 Call 350.00 @ 2.08,1040.0,5.0,208.0,0.0,-0.72,100.0,COST,2020-09-11,350.0,CALL,101616850.0
2020-09-09,Trade,BUY_TO_CLOSE,COST  200911C00355000,Equity Option,Bought 5 COST 09/11/20 Call 355.00 @ 0.77,-385.0,5.0,-77.0,0.0,-0.68,100.0,COST,2020-09-11,355.0,CALL,101616850.0
2020-09-09,Trade,BUY_TO_OPEN,COST  200918C00350000,Equity Option,Bought 5 COST 09/18/20 Call 350.00 @ 5.18,-2590.0,5.0,-518.0,-5.0,-0.68,100.0,COST,2020-09-18,350.0,CALL,101616850.0
2020-09-08,Trade,SELL_TO_OPEN,DIS   201016C00130000,Equity Option,Sold 1 DIS 10/16/20 Call 130.00 @ 10.40,1040.0,1.0,1040.0,-1.0,-0.172,100.0,DIS,2020-10-16,130.0,CALL,101204120.0
2020-09-08,Trade,BUY_TO_OPEN,TGT   201016C00145000,Equity Option,Bought 1 TGT 10/16/20 Call 145.00 @ 6.10,-610.0,1.0,-610.0,-1.0,-0.14,100.0,TGT,2020-10-16,145.0,CALL,101198650.0
2020-09-08,Trade,BUY_TO_OPEN,DIS   201016C00125000,Equity Option,Bought 1 DIS 10/16/20 Call 125.00 @ 10.39,-1039.0,1.0,-1039.0,-1.0,-0.14,100.0,DIS,2020-10-16,125.0,CALL,101185458.0
2020-09-02,Trade,SELL_TO_OPEN,DOCU  200904C00270000,Equity Option,Sold 1 DOCU 09/04/20 Call 270.00 @ 23.12,2312.0,1.0,2312.0,-1.0,-0.202,100.0,DOCU,2020-09-04,270.0,CALL,100481676.0
2020-09-02,Trade,BUY_TO_OPEN,DOCU  200904C00260000,Equity Option,Bought 1 DOCU 09/04/20 Call 260.00 @ 26.72,-2672.0,1.0,-2672.0,-1.0,-0.14,100.0,DOCU,2020-09-04,260.0,CALL,100481676.0
2020-09-02,Trade,SELL_TO_OPEN,RKT   200918C00037000,Equity Option,Sold 4 RKT 09/18/20 Call 37.00 @ 3.95,1580.0,4.0,395.0,-4.0,-0.588,100.0,RKT,2020-09-18,37.0,CALL,100466254.0
2020-09-02,Trade,BUY_TO_OPEN,RKT   200918C00035000,Equity Option,Bought 4 RKT 09/18/20 Call 35.00 @ 4.65,-1860.0,4.0,-465.0,-4.0,-0.54,100.0,RKT,2020-09-18,35.0,CALL,100466254.0
2020-09-02,Trade,SELL_TO_OPEN,RKT   200918C00037000,Equity Option,Sold 1 RKT 09/18/20 Call 37.00 @ 3.95,395.0,1.0,395.0,-1.0,-0.152,100.0,RKT,2020-09-18,37.0,CALL,100466254.0
2020-09-02,Trade,BUY_TO_OPEN,RKT   200918C00035000,Equity Option,Bought 1 RKT 09/18/20 Call 35.00 @ 4.65,-465.0,1.0,-465.0,-1.0,-0.14,100.0,RKT,2020-09-18,35.0,CALL,100466254.0
2020-09-02,Trade,SELL_TO_OPEN,ADBE  200904C00532500,Equity Option,Sold 3 ADBE 09/04/20 Call 532.50 @ 5.40,1620.0,3.0,540.0,-3.0,-0.456,100.0,ADBE,2020-09-04,532.5,CALL,100284699.0
2020-09-02,Trade,BUY_TO_OPEN,ADBE  200904C00527500,Equity Option,Bought 3 ADBE 09/04/20 Call 527.50 @ 7.21,-2163.0,3.0,-721.0,-3.0,-0.41,100.0,ADBE,2020-09-04,527.5,CALL,100284699.0
2020-09-01,Trade,SELL_TO_OPEN,COST  200911C00355000,Equity Option,Sold 5 COST 09/11/20 Call 355.00 @ 2.13,1065.0,5.0,213.0,-5.0,-0.72,100.0,COST,2020-09-11,355.0,CALL,99940575.0
2020-09-01,Trade,BUY_TO_OPEN,COST  200911C00350000,Equity Option,Bought 5 COST 09/11/20 Call 350.00 @ 3.73,-1865.0,5.0,-373.0,-5.0,-0.68,100.0,COST,2020-09-11,350.0,CALL,99940575.0
2020-08-31,Trade,SELL_TO_OPEN,MNST  200918C00085000,Equity Option,Sold 2 MNST 09/18/20 Call 85.00 @ 1.27,254.0,2.0,127.0,-2.0,-0.284,100.0,MNST,2020-09-18,85.0,CALL,99657650.0
2020-08-31,Trade,BUY_TO_OPEN,MNST  200918C00082000,Equity Option,Bought 2 MNST 09/18/20 Call 82.00 @ 2.82,-564.0,2.0,-282.0,-2.0,-0.27,100.0,MNST,2020-09-18,82.0,CALL,99657650.0
2020-08-31,Trade,SELL_TO_OPEN,YETI  200918C00055000,Equity Option,Sold 4 YETI 09/18/20 Call 55.00 @ 1.05,420.0,4.0,105.0,-4.0,-0.558,100.0,YETI,2020-09-18,55.0,CALL,99657347.0
2020-08-31,Trade,BUY_TO_OPEN,YETI  200918C00052500,Equity Option,Bought 4 YETI 09/18/20 Call 52.50 @ 1.84,-736.0,4.0,-184.0,-4.0,-0.54,100.0,YETI,2020-09-18,52.5,CALL,99657347.0
2020-08-31,Trade,SELL_TO_OPEN,MS    200918C00055000,Equity Option,Sold 4 MS 09/18/20 Call 55.00 @ 0.70,280.0,4.0,70.0,-4.0,-0.558,100.0,MS,2020-09-18,55.0,CALL,99657455.0
2020-08-31,Trade,BUY_TO_OPEN,MS    200918C00053500,Equity Option,Bought 4 MS 09/18/20 Call 53.50 @ 1.21,-484.0,4.0,-121.0,-4.0,-0.54,100.0,MS,2020-09-18,53.5,CALL,99657455.0
2020-08-31,Trade,SELL_TO_OPEN,MS    200918C00055000,Equity Option,Sold 1 MS 09/18/20 Call 55.00 @ 0.70,70.0,1.0,70.0,-1.0,-0.152,100.0,MS,2020-09-18,55.0,CALL,99657455.0
2020-08-31,Trade,BUY_TO_OPEN,MS    200918C00053500,Equity Option,Bought 1 MS 09/18/20 Call 53.50 @ 1.21,-121.0,1.0,-121.0,-1.0,-0.14,100.0,MS,2020-09-18,53.5,CALL,99657455.0
2020-08-31,Trade,BUY_TO_OPEN,TTWO  200918C00175000,Equity Option,Bought 1 TTWO 09/18/20 Call 175.00 @ 3.81,-381.0,1.0,-381.0,-1.0,-0.14,100.0,TTWO,2020-09-18,175.0,CALL,99658118.0
2020-08-31,Trade,SELL_TO_OPEN,TTWO  200918C00185000,Equity Option,Sold 1 TTWO 09/18/20 Call 185.00 @ 1.30,130.0,1.0,130.0,-1.0,-0.152,100.0,TTWO,2020-09-18,185.0,CALL,99658118.0
2020-08-31,Trade,BUY_TO_OPEN,UPS   200918C00165000,Equity Option,Bought 1 UPS 09/18/20 Call 165.00 @ 2.98,-298.0,1.0,-298.0,-1.0,-0.14,100.0,UPS,2020-09-18,165.0,CALL,99658200.0
2020-08-31,Trade,SELL_TO_OPEN,UPS   200918C00170000,Equity Option,Sold 1 UPS 09/18/20 Call 170.00 @ 1.53,153.0,1.0,153.0,-1.0,-0.152,100.0,UPS,2020-09-18,170.0,CALL,99658200.0
2020-08-31,Trade,BUY_TO_OPEN,UPS   200918C00165000,Equity Option,Bought 1 UPS 09/18/20 Call 165.00 @ 2.98,-298.0,1.0,-298.0,-1.0,-0.14,100.0,UPS,2020-09-18,165.0,CALL,99658200.0
2020-08-31,Trade,SELL_TO_OPEN,UPS   200918C00170000,Equity Option,Sold 1 UPS 09/18/20 Call 170.00 @ 1.53,153.0,1.0,153.0,-1.0,-0.152,100.0,UPS,2020-09-18,170.0,CALL,99658200.0
2020-08-31,Trade,SELL_TO_OPEN,TSM   200918C00085000,Equity Option,Sold 2 TSM 09/18/20 Call 85.00 @ 0.74,148.0,2.0,74.0,-2.0,-0.284,100.0,TSM,2020-09-18,85.0,CALL,99657002.0
2020-08-31,Trade,BUY_TO_OPEN,TSM   200918C00081000,Equity Option,Bought 2 TSM 09/18/20 Call 81.00 @ 1.88,-376.0,2.0,-188.0,-2.0,-0.27,100.0,TSM,2020-09-18,81.0,CALL,99657002.0
2020-08-31,Trade,SELL_TO_OPEN,AMD   200918C00090000,Equity Option,Sold 3 AMD 09/18/20 Call 90.00 @ 2.43,729.0,3.0,243.0,-3.0,-0.436,100.0,AMD,2020-09-18,90.0,CALL,99657502.0
2020-08-31,Trade,BUY_TO_OPEN,AMD   200918C00086000,Equity Option,Bought 3 AMD 09/18/20 Call 86.00 @ 3.91,-1173.0,3.0,-391.0,-3.0,-0.41,100.0,AMD,2020-09-18,86.0,CALL,99657502.0
2020-08-31,Trade,SELL_TO_OPEN,TMUS  200918C00120000,Equity Option,Sold 2 TMUS 09/18/20 Call 120.00 @ 0.94,188.0,2.0,94.0,-2.0,-0.284,100.0,TMUS,2020-09-18,120.0,CALL,99657528.0
2020-08-31,Trade,BUY_TO_OPEN,TMUS  200918C00117000,Equity Option,Bought 2 TMUS 09/18/20 Call 117.00 @ 1.95,-390.0,2.0,-195.0,-2.0,-0.27,100.0,TMUS,2020-09-18,117.0,CALL,99657528.0
2020-08-28,Trade,SELL_TO_CLOSE,ADSK  200828C00245000,Equity Option,Sold 1 ADSK 08/28/20 Call 245.00 @ 2.10,210.0,1.0,210.0,0.0,-0.152,100.0,ADSK,2020-08-28,245.0,CALL,99643037.0
2020-08-28,Trade,BUY_TO_CLOSE,ADSK  200828C00247500,Equity Option,Bought 1 ADSK 08/28/20 Call 247.50 @ 0.10,-10.0,1.0,-10.0,0.0,-0.14,100.0,ADSK,2020-08-28,247.5,CALL,99643037.0
2020-08-28,Trade,SELL_TO_CLOSE,DG    200828C00197500,Equity Option,Sold 1 DG 08/28/20 Call 197.50 @ 3.30,330.0,1.0,330.0,0.0,-0.152,100.0,DG,2020-08-28,197.5,CALL,99608446.0
2020-08-28,Trade,BUY_TO_CLOSE,DG    200828C00200000,Equity Option,Bought 1 DG 08/28/20 Call 200.00 @ 0.85,-85.0,1.0,-85.0,0.0,-0.14,100.0,DG,2020-08-28,200.0,CALL,99608446.0
2020-08-28,Trade,SELL_TO_CLOSE,DG    200828C00197500,Equity Option,Sold 1 DG 08/28/20 Call 197.50 @ 3.23,323.0,1.0,323.0,0.0,-0.152,100.0,DG,2020-08-28,197.5,CALL,99608446.0
2020-08-28,Trade,BUY_TO_CLOSE,DG    200828C00200000,Equity Option,Bought 1 DG 08/28/20 Call 200.00 @ 0.78,-78.0,1.0,-78.0,0.0,-0.14,100.0,DG,2020-08-28,200.0,CALL,99608446.0
2020-08-24,Trade,SELL_TO_OPEN,CRM   200828C00212500,Equity Option,Sold 1 CRM 08/28/20 Call 212.50 @ 3.81,381.0,1.0,381.0,-1.0,-0.152,100.0,CRM,2020-08-28,212.5,CALL,98334483.0
2020-08-24,Trade,BUY_TO_OPEN,CRM   200828C00207500,Equity Option,Bought 1 CRM 08/28/20 Call 207.50 @ 5.94,-594.0,1.0,-594.0,-1.0,-0.14,100.0,CRM,2020-08-28,207.5,CALL,98334483.0
2020-08-24,Trade,SELL_TO_OPEN,WDAY  200828C00195000,Equity Option,Sold 1 WDAY 08/28/20 Call 195.00 @ 5.77,577.0,1.0,577.0,-1.0,-0.162,100.0,WDAY,2020-08-28,195.0,CALL,98334723.0
2020-08-24,Trade,BUY_TO_OPEN,WDAY  200828C00192500,Equity Option,Bought 1 WDAY 08/28/20 Call 192.50 @ 6.97,-697.0,1.0,-697.0,-1.0,-0.14,100.0,WDAY,2020-08-28,192.5,CALL,98334723.0
2020-08-24,Trade,SELL_TO_OPEN,DG    200828C00200000,Equity Option,Sold 2 DG 08/28/20 Call 200.00 @ 5.88,1176.0,2.0,588.0,-2.0,-0.304,100.0,DG,2020-08-28,200.0,CALL,98334383.0
2020-08-24,Trade,BUY_TO_OPEN,DG    200828C00197500,Equity Option,Bought 2 DG 08/28/20 Call 197.50 @ 7.23,-1446.0,2.0,-723.0,-2.0,-0.27,100.0,DG,2020-08-28,197.5,CALL,98334383.0
2020-08-24,Trade,SELL_TO_OPEN,ADSK  200828C00247500,Equity Option,Sold 1 ADSK 08/28/20 Call 247.50 @ 10.74,1074.0,1.0,1074.0,-1.0,-0.172,100.0,ADSK,2020-08-28,247.5,CALL,98334489.0
2020-08-24,Trade,BUY_TO_OPEN,ADSK  200828C00245000,Equity Option,Bought 1 ADSK 08/28/20 Call 245.00 @ 12.30,-1230.0,1.0,-1230.0,-1.0,-0.14,100.0,ADSK,2020-08-28,245.0,CALL,98334489.0
2020-08-20,Trade,SELL_TO_CLOSE,UBER  200828P00025000,Equity Option,Sold 4 UBER 08/28/20 Put 25.00 @ 0.05,20.0,4.0,5.0,0.0,-0.558,100.0,UBER,2020-08-28,25.0,PUT,98018282.0
2020-08-20,Trade,SELL_TO_CLOSE,UBER  200828P00025000,Equity Option,Sold 2 UBER 08/28/20 Put 25.00 @ 0.05,10.0,2.0,5.0,0.0,-0.284,100.0,UBER,2020-08-28,25.0,PUT,98018282.0
2020-08-20,Trade,BUY_TO_OPEN,UBER  200828P00025000,Equity Option,Bought 1 UBER 08/28/20 Put 25.00 @ 0.12,-12.0,1.0,-12.0,0.0,-0.14,100.0,UBER,2020-08-28,25.0,PUT,97994287.0
2020-08-20,Trade,BUY_TO_OPEN,UBER  200828P00025000,Equity Option,Bought 5 UBER 08/28/20 Put 25.00 @ 0.12,-60.0,5.0,-12.0,0.0,-0.68,100.0,UBER,2020-08-28,25.0,PUT,97994287.0
2020-08-19,Trade,SELL_TO_OPEN,NVDA  201016C00500000,Equity Option,Sold 1 NVDA 10/16/20 Call 500.00 @ 34.44,3444.0,1.0,3444.0,-1.0,-0.222,100.0,NVDA,2020-10-16,500.0,CALL,97704129.0
2020-08-19,Trade,BUY_TO_OPEN,NVDA  201016C00495000,Equity Option,Bought 1 NVDA 10/16/20 Call 495.00 @ 36.61,-3661.0,1.0,-3661.0,-1.0,-0.14,100.0,NVDA,2020-10-16,495.0,CALL,97704129.0
2020-08-18,Trade,SELL_TO_OPEN,UPS   201016C00185000,Equity Option,Sold 4 UPS 10/16/20 Call 185.00 @ 1.02,408.0,4.0,102.0,-4.0,-0.558,100.0,UPS,2020-10-16,185.0,CALL,97512800.0
2020-08-18,Trade,BUY_TO_OPEN,UPS   201016C00180000,Equity Option,Bought 4 UPS 10/16/20 Call 180.00 @ 1.44,-576.0,4.0,-144.0,-4.0,-0.54,100.0,UPS,2020-10-16,180.0,CALL,97512800.0
